{"body": " (CNN)Here's a look at the life of Carly S. Fiorina, former Hewlett-Packard CEO and 2016 presidential candidate.\nPersonal:Birth date: September 6, 1954\nBirth place: Austin, Texas\nBirth name: Cara Carleton Sneed \nFather: Joseph T. Sneed, III, federal judge and law professor\nMother: Madelon Montross Juergens, artist (abstract painter)\nMarriages: Frank Fiorina (1985-present); Todd Bartlem (June 1977-1984, divorced) \nChildren: Two stepdaughters with Frank Fiorina, Traci and Lori Ann (1974-2009)\nEducation: B.A., Stanford University, medieval history and philosophy, 1976; M.B.A., University of Maryland, 1980, marketing; M.S., Massachusetts Institute of Technology, 1989; attended UCLA School of Law.\nOther Facts: Was the first woman to head a Fortune 50 company and a company in the Dow Jones Industrial Average when she became CEO and president of Hewlett-Packard Co. in 1999. \nWas the first person to head HP who came from outside the company.\nWas the first female officer at AT&T when she was 35. By the age of 40 she was leading AT&T's North American operations.\nBegan her career as a secretary in a real estate office.\nTimeline: 1980 - Begins working for AT&T as a sales representative.\nApril 1996 - Oversees Lucent Technologies Inc. $3 billion initial public offering, the largest in U.S. history, when it is spun off from AT&T. \n1998 - Becomes president of Lucent Technologies' global service-provider division.\n1998-2003 - Leads Fortune magazine's list of the 50 most powerful women, for  six years in a row. \n1999-2005 - CEO of Hewlett-Packard.\n2000 - HP names Fiorina chairman of the board.\nSept. 3, 2001 - Hewlett-Packard buys Compaq Computer Corp., a move orchestrated by Fiorina amid opposition from both the Hewlett and the Packard families. \n2003 - Fiorina leads Fortune magazine's list of the 50 most powerful business women for the sixth year in a row. \nFebruary 8, 2005 - Resigns as HP CEO.\nOctober 9, 2006 - Publishes a memoir, \"Tough Choices.\"\nOctober 2007 - Becomes a business commentator on the Fox Business Network.\n2008 - Serves as economic adviser to John McCain during his presidential campaign.\nFebruary 20, 2009 - Is diagnosed with breast cancer at age 54. \nNovember 2, 2010 - Loses her bid to unseat California Senator Barbara Boxer. She campaigns against President Barack Obama's Affordable Healthcare Act and abortion rights. \n2014 - Launches the Unlocking Potential Project, a political action committee that aims to inform women voters about conservative positions and issues.\nFebruary 24, 2015 - Supporters launch Carly for America, a super PAC to support Fiorina's presidential bid. \nMay 4, 2015 - Announces her candidacy for president, becoming the first declared female candidate to seek the Republican Party's nomination.\nMay 5, 2015 - Her book, \"Rising to the Challenge: My Leadership Journey,\" is released.\n", "byline": "", "description": "\n    \n", "title": "Carly Fiorina Fast Facts", "url": "http://www.cnn.com/2015/05/28/us/carly-fiorina-fast-facts/index.html", "topics": ["personality", "women"], "people": ["Barack Obama", "Barbara Boxer", "Frank Fiorina", "Carly Fiorina", "Cara Carleton Sneed"], "orgs": ["Massachusetts Institute of Technology", "Compaq Computer Corp.", "Stanford University", "University of Maryland", "PAC", "Republican Party", "Lucent Technologies", "AT&T"], "authors": [{"author_id": 2564, "fullname": "cnn library", "primary_org": "cnn"}], "date_written": "2015-05-28 21:54:29", "org": "cnn", "article_id": "d44f85bf796f502d2f1520f216bad04f", "date_access": "2015-05-28 23:55:55.980234"}