{"body": " (CNN)Within minutes of the start of the prime-time GOP debate on Fox News, Republican presidential Donald Trump stole the show.\nHere are five dramatic Trump moments -- so far -- from the debate:\n1. \"I can totally make that pledge if I am the nominee,\" he said about pledging to support the nominee for the Republican party. He's not ruling out a third-party nomination.\n2. \"Only Rosie O'Donnell,\" Trump said after debate moderator Megyn Kelly asked him about his history of referring to women offensively, including calling them fat pigs and slobs.\n3. \"I didn't know her money would be used on private jets going all over the world, but it was,\" he said about donating money to Hillary Clinton in the past.\n4. \"I don't think you heard me. You're having a hard time tonight,\" he told Rand Paul, who scolded at Trump for originally supporting a single-payer heath care system.\n5. \"If it weren't for me you wouldn't even be talking about illegal immigration, Chris,\" he told Chris Christie during the debate.\n", "byline": "", "description": "Within minutes of the start of the prime-time GOP debate on Fox News, Republican presidential Donald Trump stole the show.\n    \n", "title": "Trump's dramatic moments so far at the GOP debate", "url": "http://www.cnn.com/2015/08/06/politics/republican-debate-donald-trump-top-lines/index.html", "topics": ["immigration", "women"], "people": ["Rand Paul", "Chris Christie", "Hillary Clinton", "Donald Trump", "Megyn Kelly", "Rosie O'Donnell"], "orgs": ["GOP"], "authors": [{"author_id": 17207, "fullname": "daniella diaz", "primary_org": "cnn"}], "date_written": "2015-08-07 03:15:42", "org": "cnn", "article_id": "57cc148a51143188fcdf0cb17b9f9155", "date_access": "2015-08-07 02:20:35.844498"}