{"body": "Buck Sexton is a political commentator for CNN and host of \"The Buck Sexton Show\" on TheBlaze. He was previously a CIA counterterrorism analyst. The opinions expressed in this commentary are his.\n (CNN)Donald Trump's unlikely surge to the top of the GOP field has had analysts and the establishment scratching their heads for weeks. Trump's durability at the front of the pack -- despite some controversial statements  -- has further flummoxed even the most seasoned campaign watchers. Many have begun to resign themselves to the real possibility of Trump staying in it for the long haul even if his chances to end up atop the GOP ticket appear slim.\nBut according to the latest polling of likely Iowa caucusgoers, Trump is now neck and neck with another Washington outsider -- Dr. Ben Carson. The Donald and the Doctor are tied at 23%. Add into the mix Carly Fiorina, who has jumped into third place, and Ted Cruz -- a tea party favorite in fourth place, and you have a clear trend at this stage of the Republican primary:\nCall it the rise of the outsiders.\nThere are many reasons for this phenomenon. Some are surely specific to the candidates as each of these nontraditional contenders for the Republican nomination offers a unique appeal to the conservative base.\nTrump, for one, packages himself as the \"builder,\" a savvy negotiator who gets the job done, whatever it may be, and who delights in hammering the \"losers\" of the current political class.\nCarson brings a combination of brilliance and soft-spoken humility, whose achievements as a world-class surgeon are truly impressive. His favorability rating of 79% among likely Iowa caucus voters should come as no surprise.\nCruz is an ardent constitutionalist and senator of choice for the tea party. Cruz is the only one among the outsider bunch to be a literal Washington insider, but he manages to run as a virtual outsider based on his willingness to run headlong into the machinery of Republican leadership. \nFinally, with Fiorina you get experience as CEO of a Fortune 500 company instead of a career politician. And although Republicans don't play identity politics the way Democrats do, it would be a bonus for the first woman president to come from within the ranks of the GOP.\nBut the distinct appeal of each candidate aside, there is a theme unifying them all -- and it is why they are resonating with the conservative base:\nNo more betrayals from the establishment.\nThat is the single, clear battle cry of the conservative base across America. It's the reason an outsider candidate such as Trump -- and to lesser degrees Carson, Cruz and Fiorina along with him -- have managed to overtake a slew of governors and senators -- even a Bush -- in the polls. \nConservative voters from coasts to cornfields feel that the Senate and House GOP leadership have sold them out. It was less than a year ago that the Republicans were handed a majority in the Senate to add to their strong advantage in the House. House Speaker John Boehner and Senate Majority Leader Mitch McConnell promptly voted to fund President Barack Obama's government fully, caved on opposing Obama's immigration orders and focused on crony capitalist giveaways. \nThe conservative backlash to this bait-and-switch has been fierce. Promises to oppose Obama's agenda from anyone inside the Beltway are met by the base with derision. Any GOP candidate who tries to hedge a position or lean toward the center runs the risks of being called a phony and a sellout. The GOP base is hunting for Republicans In Name Only, or RINOs. \nThis is all predictable -- and even understandable. The GOP elites made promises they not only failed to keep but flatly ignored. People do not like being lied to, and the conservative base feels it has been lied to many, many times. It's done with the go-along-to-get-along Republicans.\nThat's the genesis of the GOP outsider surge. It's a righteous anger from the heart and soul of the conservative movement. So far, only those who cannot be blamed for the GOP's transgressions -- those outside the halls of political power -- have been able to harness it to their advantage.\nAnd the candidate who is best able to convince the conservative base that the betrayals will stop is likely to be the GOP nominee -- all in the hopes of becoming the ultimate insider, at 1600 Pennsylvania Ave.\nJoin us on Facebook.com/CNNOpinion.Read CNNOpinion's new Flipboard magazine.    \n", "byline": "", "description": "", "title": "Trump, Carson, Fiorina -- GOP's year of the outsiders", "url": "http://www.cnn.com/2015/09/01/opinions/sexton-trump-carson-fiorina-outsiders/index.html", "topics": ["immigration"], "people": ["Donald Trump", "John Boehner", "Barack Obama", "Buck Sexton", "Carly Fiorina", "Ben Carson", "Ted Cruz"], "orgs": ["CIA", "Beltway", "Senate", "House GOP", "Pennsylvania Ave.", "GOP"], "authors": [{"author_id": 26512, "fullname": "buck sexton", "primary_org": "cnn"}], "date_written": "2015-09-01 15:14:07", "org": "cnn", "article_id": "97d1bece48e727ae29b78bcf118e2e0e", "date_access": "2015-09-01 14:31:28.313284"}