{"body": "\nWhat Works\n\n10/08/15 02:23 PM EDT\n\n                                        By \n                                                POLITICO Magazine\n\n\n10/08/15 02:08 PM EDT\n\n                                        By \nNick Gass\n\nWhat social media is saying about his withdraw form the Speaker's race. \n\n                                        Updated 10/08/15 02:04 PM EDT\n\n                                        By \nJake Sherman\n                                        ,\nAnna Palmer\n                                         and \nJohn Bresnahan\n\nThe House Republican Conference is now in a serious crisis. \n\n10/08/15 02:03 PM EDT\n\n                                        By \nHadas Gold\n\nBoehner has canceled his planned Thursday night appearance on \"The Tonight Show\" hosted by Jimmy Fallon, NBC has confirmed.\n\n10/08/15 02:00 PM EDT\n\n                                        By \n                                                Isaac Arnsdorf \n\nNot quite a full house \u2014 Science smells nice\n\n10/08/15 01:50 PM EDT\n\n10/08/15 01:46 PM EDT\n\n                                        Updated 10/08/15 01:31 PM EDT\n\n                                        By \nNick Gass\n\n\"If I were the president, I would not sign an increased budget,\" he says. \n\n10/08/15 01:18 PM EDT\n\n10/08/15 01:18 PM EDT\n\n                                        By \n                                                Thomas Graham\n\nThe U.S. should deploy a mix of resistance and cooperation in dealing with Moscow.\n\n10/08/15 01:00 PM EDT\n\n10/08/15 12:59 PM EDT\n\n                                        By \nEliza Collins\n\nErickson says he wasn\u2019t fired.\n\n10/08/15 12:55 PM EDT\n\n                                        Updated 10/08/15 12:51 PM EDT\n\n                                        By \nNick Gass\n\n\"Great, Kevin McCarthy drops out of SPEAKER race,\" the Republican presidential candidate tweeted Thursday.\n\n10/08/15 12:45 PM EDT\n\n                                        By \nJosh Gerstein\n\nThere was no immediate comment from the Justice Department or the State Department on the decision.\n\n10/08/15 12:16 PM EDT\n\n                                        By \nNick Gass\n\nThe country is experiencing ongoing civil unrest related to the recent adoption of a new constitution.\n\n                                        Updated 10/08/15 12:11 PM EDT\n\n                                        By \nBurgess Everett\n\nSen. Bob Corker is considering issuing a subpoena for Secretary of State John Kerry.\n\n10/08/15 11:51 AM EDT\n\n                                        By \nKyle Cheney\n                                         and \nKatie Glueck\n\nThe GOP front-runners lack conservative cred, and activists are starting to notice.\n\n10/08/15 11:33 AM EDT\n\n                                        Updated 10/08/15 11:15 AM EDT\n\n                                        By \nSarah Wheaton\n\nThe move is aimed at avoiding a confirmation battle at the scandal-plagued agency blamed for the \"Fast and Furious\" gun-running operation.\n\n10/08/15 11:10 AM EDT\n\n                                        By \nNick Gass\n\nThe mayor of Yalta would like the Trump to visit if he becomes president.\n\n10/08/15 10:18 AM EDT\nKANYE\u2019s lament\n\n10/08/15 10:17 AM EDT\n\n                                        By \nNick Gass\n\nRepublican candidates, she added, have done her organization a favor by putting \"this issue way up high in the consciousness of the American people.\"...\n\n10/08/15 10:10 AM EDT\n\n                                        By \nLauren French\n\nChaffetz described his plan as an \u201cinclusive approach.\u201d\n\n10/08/15 10:03 AM EDT\n\n                                        By \nLauren Gardner\n                                         and \nHeather Caygle\n\nVW heads to Hill for reckoning \u2014 Dems take hard-line stance on PTC (MT exclusive) \u2014 House dons beer goggles for highway offsets \u2014 FAA works to wrap up...\n\n10/08/15 10:02 AM EDT\n\n                                        By \nAdam Sneed\n\nTech falls short on last-minute TPP change \u2014 Obama urged to support uncompromised encryption\n\n10/08/15 10:02 AM EDT\n\n                                        By \nJake Sherman\n                                         and \nJohn Bresnahan\n\nFlorida Rep. Daniel Webster - a long-shot candidate for speaker backed by hard-line conservatives - said he would not commit to supporting the party's...\n\n10/08/15 10:02 AM EDT\n\n                                        By \nAdam Behsudi\n\nRyan eager to find out if TPP is a good agreement \u2014 Froman promises TPP text within 30 days\n\n10/08/15 10:01 AM EDT\n\n                                        By \nEric Wolff\n\nExports veto threat \u2014 LWCF in the spotlight\n\n10/08/15 10:01 AM EDT\n\n                                        By \nToby Eckert\n\nSenate Finance probe may mean new VW liabilities \u2014 House seems set to take Senate highway pay-fors \u2014 Manufacturers to outline BEPS misgivings\n\n10/08/15 10:01 AM EDT\n\n                                        By \nDarius Tahir\n\n23andMe and some political goings-on \u2014 Continuing resolution would hurt precision medicine?\n\n10/08/15 10:01 AM EDT\n\n                                        By \nCaitlin Emma\n\nWill Moskowitz run for mayor? \u2014 Admissions coalition presses pause\n\n10/08/15 10:00 AM EDT\n\n                                        By \nBrian Mahoney\n\nObama talks unions.\n\n10/08/15 10:00 AM EDT\n\n                                        By \nDavid Perera\n\nMatthew Keys guilty of three CFAA felonies.\n\n10/08/15 10:00 AM EDT\n\n                                        By \nJenny Hopkinson\n\nWhat Clinton's TPP rejection really means.\n\n10/08/15 10:00 AM EDT\n\n                                        By \nTheodoric Meyer\n\nConway outspends Bevin nearly 4-to-1 \u2014 McConnell, Paul to host Bevin fundraiser\n\n10/08/15 10:00 AM EDT\n\n                                        By \nErin Mershon\n\nAll eyes are on the leadership elections \u2014 Republicans kick off another Planned Parenthood hearing\n\n10/08/15 08:40 AM EDT\n\n                                        By \nJake Sherman\n\nHouse Ways and Means Chairman Paul Ryan will give the nominating speech for Kevin McCarthy today\n\n10/08/15 08:30 AM EDT\n\n                                        By \nJeremy Herb\n\nRussia ramps up offensive in Syria.\n\n10/08/15 08:22 AM EDT\n\n                                        By \nLauren French\n\nThe GOP picks its new Speaker of the House Thursday.\n\n10/08/15 08:00 AM EDT\n\n                                        By \nBen White\n\nHRC close on Wall Street plan\n\n10/08/15 07:49 AM EDT\nWHAT JACK and SUSANNA QUINN are asking for their mansion\n\n10/08/15 07:21 AM EDT\n\n                                        By \nNick Gass\n\nMore than six in 10--62 percent--said they approve of the job their governor is doing.\n\n10/08/15 07:17 AM EDT\n\n                                        By \nJosh Gerstein\n                                         and \nRachael Bade\n\nThe Senate Homeland Security and Government Affairs Committee found evidence of attempted intrusions into Clinton's server in 2013 and 2014.\n\n10/08/15 07:12 AM EDT\nKIRK dismisses primary threat\n\n10/08/15 07:06 AM EDT\nCCRB faults Blake cop\n\n10/08/15 06:55 AM EDT\nCHRIS SMITH\u2019s Maddow test for interns\n\n10/08/15 06:52 AM EDT\n\n                                        By \nNick Gass\n\nClinton \"will unveil proposals intended to equip prosecutors with better tools in order to prosecute Wall Street executives who break the law,\"...\n\n10/08/15 06:42 AM EDT\nBAKER\u2019s transportation \u2018honeymoon\nWe're working on more stories right now\n\n                                            By \n                                                    Josh Zeitz\n\n\n                                            By \n                                                    Barney Frank\n\n\n                                            By \n                                                    Rich Lowry\n\n\n                                            By \nTodd S. Purdum\n\n\n                M. Scott Mahaskey\n\n            By \nNick Gass\n\n10/08/15 02:08 PM EDT\n\n \u00a9 2015 POLITICO LLC", "byline": "", "description": "", "title": "2016 candidates react to McCarthy's decision on Twitter", "url": "http://www.politico.com/story/2015/10/kevin-mccarthy-2016-twitter-reaction-214567", "topics": ["campaign_finance"], "people": ["Isaac Arnsdorf", "Burgess Everett", "Kyle Cheney", "Lauren Gardner", "Erin Mershon", "Anna Palmer", "Hadas Gold", "Darius Tahir", "Matthew Keys", "Bob Corker", "Jenny Hopkinson", "Theodoric Meyer", "Brian Mahoney", "John Boehner", "Josh Gerstein", "Jimmy Fallon", "Toby Eckert", "Rich Lowry", "Katie Glueck", "Nick Gass", "Adam Sneed", "M. Scott Mahaskey", "Barney Frank", "Jeremy Herb", "John Bresnahan", "Jake Sherman", "Eliza Collins", "Paul Ryan", "Sarah Wheaton", "Lauren French", "Josh Zeitz", "Rachael Bade", "John Kerry", "Adam Behsudi", "Heather Caygle", "Todd S. Purdum", "Daniel Webster", "David Perera", "Ben White", "Eric Wolff", "Thomas Graham", "Jason Chaffetz", "Matt Bevin", "Caitlin Emma"], "orgs": ["Bevin", "What Works", "Senate", "State Department", "LWCF", "Senate Finance", "Justice Department", "House Republican Conference", "TPP", "FAA", "GOP"], "authors": [{"author_id": 31419, "fullname": "politico magazine", "primary_org": "politico"}], "date_written": "2015-10-08 19:08:31", "org": "politico", "article_id": "fb6579d6b96ac82baf64f3fd1d819ecc", "date_access": "2015-10-08 18:30:07.472517"}