{"body": "\n09/18/15, 12:46 PM EDT\n\n09/18/15, 12:42 PM EDT\n\n                                        By \nShane Goldmacher\n\nHe has an unidentified \u201csignificant business transaction.\u201d\n\n09/18/15, 12:15 PM EDT\n\n                                        By \nAustin Wright\n\nPetraeus' appearance on Capitol Hill underscores the level of angst regarding the progress of the U.S.-led camapign to defeat the Islamic State\n\n                                        Updated 09/18/15, 12:14 PM EDT\n\n                                        By \nNick Gass\n\n\"I think voters should be able to weigh in,\" he said.\n\n                                        Updated 09/18/15, 12:12 PM EDT\n\n                                        By \nNick Gass\n\nThe Monday start date for the new rules coincides with Pope Francis\u2019s visit to the island\n\n09/18/15, 11:44 AM EDT\n\nCongress\n\n                                        Updated 09/18/15, 11:31 AM EDT\n\n                                        By \nLauren French\n                                         and \nAnna Palmer\n\nDemocrats mull how to vote on vacate the speaker motion\n\n09/18/15, 11:17 AM EDT\n\n                                        By \nAndrew Restuccia\n\nCiting Pope Francis' support for action on climate change, Republican Rep. Paul Gosar says he is boycotting the pontiff's address to Congress.\n\n09/18/15, 11:12 AM EDT\n\n09/18/15, 11:09 AM EDT\n\nHistory Dept.\n\n09/18/15, 10:47 AM EDT\n\n                                        By \n                                                Nicholas G. Karambelas\n\nThe battle between Athens and Brussels goes back much further than the Eurozone.\n\n09/18/15, 10:06 AM EDT\n\n                                        By \nBrian Mahoney\n\nBiden met with Culinary workers \u2014 Workplace deaths highest since '08\n\n09/18/15, 10:03 AM EDT\n\n                                        By \nHelena Bottemiller Evich\n\nLivestock price reporting susceptible to shutdown\n\n09/18/15, 10:03 AM EDT\n\n                                        By \nElena Schneider\n\nRivals hope scandal sinks Vitter \u2014 NRSC eyes Kudlow in Conn. \u2014 Debate a ratings success for CNN\n\n09/18/15, 10:03 AM EDT\n\n                                        By \nBrianna Ehley\n\nHouse votes on defund Planned Parenthood bill today \u2014 Candidates inject vaccines into the election \u2014 Republicans could use waivers to attack Obamacare\n\n09/18/15, 10:02 AM EDT\n\n                                        By \nJoseph Marks\n\nCybercom plans monitoring system for weapons vulnerabilities \u2014 Lawmakers to DHS: Not so fast on cyber re-org\n\n09/18/15, 10:02 AM EDT\n\n                                        By \nArthur Allen\n\nPrecision medicine: Can it \u201cmove the needle\u201d on EHRs? \u2014 Pressure Builds to Stuff Stage 3\n\n09/18/15, 10:01 AM EDT\n\n                                        By \nEric Wolff\n\nHappy Birthday, Keystone review\n\n09/18/15, 10:01 AM EDT\n\n                                        By \nCaitlin Emma\n\nGovernment shutdown watch - 'It's On Us' turns 1 - 'Walk-in' for Milwaukee schools\n\n09/18/15, 10:00 AM EDT\n\n                                        By \nBrian Faler\n\nTax extenders d\u00e9j\u00e0 vu.\n\n09/18/15, 10:00 AM EDT\n\n                                        By \nJennifer Scholtes\n\nFeinberg set to sail to confirmation.\n\n09/18/15, 10:00 AM EDT\n\n                                        By \nAdam Sneed\n\nPritzker urges high-skilled immigration reform.\n\n09/18/15, 10:00 AM EDT\n\n                                        By \nVictoria Guida\n\nMore steel trade cases coming.\n\n09/18/15, 09:34 AM EDT\n\n                                        By \nNick Gass\n                                         and \nKyle Cheney\n\nJohn Yob wrote that Rich Beeson \"literally physically assaulted me by punching me in the face.\"\n\n09/18/15, 09:10 AM EDT\nGovernment offices were closed to mark the occasion.\n\n09/18/15, 08:30 AM EDT\n\n                                        By \nJeremy Herb\n\nRichardson takes over as CNO.\n\n09/18/15, 08:23 AM EDT\n\n                                        By \nNick Gass\n\n\"Ronald Reagan was behind, I think something like 8 points six days before the presidential election.\"\n\nCartoon Carousel \n\n09/18/15, 08:11 AM EDT\n\n                                        By \n                                                POLITICO Staff\n\n\n09/18/15, 08:00 AM EDT\n\n                                        By \nBen White\n\nFed decision a risk for Dems \u2014 Trump slowing down? \u2014 Shutdown could happen \u2014 Goldman comes to Snapchat\n\n09/18/15, 07:53 AM EDT\nMarco Rubio and Rand Paul stay out of Ted Cruz's Planned Parenthood fight.\n\n09/18/15, 07:41 AM EDT\n\n                                        By \nNick Gass\n\n\"I'll just tell you what I would do, and I wouldn't have permitted that.\"\n\n09/18/15, 07:34 AM EDT\nPreet digs into Cuomo\u2019s Buffalo bucks.\n\n09/18/15, 07:26 AM EDT\n\n                                        By \nNick Gass\n\nJust 53 percent said they had \"a great deal\" or \"a fair amount\" of trust in the judiciary's ability to do its job.\n\n09/18/15, 07:07 AM EDT\n\n                                        By \nNick Gass\n\n\"Every question had to do with me,\" he said.\n\n09/18/15, 07:06 AM EDT\nChris Christie\u2019s pretty good week.\n\n09/18/15, 07:02 AM EDT\nHoward Dean to rally Clinton donors.\n\n2016\n\n09/18/15, 06:25 AM EDT\n\n                                        By \nAnnie Karni\n                                         and \nIsabelle Taft\n\nThey went from \u2018dead broke\u2019 to millionaires in months.\n\n09/18/15, 06:24 AM EDT\nAfter Wednesday's debate, is Trump's momentum gone?\n\n2016\n\n09/18/15, 06:22 AM EDT\n\n                                        By \nMichael Kruse\n                                        ,\nJosh Gerstein\n                                         and \nBen Schreckinger\n\nStory of Cincinnati apartment complex exaggerates the young Donald's role.\n\n09/18/15, 06:00 AM EDT\nFlorida mapping hypocrisy.\n\n2016\n\n09/18/15, 05:52 AM EDT\n\n                                        By \nEli Stokols\n\nFirms that boosted his net worth after leaving office helped his record campaign fundraising.\n\n2016\n\n09/18/15, 05:52 AM EDT\n\n                                        By \nMichael Kruse\n\nRailing for decades about unequal income has meant he earned little of it himself.\n\n2016\n\n09/18/15, 05:51 AM EDT\n\n                                        By \nMarc Caputo\n                                         and \nManu Raju\n\nA new house, private schools, a fishing boat and a nearly debt-free life.\n\n2016\n\n09/18/15, 05:50 AM EDT\n\n                                        By \nTarini Parti\n\nHe\u2019s in debt, but he\u2019s also living in the governor\u2019s mansion.\n\n2016\n\n09/18/15, 05:45 AM EDT\n\n                                        By \n                                                POLITICO Staff\n\nThe 2016 field is the richest ever, and it's not only because of the self-promoting billionaire.\n\n09/18/15, 05:23 AM EDT\n\n                                        By \nTerence Mulcahy\n                                         and \nHanna Trudo\n\n\n09/18/15, 05:16 AM EDT\n\n                                        By \nJake Sherman\n                                         and \nAnna Palmer\n\nA lump-sum payment to an ex-staffer appears to be prohibited by House rules.\n\n2016\n\n09/18/15, 05:10 AM EDT\n\n                                        By \nEdward-Isaac Dovere\n\nThe VP's inner circle thinks he can bide his time a while longer -- even into the spring -- before deciding whether to run for president. \n\n09/18/15, 05:00 AM EDT\n\n09/18/15, 04:30 AM EDT\nWe're working on more stories right now\n\n                                            By \n                                                    Sara Solovitch\n\n\n                                            By \n                                                    Nicholas G. Karambelas\n\n\n                                            By \nTodd S. Purdum\n\n\n                                            By \n                                                    Andrea Damewood\n\n\n                AP Photo\n\n            By \nShane Goldmacher\n\n09/18/15, 12:42 PM EDT\nGREENVILLE, South Carolina \u2013 Donald Trump unexpectedly announced Friday that he would skip a major Republican gathering to be held later in the day in South Carolina due to an unidentified \u201csignificant business transaction.\u201d\nTrump was one of 11 GOP presidential candidates slated to speak at the Heritage Action Presidential Forum at an arena in Greenville. The event is co-sponsored by two of the biggest names in South Carolina GOP politics: Gov. Nikki Haley and former Sen. Jim DeMint. \nTrump\u2019s campaign said his undisclosed transaction \u201cwas expected to close Thursday\u201d but a delay made him unable to attend. \u201cHe sends his regrets,\u201d the campaign said in a statement. \nTrump spokeswoman Hope Hicks told POLITICO in an email: \u201cIt will be announced next week.\u201d\nTrump is currently scheduled to be in South Carolina next week to attend a town hall. The Friday forum, held at the Bon Secours Wellness Arena, had promised an audience for Trump of thousands of GOP activists in the key early state. \n\n2016\n\n            By \nBen Schreckinger\n\nAs the first multi-candidate event following this week\u2019s debate, it had also promised to test his reception against others in the field, most notably Carly Fiorina, whose breakout performance has earned plaudits around the country. \nTen other Republican hopefuls are still set to address the crowd: Fiorina, Jeb Bush, Ben Carson, Chris Christie, Ted Cruz, Bobby Jindal, Rand Paul, Marco Rubio, Rick Santorum and Scott Walker. \nA spokesman for Heritage Action did not immediately respond to a request for comment on Trump\u2019s last-minute cancellation.\nBen Schreckinger contributed to this report.\n \u00a9 2015 POLITICO LLC", "byline": "", "description": "", "title": "Trump bails on Heritage forum in South Carolina", "url": "http://www.politico.com/story/2015/09/donald-trump-cancels-heritage-forum-south-carolina-213825", "topics": ["campaign_finance", "immigration", "personality"], "people": ["Rand Paul", "Sara Solovitch", "John Yob", "Kyle Cheney", "Rick Santorum", "Nikki Haley", "Helena Bottemiller Evich", "Elena Schneider", "Anna Palmer", "Hanna Trudo", "Austin Wright", "David Petraeus", "Michael Kruse", "Ted Cruz", "Chris Christie", "Marc Caputo", "Brian Mahoney", "Andrew Restuccia", "Howard Dean", "Manu Raju", "Caitlin Emma", "Annie Karni", "Pope Francis", "Bobby Jindal", "Brianna Ehley", "Scott Walker", "Shane Goldmacher", "Nick Gass", "Jennifer Scholtes", "Joseph Marks", "Isaac Dovere", "Jeb Bush", "Jeremy Herb", "Todd S. Purdum", "Marco Rubio", "Jake Sherman", "David Vitter", "Lauren French", "Carly Fiorina", "Rich Beeson", "Adam Sneed", "Ben Schreckinger", "Brian Faler", "Donald Trump", "Nicholas G. Karambelas", "Ronald Reagan", "Arthur Allen", "Hope Hicks", "Terence Mulcahy", "Ben White", "Eli Stokols", "Isabelle Taft", "Andrea Damewood", "Victoria Guida", "Josh Gerstein", "Eric Wolff", "Paul Gosar", "Ben Carson"], "orgs": ["Heritage Action", "Tarini Parti", "Fed", "Congress", "Keystone", "NRSC", "Bon Secours Wellness Arena", "CNO", "Cartoon Carousel", "DHS", "GOP", "Cybercom"], "authors": [{"author_id": 39086, "fullname": "shane goldmacher", "primary_org": "politico"}], "date_written": "2015-09-18 17:42:06", "org": "politico", "article_id": "e03301a68a667535fa28401d547f5af1", "date_access": "2015-09-18 16:50:09.156692"}