{"body": "\n10/01/15 12:29 PM EDT\nThe Obama administration Thursday tightened its regulations for smog-causing ozone pollution despite a furious opposition campaign by industry groups,...\n\n                                        By \n                                                Rep. Sander Levin\n\nThe trade deal could be a powerful lever to improve worker rights and fix some of NAFTA\u2019s mistakes. It\u2019s not there yet.\n\n10/01/15 12:16 PM EDT\n\n                                        By \nNick Gass\n\nApparently it takes a hurricane to keep Donald Trump from the trail.\n\n                                        Updated 10/01/15 12:08 PM EDT\n\n                                        By \nJake Sherman\n\nMcCarthy is trying to maximize his vote count ahead of the Oct. 8 leadership election.\n\n10/01/15 12:07 PM EDT\n\n                                        By \nEliza Collins\n\nDonald Trump says he has no plans to tank.\n\n10/01/15 11:55 AM EDT\n\n                                        By \nNick Gass\n\nRussia targeted \"ISIL-associated depots, armaments and sites,\" Moscow's foreign minister says.\n\n                                        Updated 10/01/15 11:46 AM EDT\n\n                                        By \nEliza Collins\n\nHillary Clinton finds Kevin McCarthy's comments that tout the Benghazi investigation and her dropping poll numbers as related 'deeply distressing.'\n\n10/01/15 11:00 AM EDT\n\nIn The Arena\n\n10/01/15 10:58 AM EDT\n\n                                        By \n                                                Rich Lowry\n\nIt\u2019s the Abortion, Stupid\n\n10/01/15 10:51 AM EDT\n\n10/01/15 10:38 AM EDT\n\n                                        By \nDaniel Strauss\n\n\"Donald seems to have a harder time taking criticism and he probably needs to put on his big-boy pants too.\"\n\n10/01/15 10:22 AM EDT\n\n10/01/15 10:02 AM EDT\n\n                                        By \nDarius Tahir\n\nHELP hearing \u2014 Jeb! with a health IT recommendation?\n\n10/01/15 10:02 AM EDT\n\n                                        By \nTheodoric Meyer\n\nFundraising reports we\u2019re watching \u2014 Another potential Bennet challenger won\u2019t run\n\n10/01/15 10:02 AM EDT\n\n                                        By \nBrian Mahoney\n\nCWA members mull Sanders, Clinton ... and Trump! \u2014 Franchises take to the Hill \n\n10/01/15 10:02 AM EDT\n\n                                        By \nEric Wolff\n\nSurvivor: Marshall Islands \u2014 Senate committee has crude intentions\n\n10/01/15 10:01 AM EDT\n\n                                        By \nCaitlin Emma\n\nWe have a budget deal \u2014 HEA state of play\n\n10/01/15 10:00 AM EDT\n\n                                        By \nTim Starks\n\nPasswords move one step closer to the end \u2014 DoD has unresolved cyber recommendations\n\n10/01/15 10:00 AM EDT\n\n                                        By \nVictoria Guida\n\nCongress weighs in on USTR efforts\n\n10/01/15 10:00 AM EDT\n\n                                        By \nJenny Hopkinson\n\nTPP talks could go into overtime \u2014 Obama signs ag reauthorization acts\n\n10/01/15 10:00 AM EDT\n\n                                        By \nJennifer Scholtes\n\nHappy new fiscal year!\n\n10/01/15 10:00 AM EDT\n\n                                        By \nToby Eckert\n\nClub for Growth disses Kasich.\n\n10/01/15 10:00 AM EDT\n\n                                        By \nKate Tummarello\n                                         and \nAlex Byers\n\nObamacare and the gig economy.\n\n                                        Updated 10/01/15 09:46 AM EDT\n\n                                        By \nDaniel Strauss\n\nThe move underscores Paul's effort to turnaruond lackluster polling.\n\n10/01/15 09:22 AM EDT\n\n                                        By \nHadas Gold\n\nEllen Pollock to succeed him as editor of Businessweek\n\n10/01/15 08:55 AM EDT\nHarry Reid's requests that the White House promise to oppose a Palestinian state at the UN were brushed off by Obama.\n\n10/01/15 08:33 AM EDT\nBernie Sanders and Ben Carson surprise with big fundraising hauls.\n\n10/01/15 08:32 AM EDT\nROSKAM bows out.\n\n10/01/15 08:30 AM EDT\n\n                                        By \nJeremy Herb\n\nObama signs stopgap funding measure.\n\n10/01/15 08:00 AM EDT\n\n                                        By \nBen White\n\nMore battle for NYC \u2014 Bush to 'surpass' Q2 fundraising \u2014 The Litan backlash \u2014 Warren power\n\n                                        Updated 10/01/15 07:38 AM EDT\n\n                                        By \nEliza Collins\n\nRussia acknowledged Thursday that its airstrikes in Syria are not just targeting the Islamic State.\n\n                                        By \n                                                Allen Grunes\n\nHow the industry took control of a new privacy role\u2014and how policymakers can take it back.\n\n10/01/15 07:16 AM EDT\nBrooklyn school rezoning debate\n\n                                        Updated 10/01/15 07:12 AM EDT\n\n                                        By \nBrianna Ehley\n\nObamacare repeal advances in the House \u2014 Committee wants answers on troubled co-ops \u2014 ICD-10 is finally here\n\n10/01/15 06:58 AM EDT\nCHRISTIE\u2019s Daily Show grilling.\n\n10/01/15 06:39 AM EDT\nHILLARY\u2019s Mass. fundraising sked.\n\n10/01/15 06:30 AM EDT\nWISHY WASHY: Atwater mulls again.\n\n10/01/15 06:19 AM EDT\n\n                                        By \nKate Bennett\n\nWhere the Obamas buy their gifts, the Podestas\u2019 cooking party for Hillary & more \n\nKGB File\n\n10/01/15 05:28 AM EDT\n\n                                        By \nKate Bennett\n\nPapelbon sold his 4,200-square-foot penthouse in the trendy Rittenhouse Square area of the city\n\nKGB File\n\n10/01/15 05:28 AM EDT\n\n                                        By \nKate Bennett\n\nLiterally.\n\nKGB File\n\n10/01/15 05:26 AM EDT\n\n                                        By \nKate Bennett\n\nObama mananged to sneak out another round on the course.\n\nKGB File\n\n10/01/15 05:25 AM EDT\n\n                                        By \nKate Bennett\n\nYou might be surprised.\n\nKGB File\n\n10/01/15 05:24 AM EDT\n\n                                        By \nKate Bennett\n\nThe Atlantic Media owner couldn't overcome the weather.\n\n10/01/15 05:14 AM EDT\n\n                                        By \nSeung Min Kim\n\nThe two very different men are about to begin one of the most important relationships in Washington.\n\n2016\n\n10/01/15 05:13 AM EDT\n\n                                        By \nEdward-Isaac Dovere\n\nOctober poses serious risks for many contenders, but opportunity for a few.\n\nForeign Policy\n\n10/01/15 05:13 AM EDT\n\n                                        By \nJohn Bresnahan\n                                         and \nEdward-Isaac Dovere\n\nThe Senate leader wanted the president to side with Israel by disavowing a U.N. resolution calling for a Palestinian state. It didn't happen.\n\n10/01/15 05:11 AM EDT\n\n                                        By \nDaniel Strauss\n\n\"There are enough big government msisteps to send a clear warning to fiscal conservatives.\"\n\n2016\n\n10/01/15 05:09 AM EDT\n\n                                        By \nBen Schreckinger\n\nJustin McConney spearheaded this cycle's biggest innovation: the 15-second Instagram attack ad.\n\n10/01/15 12:04 AM EDT\n\n                                        By \nAndrew Glass\n\nPresident Lyndon B. Johnson reluctantly withdrew his nomination of Supreme Court Justice Abe Fortas.\nThanks to the magic of the market economy, the carmaker will come back stronger than before.\nWe're working on more stories right now\n\n                                            By \n                                                    Josh Zeitz\n\n\n                                            By \n                                                    Rich Lowry\n\n\n                                            By \nJack Shafer\n\n\n                                            By \n                                                    Steven Lee Myers\n\n\n                Getty\n\n            By \nEliza Collins\n\n10/01/15 12:07 PM EDT\nDonald Trump \u2014 who has held a consistent lead in the field of Republican presidential hopefuls in recent months \u2014 says he won't stay in the race if he starts bombing in the polls. \u201cI'm not a masochist,\u201d he said.\n\"Right now, I\u2019m leading every poll, in most cases big,\" Trump said in an interview with CNBC\u2018s John Harwood. \"If that changed, if I was like some of these people at 1 percent or 2 percent, there\u2019s no reason to move forward. \u2026 If I tank, sure, I go back to the business. Why wouldn't I?\u201d\nStory Continued Below\nBut Trump has no plans to tank. \n\u201cYour answer to policy questions is, 'I\u2019m Trump, I\u2019m good, I\u2019m the best, I will get it done,\u2019\u201d Harwood said. \n\u201cWell, there\u2019s a little truth to that,\u201d Trump responded. \u201cActually, a lot of truth.\"\n\u201cYou\u2019ve been very successful, but we don\u2019t have Superman presidents,\u201d Harwood said. \n\u201cBut we will if you have Trump \u2014 you watch,\u201d the businessman said. \nTrump, who has been notorious for answering policy questions with boasts about his widespread support, also said he no longer talks about where Obama was born. He said it keeps people from talking about what really matters. \n\u201cPeople find the subject so interesting that we would spend a whole half hour talking about that,\u201d he said. \n \u00a9 2015 POLITICO LLC", "byline": "", "description": "", "title": "Trump: I won't stay in the race if I start tanking", "url": "http://www.politico.com/story/2015/10/donald-trump-2016-campaign-future-214315", "topics": ["trade", "economy", "campaign_finance"], "people": ["John Harwood", "Harry Reid", "Kate Tummarello", "Kate Bennett", "Hadas Gold", "Steven Lee Myers", "Jenny Hopkinson", "Brian Mahoney", "Theodoric Meyer", "Darius Tahir", "Toby Eckert", "Rich Lowry", "Nick Gass", "Jack Shafer", "Jennifer Scholtes", "Ben Schreckinger", "Isaac Dovere", "Seung Min Kim", "Sander Levin", "Donald Trump", "John Bresnahan", "Jake Sherman", "Eliza Collins", "Bernie Sanders", "Tim Starks", "Andrew Glass", "Josh Zeitz", "Brianna Ehley", "Lyndon B. Johnson", "Jeremy Herb", "Daniel Strauss", "Ellen Pollock", "Hillary Clinton", "Ben White", "Victoria Guida", "Alex Byers", "Eric Wolff", "Ben Carson", "Allen Grunes", "Caitlin Emma"], "orgs": ["CNBC", "Congress", "NAFTA", "Senate", "KGB", "CWA", "Supreme Court Justice", "ISIL", "U.N.", "Businessweek"], "authors": [{"author_id": 41292, "fullname": "rep. sander levin", "primary_org": "politico"}], "date_written": "2015-10-01 17:07:29", "org": "politico", "article_id": "18f1d21bf57e6b836a940b701aeb9e10", "date_access": "2015-10-01 16:30:12.130110"}