{"body": "\n10/21/15 02:46 PM EDT\n\n10/21/15 02:45 PM EDT\n\n10/21/15 02:41 PM EDT\n\n10/21/15 02:39 PM EDT\n\n10/21/15 02:19 PM EDT\nRead Joe Biden's full remarks. \n\n                                        Updated 10/21/15 02:02 PM EDT\n\n                                        By \nGabriel Debenedetti\n                                         and \nNick Gass\n\nThe window for mounting a successful campaign 'has closed,' the vice president said.\n\n10/21/15 02:00 PM EDT\n\n                                        By \n                                                Isaac Arnsdorf \n\nTen biggest clients and registrants \u2014 Fending off defunding\n\n10/21/15 01:57 PM EDT\n\n                                        By \nEliza Collins\n\nBiden's decision is welcomed by the Republican field.\n\n                                        Updated 10/21/15 01:42 PM EDT\n\n                                        By \nNick Gass\n\nAs told by breathless and often wrong headlines.\n\n10/21/15 12:56 PM EDT\n\n                                        By \nTim Starks\n\nThe announcement did not specify which email account of Brennan's it had gotten ahold of.\n\n10/21/15 12:26 PM EDT\n\n                                        By \nLauren French\n\nTwo leading House Democrats offered measure support for Paul yan as \n\n10/21/15 12:23 PM EDT\n\n10/21/15 12:14 PM EDT\n\n                                        By \nLauren French\n                                         and \nJake Sherman\n\nAn endorsement decision is not expected.\n\n10/21/15 12:13 PM EDT\n\n                                        By \nHadas Gold\n\nHenneberger joins the paper from Bloomberg Politics, where she is a senior writer covering the 2016 election. \n\n                                        Updated 10/21/15 12:12 PM EDT\n\n                                        By \nBurgess Everett\n\nAt issue are letters Johnson sent to two companies that incorporated information received from a third,\n\n                                        Updated 10/21/15 12:07 PM EDT\n\n                                        By \nPatrick Temple-West\n\nTreasury Secretary Jack Lew today fired back at congressional Republicans.\n\n10/21/15 12:06 PM EDT\nHe has been weighing a presidential run.\n\n                                        Updated 10/21/15 12:00 PM EDT\n\n                                        By \nPaul Demko\n\nThe mergers could remake the insurance landscape and undermine a key Obamacare goal.\n\n                                        Updated 10/21/15 11:58 AM EDT\n\n                                        By \nLauren French\n\nSome conservatives complain he's setting them up to be blamed if he decides not to run.\n\nCongress\n\n                                        Updated 10/21/15 11:41 AM EDT\n\n                                        By \nJake Sherman\n                                        ,\nJohn Bresnahan\n                                         and \nAnna Palmer\n\nThe reluctant speaker candidate drafted a secret five-point plan to run. Now it's on Republicans to decide if they like it.\n\n10/21/15 11:37 AM EDT\n\n                                        Updated 10/21/15 11:36 AM EDT\n\n                                        By \nNick Gass\n\nBillionaire investor Carl Icahn announced Wednesday that he is forming a super PAC with $150 million of his own money.\n\n10/21/15 11:29 AM EDT\n\n                                        By \nEliza Collins\n\nThe President will discuss criminal justice reform.\n\n10/21/15 11:12 AM EDT\n\n                                        By \n                                                Joe Pompeo\n\nRupert's children are known to be more liberal than their father, though they are not as public about their beliefs as he. \n\n10/21/15 10:57 AM EDT\n\n                                        By \nJake Sherman\n\nHe says Ryan \"would make a great speaker.\"\n\n                                        Updated 10/21/15 10:57 AM EDT\n\n                                        By \nNick Gass\n\nFlorida Sen. Marco Rubio is running a cynical campaign that will come back to haunt him.\n\n                                        Updated 10/21/15 10:46 AM EDT\n\n                                        By \nSteven Shepard\n\nMark Blumenthal is a big catch.\n\n                                        Updated 10/21/15 10:44 AM EDT\n\n                                        By \nNahal Toosi\n                                         and \nBurgess Everett\n\nThe Senate has held off confirming an ambassador as the battle over Cuba rages.\n\n10/21/15 10:20 AM EDT\nJEB! protest in SF\n\n10/21/15 10:09 AM EDT\n\n                                        By \nLauren French\n\nPaul Ryan wants a full embrace from the House Freedom Caucus.\n\n10/21/15 10:05 AM EDT\n\n                                        By \nJake Sherman\n                                        ,\nJohn Bresnahan\n                                         and \nAnna Palmer\n\nRyan was preparing to say he would run for speaker \u2013 if things were done his way.\n\n10/21/15 10:04 AM EDT\n\n10/21/15 10:03 AM EDT\n\n                                        By \nDarius Tahir\n\nRock Health goes to D.C. \u2014 Data liberation still on agenda\n\n10/21/15 10:03 AM EDT\n\n                                        By \nCaitlin Emma\n\nStudent veterans in the spotlight \u2013 A third testing option for the Bay State? \n\n10/21/15 10:03 AM EDT\n\n                                        By \nEric Wolff\n\nBiden thinks GOP believe in climate change deep down \u2014 Keystone hint from State\n\n10/21/15 10:02 AM EDT\n\n                                        By \nTim Starks\n\nResistance to car hacking proposal \u2014 Fireworks expected at EMV hearing\n\n10/21/15 10:01 AM EDT\n\n                                        By \nBrian Mahoney\n\nRyan wants work-life balance \u2013 Obama and the UAW\n\n10/21/15 10:01 AM EDT\n\n                                        By \nBrianna Ehley\n\nRyan willing to run for Speaker \u2014 White House makes new effort on opioid abuse \u2014 Insurance mergers boost lobbying spending\n\n10/21/15 10:00 AM EDT\n\n                                        By \nBill Tomson\n\nWheat, sugar, dairy and cotton to be highlighted in hearing \u2014 Sugar farmers declare victory\n\n10/21/15 10:00 AM EDT\n\n                                        By \nTheodoric Meyer\n\nDCCC outraising NRCC \u2014 Schneider swats at Dold online\n\n10/21/15 10:00 AM EDT\n\n                                        By \nJennifer Scholtes\n\nFeds challenge auto safety bill \u2014 Amid watchdogging buildup, FTA embraces Metro oversight \u2014 Nary a transpo mention in House agenda talks\n\n10/21/15 10:00 AM EDT\n\n                                        By \nKaty O'Donnell\n\nVote on Default Prevention Act today in House \u2014 EU preps action on tax avoidance\n\n10/21/15 10:00 AM EDT\n\n                                        By \nVictoria Guida\n\nJapan\u2019s sacred ag products kept mostly safe \u2014 Apparel, textile industries \u2018happy enough\u2019\n\n10/21/15 10:00 AM EDT\n\n                                        By \nAdam Sneed\n\nEU preps action on tax avoidance \u2014 Thune: Don\u2019t expect spectrum bill, or anything else, anytime soon\n\n10/21/15 09:39 AM EDT\n\n                                        By \nJake Sherman\n\nSpeaker John Boehner announced Wednesday that the internal Republican election for speaker will be Oct. 28, and the floor election will be Oct. 29.\n\n                                        By \n                                                Carmen Paun\n\n\n                                        By \n                                                Nicholas Vinocur\n\n\n10/21/15 09:26 AM EDT\n\n                                        By \nNick Gass\n\nBen Bernanke is \"a little puzzled\" by the focus of some Democratic presidential candidates on reinstating the Glass-Steagall Act.\n\n10/21/15 09:12 AM EDT\n\n                                        By \nJake Sherman\n\nep. Paul Ryan will meet with the conservative Republican Study Committee Wednesday morning.\n\n10/21/15 08:30 AM EDT\n\n                                        By \nJeremy Herb\n\nCanada to stop Islamic State bombings \u2014 Gates to the Hill today\nWe're working on more stories right now\n\n\n\n                                            By \nGlenn Thrush\n\n\n                                            By \n                                                    Ray Takeyh\n\n\n                                            By \n                                                    Mark K. Updegrove\n\n\n                AP Photo\n\n                        As told by breathless and often wrong headlines.\n\n            By \nNick Gass\n\n10/21/15 01:15 PM EDT\n\n                    Updated 10/21/15 01:42 PM EDT\nFor much of the past year, Vice President Joe Biden has had the political media on tenterhooks in the seemingly endless will-he-or-won't-he melodrama of whether he would jump into the Democratic primary race.\nWith Biden officially out of the running, here's a look back at how the media covered Biden's decision-making and discussions within the vice president's orbit, as told by the headlines:\nStory Continued Below\nFeb. 12, ABC News: \"Joe Biden Reveals Timeframe for 2016 Presidential Decision\"\nJune 17, U.S. News: \"Biden Not Bowing Out, Will Decide on White House Run by August\"\nJune 26, USA Today: \"Family a top concern as Biden weighs presidential bid\"\nJune 28, The Wall Street Journal: \"Will He Run? Biden Speculation Mounts\"\nAug. 1, New York Times op-ed: \"Joe Biden in 2016: What Would Beau Do?\"\nAug. 1, The New York Times: \"Joe Biden Said to Be Taking New Look at Presidential Run\"\nAug. 9, The Associated Press: \"Biden expected to decide about race after weeklong retreat\"\nAug. 16, CNN: \"Advisers tell Biden: Decide by October 1\"\nAug. 21, POLITICO: \"Biden games out presidential run with circle of advisers\"\nAug. 23, The Wall Street Journal: \"Joe Biden Is Leaning Toward a 2016 Run\"\nAug. 24, POLITICO: \"The Biden Dither\"\nAug. 25, CNN: \"Obama gives Joe Biden 'blessing' for 2016 bid\"\nAug. 26, CNN: \"Biden unsure if he has the 'emotional fuel' for 2016 run\"\nOct. 3, CBS News: \"Joe Biden could decide presidential run in the next week\"\nOct. 15, POLITICO: \"Biden sidesteps the question\"\nOct. 16, CNN: \"Joe Biden camp to allies: Be ready\"\nOct. 19, NBC News: \"Biden Nears Decision Time\"\nOct. 19, The Washington Post: \"We are now on our 12th timeline for a Biden announcement\"\nOct. 20, CBS News: \"Joe Biden inches closer to critical 2016 deadlines\"\nOct. 21, POLITICO: \"Biden bows out\"\n \u00a9 2015 POLITICO LLC", "byline": "", "description": "As told by breathless and often wrong headlines.", "title": "The 250 days of pointless Biden speculation", "url": "http://www.politico.com/story/2015/10/joe-biden-announcement-wrong-headlines-215015", "topics": ["campaign_finance"], "people": ["Ray Takeyh", "Katy O'Donnell", "Isaac Arnsdorf", "Burgess Everett", "Ben Bernanke", "Joe Pompeo", "Anna Palmer", "Hadas Gold", "Paul Demko", "Lauren French", "Steven Shepard", "Joe Biden", "John Boehner", "Brian Mahoney", "Theodoric Meyer", "Nahal Toosi", "Gabriel Debenedetti", "Patrick Temple", "Beau Do", "Nick Gass", "Jennifer Scholtes", "Glenn Thrush", "Jeremy Herb", "John Bresnahan", "Marco Rubio", "Carl Icahn", "Eliza Collins", "Paul Ryan", "Nicholas Vinocur", "Brianna Ehley", "Tim Starks", "Adam Sneed", "Jack Lew", "Jake Sherman", "Victoria Guida", "Eric Wolff", "Bill Tomson", "Darius Tahir", "Caitlin Emma"], "orgs": ["EMV", "NRCC", "Congress", "Senate", "UAW", "House Democrats", "PAC", "Treasury", "Metro", "GOP", "House Freedom Caucus"], "authors": [{"author_id": 30728, "fullname": "nick gass", "primary_org": "politico"}, {"author_id": 31592, "fullname": "gabriel debenedetti", "primary_org": "politico"}], "date_written": "2015-10-21 18:15:32", "org": "politico", "article_id": "30d7da3125585ec9ebc8ea9b2eb63d26", "date_access": "2015-10-21 19:00:21.988989"}