{"body": "\n09/28/15 11:51 AM EDT\n\n                                        By \nDarren Samuelsohn\n\nThe American Coalition for Clean Cal Electricity is planning to cut half its staff.\n\n                                        Updated 09/28/15 11:45 AM EDT\n\n                                        By \nEdward-Isaac Dovere\n\nPutin was a particular focus for Obama, as he railed against regimes that repress information and jail dissidents.\n\n09/28/15 11:40 AM EDT\n\n                                        By \nJohn Bresnahan\n\nTexas Repubican will not seek any leadership post\n\n09/28/15 11:28 AM EDT\n\n                                        Updated 09/28/15 11:23 AM EDT\n\n                                        By \nNick Gass\n\nOn \"60 Minutes,\" Trump says many Americans would pay no taxes under his plan.\n\n09/28/15 11:15 AM EDT\n\n                                        By \n                                                Associated Press\n\nThe disclosure came Monday during a hearing in federal court in Chicago\n\n09/28/15 10:57 AM EDT\n\n                                        By \nNick Gass\n\nIf current demographic trends continue, immigrants and their progeny will account for 88 percent of the U.S.' population increase from 2015 to 2065.\n\nINVESTIGATION\n\n                                        Updated 09/28/15 10:27 AM EDT\n\n                                        By \nJon Prior\n\nBanks continue to foreclose on homeowners they claim to be helping in violation of 2012 settlement.\n\n09/28/15 10:03 AM EDT\n\n                                        By \nKaty O'Donnell\n\nTrump to release tax plan \u2014 Tax skirmishes played big role in Boehner's tenure  \u2014 Tax group briefs Senate staff on untaxed corporate profits\n\n09/28/15 10:02 AM EDT\n\n                                        By \nJennifer Scholtes\n\nLeaders deploy shutdown avoidance plans \u2014 House prepares to pass FAA patch \u2014 What Boehner\u2019s departure could mean for transportation investment \n\n09/28/15 10:02 AM EDT\n\n                                        By \nChase Purdy\n\nChristie to scoop up Iowa endorsements \u2014 Core issues taking the stage in antibiotic resistance fight\n\n09/28/15 10:02 AM EDT\n\n                                        By \nBrianna Ehley\n\nGet Ready for Reconciliation \u2014 Supremes to Consider Texas Abortion Case \u2014 House Tweaks 'Small Group Market'\n\n09/28/15 10:02 AM EDT\n\n                                        By \nEric Wolff\n\nObama echoes Pope Francis \u2014 Polls and reports!\n\n09/28/15 10:01 AM EDT\n\n                                        By \nDavid Pittman\n\nWhere is that Stage 2 final rule? \u2014 Cassidy interoperability bill coming this week\n\n09/28/15 10:01 AM EDT\n\n                                        By \nAlex Byers\n\nInside the FCC: What really killed the Comcast merger \u2014 Dem memo needles tech on TPP\n\n09/28/15 10:01 AM EDT\n\n                                        By \nCaitlin Emma\n\nNew look at community college defaulters \u2014 Pennsylvania budget impasse could shutter schools\n\n09/28/15 10:01 AM EDT\n\n                                        By \nTim Starks\n\nKasich talks tough on cyber \u2013 What happens after the China deal\n\n09/28/15 10:01 AM EDT\n\n                                        By \nVictoria Guida\n\nObama and Modi to meet in New York \u2014 Xi meeting yields BIT progress\n\n09/28/15 10:00 AM EDT\n\n                                        By \nTheodoric Meyer\n\nSchweikert says McCain can\u2019t beat Kirkpatrick\n\n09/28/15 10:00 AM EDT\n\n                                        By \nBrian Mahoney\n\nUAW-Fiat deal is in jeopardy.\n\n09/28/15 09:44 AM EDT\n\n                                        By \nBen White\n\nWall Street freaks over Boehner \u2014 Donors worried about Bush \u2014 Investors get special CEO access \n\n09/28/15 09:27 AM EDT\n\n                                        By \nNick Gass\n\nJeb Bush plans to release his health-care policy proposal in the next three weeks, the Republican candidate said Monday\n\n09/28/15 09:19 AM EDT\n\n                                        By \nHadas Gold\n\nCNN announced its debate criteria on Monday, making clear that Vice President Joe Biden will have the chance to make it onto the first debate stage should...\n\n09/28/15 08:48 AM EDT\nDonald Trump is set to unveil his tax plan Monday after a preview on Sunday night's 60 minutes.\n\n09/28/15 08:31 AM EDT\n\n                                        By \nJeremy Herb\n\nPutin, Obama to meet today.\n\n09/28/15 08:29 AM EDT\nA look behind the curtain at Kevin McCarthy's all-but-certain bid to become Speaker.\n\n09/28/15 07:42 AM EDT\n\n                                        By \nNick Gass\n\nMarco Rubio wants no part of Donald Trump's \"freak show,\" he said.\n\n09/28/15 07:36 AM EDT\n\n                                        By \nNick Gass\n\nIranian President Hassan Rouhani says the country is open to discussing the future of Syria after Bashar Assad with the United States.\n\n                                        By \nMichael Grunwald\n\n\n09/28/15 07:29 AM EDT\n\n                                        By \nNick Gass\n\nHillary Clinton's use of a private email server does not constitute a national security breach, former Secretary of State Madeleine Albright said.\n\n09/28/15 07:05 AM EDT\nPREET\u2019s next move.\n\n09/28/15 07:01 AM EDT\n\n                                        By \nNick Gass\n\nRep. Daniel Webster pitched himself as the next speaker of the House on Monday.\n\n09/28/15 06:50 AM EDT\n\n                                        By \nAnna Palmer\n\nPrice is said to be considering a bid for House Majority Leader, but his message did not announce a formal bid.\n\n09/28/15 06:47 AM EDT\nCHRIS CHRISTIE gets an Iowa boost.\n\n09/28/15 06:37 AM EDT\nELIZABETH WARREN\u2019S Black Lives Matter speech.\n\n09/28/15 06:30 AM EDT\nFLORIDA REDISTRICTING DISCORD: more dysfunction likely.\n\n09/28/15 06:26 AM EDT\n\n                                        By \nNick Gass\n\nNearly seven in 10 Americans--69 percent--oppose shutting down the government over funding Planned Parenthood, according to the poll.\n\nWealth Of Nations\n\n09/28/15 05:20 AM EDT\n\n                                        By \n                                                Robert B. Reich\n\nOn the opening day of Trump Plaza in Atlantic City in 1984, Donald Trump stood in a dark topcoat on the casino floor celebrating his new investment as...\n\nHealth Care\n\n09/28/15 05:15 AM EDT\n\n                                        By \nLauren French\n\nDemocrats compare it to the GOP's Benghazi panel.\n\nWhite House\n\n09/28/15 05:13 AM EDT\n\n                                        By \nMichael Crowley\n\nObama and Putin are trash-talking in advance of their first meeting in a year. \n\nCongress\n\n09/28/15 05:12 AM EDT\n\n                                        By \nJake Sherman\n                                         and \nJohn Bresnahan\n\nHe's the overwhelming favorite to replace John Boehner but the Freedom Caucus still presents a big hurdle.\n\nCongress\n\n09/28/15 05:11 AM EDT\n\n                                        By \nSeung Min Kim\n\nVotes this week will merely delay the showdown.\n\n09/28/15 12:00 AM EDT\n\n                                        By \nAndrew Glass\n\nHe began voicing his concern over the rising debt ceiling.\n\n                                        Updated 09/27/15 10:39 PM EDT\n\n                                        By \nHadas Gold\n\nTapper, looking somewhat surprised, thanked Carson and ended the interview. \n\n                                        Updated 09/27/15 10:08 PM EDT\n\n                                        By \nDoug Palmer\n\nOfficials from the U.S., Japan and 10 other Pacific Rim countries want to finish a massive deal.\n\n09/27/15 09:12 PM EDT\n\n                                        By \nHanna Trudo\n\nHe advocates building up the U.S. military and making use of it.\n\n                                        Updated 09/27/15 08:04 PM EDT\n\n                                        By \nPatrick Temple-West\n\nStatute-of-limitation laws stand in the way of justice, they argue.  \n\nIn The Arena\n\n09/27/15 07:45 PM EDT\n\n                                        By \n                                                Steve Latourette\n\nHe was a friend to many\u2014even his enemies.\n\nLetter From Ukraine\n\n09/27/15 07:44 PM EDT\n\n                                        By \n                                                Amie Ferris-Rotman\n\nThey\u2019re middle-aged and battled-hardened, but veterans of the Soviet war in Afghanistan are back on the front lines in Ukraine.\nWe're working on more stories right now\n\nInside the House leadership scramble.\n\n                Texas GOP Rep. Jeb Hensarling will not run for any leadership position. | AP Photo\n\n            By \nJohn Bresnahan\n\n09/28/15 11:40 AM EDT\nTexas GOP Rep. Jeb Hensarling will not run for any leadership position but will instead back Rep. Tom Price's (R-Ga.) bid for majority leader, a Hensarling aide said on Monday.\nHensarling, who was in leadership, is currently chairman of the Financial Services Committee and a high-profile conservative.\n\"After prayerful consideration, Chairman Hensarling is not a candidate for a leadership position. He will support Chairman Price for Majority Leader,\" said Sarah Rozier, Hensarling's communications director.\nHensarling's move to support Price is a blow to both Reps. Steve Scalise (R-La.) and Cathy McMorris Rodgers (R-Wash.), who are both running for majority leader.\n \u00a9 2015 POLITICO LLC", "byline": "", "description": "Texas Repubican will not seek any leadership post", "title": "Hensarling backs Price for majority leader", "url": "http://www.politico.com/blogs/the-gavel/2015/09/jeb-hensarling-backs-tom-price-gop-house-leadership-214148", "topics": ["abortion", "immigration"], "people": ["Katy O'Donnell", "Michael Grunwald", "Bashar Assad", "Steve Latourette", "Daniel Webster", "Doug Palmer", "Anna Palmer", "Hadas Gold", "Vladimir Putin", "Lauren French", "Tom Price", "Darren Samuelsohn", "Joe Biden", "John Boehner", "Brian Mahoney", "Theodoric Meyer", "Caitlin Emma", "Pope Francis", "Patrick Temple", "Brianna Ehley", "Steve Scalise", "Nick Gass", "Robert B. Reich", "Jennifer Scholtes", "Isaac Dovere", "Jeb Bush", "Seung Min Kim", "Andrew Glass", "Donald Trump", "John Bresnahan", "Marco Rubio", "Jake Sherman", "Chase Purdy", "Jake Tapper", "David Pittman", "Tim Starks", "Hassan Rouhani", "Jeremy Herb", "Michael Crowley", "Hillary Clinton", "Amie Ferris", "Ben White", "Jeb Hensarling", "Jon Prior", "Victoria Guida", "Alex Byers", "Eric Wolff", "Madeleine Albright", "Hanna Trudo"], "orgs": ["Fiat", "Texas Repubican", "Congress", "House Majority Leader", "Senate", "Reps", "UAW", "Financial Services Committee", "Freedom Caucus", "PREET", "Comcast", "United States.", "Wealth Of Nations", "GOP", "American Coalition for Clean Cal Electricity"], "authors": [{"author_id": 32490, "fullname": "darren samuelsohn", "primary_org": "politico"}], "date_written": "2015-09-28 16:40:44", "org": "politico", "article_id": "68c6b4f22a3a8d1b3caeb4bd414180e5", "date_access": "2015-09-28 16:01:08.088027"}