{"body": "\n10/13/15 01:51 PM EDT\n\n                                        By \nEliza Collins\n\nBill Clinton may be in Las Vegas but he's going to spend his Tuesday night in front of the TV. \nPOLITICO's live coverage of the 2016 presidential debates.\n\n                                        By \nAlex Spence\n\n\n                                        By \n                                                Paul Dallison\n\n\n10/13/15 01:33 PM EDT\n\n                                        By \nSarah Wheaton\n\nIt doesn't look like CNN's extra lectern will get its moment under the lights. \n\n10/13/15 01:33 PM EDT\n\n                                        By \n                                                Jeremy Barr\n\nTrump has hosted the late-night comedy show before, back in 2004.\n\n10/13/15 01:31 PM EDT\nLAS VEGAS - POLITICO's Gabriel Debenedetti caught up with Jennifer Palmieri, communications director for Hillary Clinton's 2016 presidential campaign,...\n\n10/13/15 01:18 PM EDT\n\n10/13/15 01:04 PM EDT\n\n                                        By \nAnnie Karni\n\nWelcome from Sin City, where it's still 7 hours from debate kick-off, but where the verbal tangling is already underway. However, it's not the Democratic...\n\n                                        Updated 10/13/15 01:04 PM EDT\n\n                                        By \nEliza Collins\n\n\"At the request of many, and even though I expect it to be a very boring two hours, I will be covering the Democrat Debate live on twitter!\"\n\n                                        Updated 10/13/15 12:57 PM EDT\n\n                                        By \nJason Millman\n\nThe organizations says just two of its health centers provide fetal tissue donation for research and they follow federal law allowing the clinics to recoup...\n\n10/13/15 12:47 PM EDT\n\n10/13/15 12:25 PM EDT\n\n10/13/15 12:09 PM EDT\n\n                                        By \nEliza Collins\n\nClinton holds a significant lead nationally among Democratic voters: 45 percent to Sanders\u2019 25 percent.\n\n                                        By \nDarren Samuelsohn\n\nHere's where the Dems are going to \u2018wonk out\u2019\u2014and who time is running out for.\n\n10/13/15 10:52 AM EDT\n\n10/13/15 10:50 AM EDT\n\n10/13/15 10:23 AM EDT\n\n                                        By \n                                                Nancy Cook\n\nHis plan stresses more limited, catastrophic coverage.\n\n10/13/15 10:07 AM EDT\n\n                                        By \nEric Wolff\n\nAmericans find pope persuasive on climate change \u2014 Drawing 'blood and oil'\n\n10/13/15 10:06 AM EDT\n\n                                        By \nEliza Collins\n\nThe ACLU suit is on behalf of two men who say they were tortured.\n\n10/13/15 10:01 AM EDT\n\n                                        By \nJennifer Scholtes\n\nFrom toys to transportation: A chat with Razor\u2019s founder \u2014 Dutch set to reveal Malaysia Flight 17 findings \u2014 VW scandal sparks Hollywood interest \n\n10/13/15 10:00 AM EDT\n\n                                        By \nDavid Pittman\n\nFamily docs criticize ONC\u2019s roadmap \u2014 DirectTrust advancing \n\n10/13/15 10:00 AM EDT\n\n                                        By \nAdam Sneed\n\nInternet Association kicks off conference \u2014 Snowden beams into Beltway event\n\n10/13/15 10:00 AM EDT\n\n                                        By \nBrian Mahoney\n\nClinton rallies with Culinary Workers \u2014 and against Trump, Inequality expert wins Nobel\n\n10/13/15 10:00 AM EDT\n\n                                        By \nChase Purdy\n\nDevil in details of California's new antibiotics law \u2014 Ads push Senate Dems to stay away from GMO bill \u2014 WOTUS is down but not out \u2014 New safety regulations...\n\n10/13/15 10:00 AM EDT\n\n                                        By \nTim Starks\n\nDell gets RSA \u2014 Millennials don\u2019t trust the digital ecosystem\n\n10/13/15 10:00 AM EDT\n\n                                        By \nBrian Faler\n\nA $25,000 tax break for buying a Tesla? \u2014 No Ryan news this week, spokesman says\n\n10/13/15 10:00 AM EDT\n\n                                        By \nCaitlin Emma\n\nNew federal action on accreditation, innovation \u2014 Setting scores for PARCC\n\n10/13/15 10:00 AM EDT\n\n                                        By \nVictoria Guida\n\nEU official highlights common ground on ISDS \u2014 Keeping an open mind on TISA\n\n10/13/15 09:59 AM EDT\n\n                                        By \nElena Schneider\n\nStutzman shakes up Indiana Senate campaign\n\n10/13/15 09:55 AM EDT\nBy Carla Marinucci (cmarinucci@politico.com; @cmarinucci)\n\n10/13/15 09:54 AM EDT\n\n10/13/15 09:52 AM EDT\n\n                                        By \nGabriel Debenedetti\n\nIn the first Democratic debate, Bernie Sanders could have the most to gain.\n\n10/13/15 09:49 AM EDT\n\n                                        By \nEliza Collins\n\nHannity told the paper that he was encouraging the House Freedom Caucus not to compromise on the speaker vote.\n\n10/13/15 09:01 AM EDT\n\n                                        By \n                                                Joe Pompeo\n\nAn Enquirer source broke it down like this: \u201cHillary shouldn\u2019t be on the campaign trail \u2014 she should be home making out her will!\u201d\n\n10/13/15 08:30 AM EDT\n\n                                        By \nJeremy Herb\n\nDemocratic debate tonight \u2014 Russia doubles daily airstrikes in Syria\n\n10/13/15 08:20 AM EDT\nBYRD-BENNETT to plead guilty.\n\n10/13/15 08:00 AM EDT\n\n                                        By \nBen White\n\nDebate night \u2014 Bernie\u2019s $8 trillion price tag \u2014 Millennials are constantly stressed over money \u2014 Adelson hearts Rubio\n\n10/13/15 07:30 AM EDT\n\n                                        By \nBurgess Everett\n\nPaul Ryan puts a chill on the speaker race.\n\n10/13/15 07:26 AM EDT\n\n                                        By \nEliza Collins\n\nThe vice president has yet to decide if he\u2019s running, but CNN has a podium ready should he surprise everyone and enter the race Tuesday. \n\n10/13/15 07:22 AM EDT\nTAXI TV to go dark\n\n                                        Updated 10/13/15 07:15 AM EDT\n\n                                        By \nBrianna Ehley\n\nJeb Bush unveils his Obamacare replacement \u2014 Democratic Debate tonight \u2014 House speakership race waits on Paul Ryan\n\n10/13/15 07:12 AM EDT\nCOMMON CORE refrain\n\n10/13/15 07:12 AM EDT\n\u2018WARREN WING\u2019 message to candidates\n\n10/13/15 06:52 AM EDT\n\n                                        By \nAndrew Glass\n\nOn this day in 1949, Indian Prime Minister Jawaharlal Nehru visited Capitol Hill as part of a three-week goodwill tour of the United States. Nehru spoke...\n\n10/13/15 06:30 AM EDT\nJudge\u2019s redistricting skeleton key.\n\n10/13/15 06:05 AM EDT\nPlaybook breaks down the top five things to watch in tonight's debate.\n\nFourth Estate\n\n10/13/15 05:18 AM EDT\n\n                                        By \nJack Shafer\n\nIt may be that two strategies that didn\u2019t work particularly well for her last time around might be just what the doctor ordered for fall 2015.\n\n2016\n\n10/13/15 05:15 AM EDT\n\n                                        By \nGlenn Thrush\n                                         and \nAnnie Karni\n\nInside the seven-month war within her campaign over the email scandal that just wouldn\u2019t go away.\n\n2016\n\n10/13/15 05:14 AM EDT\n\n                                        By \nKenneth P. Vogel\n                                         and \nAnnie Karni\n\nSanders prepares major fundraising push around debate.\nWe're working on more stories right now\n\nPOLITICO's live coverage of the 2016 presidential debates.\nThe latest POLITICO scoops and coverage of the 2016 elections.\n\n                AP Photo\n10/13/15 01:31 PM EDT\nLAS VEGAS \u2014 POLITICO's Gabriel Debenedetti caught up with Jennifer Palmieri, communications director for Hillary Clinton's 2016 presidential campaign, and asked her what she sees as the Democratic front-runner's opportunity in tonight's prime-time debate.\nHere's what she said:\nJust caught up with @HillaryClinton comms director @jmpalmieri. Here's what she says we can expect tonight. (1/2) pic.twitter.com/nl7B3y9bQL\n\u2014 Gabriel Debenedetti (@gdebenedetti) October 13, 2015\nMore @jmpalmieri on @HillaryClinton's message and opportunity on the debate stage tonight (2/2): pic.twitter.com/OWEsa5BhsL\n\u2014 Gabriel Debenedetti (@gdebenedetti) October 13, 2015\n \u00a9 2015 POLITICO LLC", "byline": "", "description": "LAS VEGAS - POLITICO&#39;s Gabriel Debenedetti caught up with Jennifer Palmieri, communications director for Hillary Clinton&#39;s 2016 presidential campaign, and asked her what she sees as the Democratic front-runner&#39;s opportunity in tonight&#39;s prime-time debate.", "title": "Clinton adviser spills on the front-runner&apos;s gameplan for tonight", "url": "http://www.politico.com/blogs/what-happens-in-vegas/2015/10/clinton-adviser-spills-on-the-front-runners-gameplan-for-tonight-214704", "topics": ["campaign_finance", "economy", "personality"], "people": ["Burgess Everett", "Paul Dallison", "Joe Pompeo", "Kenneth P. Vogel", "Hillary Clinton", "Elena Schneider", "Jason Millman", "Carla Marinucci", "Jeremy Barr", "Sean Hannity", "Paul Ryan", "Brian Mahoney", "Gabriel Debenedetti", "Annie Karni", "Caitlin Emma", "Jack Shafer", "Jennifer Scholtes", "Bill Clinton", "Jeb Bush", "Glenn Thrush", "Andrew Glass", "Jeremy Herb", "Alex Spence", "Eliza Collins", "Chase Purdy", "Sarah Wheaton", "Bernie Sanders", "David Pittman", "Tim Starks", "Adam Sneed", "Brianna Ehley", "Brian Faler", "Jennifer Palmieri", "Ben White", "Darren Samuelsohn", "Victoria Guida", "Eric Wolff", "Edward Snowden", "Nancy Cook"], "orgs": ["Internet Association", "Indiana Senate", "PARCC", "Tesla", "ONC", "Dell", "ACLU", "United States.", "Senate Dems", "House Freedom Caucus"], "authors": [{"author_id": 32625, "fullname": "eliza collins", "primary_org": "politico"}], "date_written": "2015-10-13 18:31:40", "org": "politico", "article_id": "daaac526af5c92cbcf6ba247dabb1df7", "date_access": "2015-10-13 18:00:14.791401"}