{"body": "\n08/28/15, 07:13 AM EDT\n\n                                        By \nLauren Dezenski\n\nBy Lauren Dezenski (ldezenski@politico.com; @laurendezenski)\n\n08/28/15, 06:22 AM EDT\n\n                                        By \nMarc Caputo\n\nLatin Builders could rebuke Trump\n\n                                        By \nMarc Caputo\n\n\nThe POLITICO Caucus\n\n08/28/15, 03:55 AM EDT\n\n                                        By \nKatie Glueck\n\nBut Democrats are more confident the governor will take the plunge than Republicans.\r\n\n\n08/31/15, 02:56 AM EDT\n\nThe POLITICO Caucus\n\n08/28/15, 03:27 AM EDT\n\n                                        By \nKatie Glueck\n\nEight out of 10 early-state Democrats think the vice president will decide against challenging Hillary Clinton in the 2016 primary.\r\n\n\n2016\n\n08/28/15, 03:00 AM EDT\n\n                                        By \nKaty O'Donnell\n\nWho would give money to a billionaire? These guys.\n\n2016\n\n08/28/15, 02:36 AM EDT\n\n                                        By \nNahal Toosi\n\nGOP hopefuls are bashing China ahead of next month\u2019s state visit.\r\n\n\n08/27/15, 10:44 PM EDT\n\n08/27/15, 10:42 PM EDT\n\nThe Friday Cover\n\n08/27/15, 09:51 PM EDT\n\n                                        By \nTony Romm\n\nSteve Jobs famously disdained D.C. Tim Cook\u2019s quietly taking it on.\r\n\n\n                                        By \nMichael Grunwald\n\nNew Orleans is rebuilding, but the real destructive force involves Congress and the Army Corps of Engineers\u2014and it's nowhere near fixed.\n\n08/27/15, 09:22 PM EDT\n\n08/27/15, 09:21 PM EDT\n\n08/27/15, 09:21 PM EDT\n\n08/27/15, 09:20 PM EDT\n\n2016\n\n08/27/15, 07:56 PM EDT\n\n                                        By \nSteven Shepard\n\nA new approach to the email scandal may help, but pollsters see a long climb ahead.\r\n\n\n08/27/15, 07:45 PM EDT\n\n                                        By \nJennifer Haberkorn\n\n\u201cCongress needs to really hammer home in their investigations.\u201d\r\n\n\n                                        By \nHenry C. Jackson\n\nHILLARY CLINTON talks gun violence in Ohio.\r\n\n\n08/27/15, 07:41 PM EDT\n\n                                        By \nHenry C. Jackson\n\nThe Progressive Resistance\r\n\n\n2016\n\n08/27/15, 07:24 PM EDT\n\n                                        By \nBen Schreckinger\n                                         and \nHadas Gold\n\nAs the controversies pile up, Trump\u2019s favorability soars.\r\n\n\n08/27/15, 07:15 PM EDT\n\n                                        By \nHadas Gold\n\nCNN announced there will be three hours between the debate for the lower-tiered candidates and those at the top of the heap.\u00a0\n\nVoter Fraud\n\n08/27/15, 07:05 PM EDT\n\n                                        By \nNicholas Kusnetz\n\nThe integrity of the election is under threat\u2014in Ohio and across the country.\r\n\n\n                                        By \nMichael Grunwald\n\nNew Orleans is rebuilding, but the real destructive force involves Congress and the Army Corps of Engineers\u2014and it's nowhere near fixed.\r\n\n\n2016\n\n08/27/15, 05:50 PM EDT\n\n                                        By \nGabriel Debenedetti\n\nThe weakened front-runner is going to Democratic elites with one message: My campaign is on track.\r\n\n\n08/27/15, 04:31 PM EDT\n\n                                        By \nMike Allen\n\nThe former House majority leader will also be named a Virginia state co-chair of Bush's presidential campaign.\r\n\n\n08/27/15, 04:24 PM EDT\n\n                                        By \nPOLITICO Staff\n\n\n08/27/15, 04:11 PM EDT\n\n08/27/15, 03:59 PM EDT\n\n                                        By \nEdward-Isaac Dovere\n                                         and \nGabriel Debenedetti\n\nClinton wouldn\u2019t have access to the money unless and until she\u2019s the nominee.\r\n\n\n08/27/15, 03:13 PM EDT\n\n                                        By \nSeung Min Kim\n\nThe campaign rivals team up for a joint attack on Obama\u2019s nuclear deal with Iran.\r\n\n\n08/27/15, 02:59 PM EDT\n\n                                        By \nEdward-Isaac Dovere\n\nA resolution honoring the vice president\u2019s son comes as his father weighs a presidential run.\r\n\n\nThe Friday Cover \n\n07/31/15, 12:00 AM EDT\n\n08/27/15, 01:40 PM EDT\n\n                                        By \nPOLITICO Magazine\n\n\n08/27/15, 01:22 PM EDT\n\n08/27/15, 01:22 PM EDT\n\n08/27/15, 01:22 PM EDT\n\n08/27/15, 01:21 PM EDT\n\n08/27/15, 01:14 PM EDT\n\n08/27/15, 01:13 PM EDT\n\n08/27/15, 01:13 PM EDT\n\n08/27/15, 01:12 PM EDT\n\n08/27/15, 01:09 PM EDT\n\n                                        By \nEliza Collins\n\nSaudi Arabia has expressed concerns that the deal would strengthen Iran, its major rival in the region.\r\n\n\n08/27/15, 01:05 PM EDT\n\n                                        By \nEdward-Isaac Dovere\n\nThe meeting with was meant to be private \u2014 Biden\u2019s official schedule only had him meeting with \u201csenior advisers.\u201d\r\n\n\n08/27/15, 01:05 PM EDT\n\n                                        By \nJacob Soll\n\nThe Chinese crisis has important echoes of the Soviet Union and history tells us the outlook isn't pretty.\r\n\n\n08/27/15, 01:00 PM EDT\n\n                                        By \nNick Gass\n\n\u201cI don\u2019t wear a toupee. It\u2019s my hair. I swear!\u201d\r\n\n\n08/27/15, 12:54 PM EDT\n\n                                        By \nBrianna Ehley\n\nShe says Jeb Bush and Sen. Marco Rubio for having \u201cextreme views on women.\u201d\r\n\n\n08/27/15, 12:18 PM EDT\n\n                                        By \nHadas Gold\n\nRoger Ailes may have called on Trump to apologize but the underlying message he's sending through his hosts: Stick to the issues.\u00a0\n\n08/27/15, 12:09 PM EDT\n\n                                        By \nGabriel Debenedetti\n\n\"He did a great job as your governor, and he will be an important voice in the Senate.\"\r\n\n\n08/27/15, 11:59 AM EDT\nWe're working on more stories right now\nMassachusetts Playbook\n\n            By \nLauren Dezenski\n\n08/28/15, 07:13 AM EDT\nBy Lauren Dezenski (ldezenski@politico.com; @laurendezenski)\nTGIF, MASSACHUSETTS! Somuch for a quiet news day on your penultimate summer Friday. Here\u2019s to (naively) hoping the loads of people attending the Donald Trump fundraiser in Norwood tonight make Cape traffic a little lighter. \n-- Car dealership magnate Ernie Boch Jr. hosts fundraiser for Donald Trump tonight \u2013 as the Boston Herald\u2019s Chris Cassidy and Gayle Fee report, Boch is living up to his namesake commercials, inviting everyone to \u201ccome on down\u201d \u2013 even if you\u2019re a protester. Boch spitballed an estimate of 1,000 attendees to the event, with admission at $100 a head. \u201cSome 75 or more sign-waving, pro-choice activists are expected to descend on Boch\u2019s Norwood manse today to protest Trump, said one of the organizers\u201d for NARAL Pro-Choice Massachusetts. \u2026 \u201cMore than 100 media members will cover the event, including CNN, which is broadcasting live from the party.\u201d ...\n-- \u201cThe invitation-only soiree will feature cocktails, live music by rock cover band Fortune, a live broadcast by Herald columnist and talk-show host Howie Carr and food from chef Tony Ambrose. That all-American menu will include Cape Cod striped bass, Maine lobster, Concord heirloom tomatoes and \u2018Great American fried surf clam.\u2019\u201d \u2026 \n-- \u201cI knew it would be busy but I had no idea,\u201d Boch said. \u201cHundreds of people have askedme, and hundreds of people are asking hundreds of people who know me. I have people from high school calling me. My enemies are calling me! You\u2019ve got toadmit, Trump has changed the game.\u201d http://bit.ly/1NDVv8O \n-- QUIZ, for while you\u2019re fired up waiting in line to see Trump: \u201cCan you match the Donald Trump insult to the target?\u201d from the Boston Globe. Can you beat my score of 8/14? Probably. In my defense, I did it at like 5 a.m. http://bit.ly/1NLdrNT \n-- ALSO TODAY: WYNN CASINO PERMIT DECISION -- From the State House News Service daily schedule: \u201cSecretary of Energy and Environmental Affairs Matthew Beaton will sign a decision on the omnibus permit sought by Wynn Resorts on Friday. The Massachusetts Environmental Policy Act permit would allow Wynn to undergo lower-level permitting on its plans to construct a resort casino and grounds on a polluted former chemical plant that lies in the shadow of a major natural gaspower plant. Wynn has touted environmental aspects of its project in press releases in recent weeks.\u201d \nTHE HOME TEAM -- Did the Soxwin? Yes! They beat the Chicago White Sox 3-0. http://bit.ly/1LzL3Mm \n A BASEMENT REBORN --\u201cFilene\u2019s Basement to be reborn as a low-price online retailer,\u201d byCallum Borchers, Boston Globe: \u201cFilene\u2019s Basement, the legendary discount retailer that went bankrupt and closed four years ago, is making a comeback under new ownership as a low-price e-tailer. \u2026 \u2018We\u2019re launching our new website in a few weeks & we can\u2019t wait to see you there,\u2019 the company tweeted Wednesday, adding a link where shoppers can sign up to be notified of theopening.\u201d http://bit.ly/1JmuOit \nGREEN LINE EXTENSION INTRIGUE-- \u201cT spin on the Green Line Ext.: In June emails, official said \u2018nothing has changed,\u2019\u201d by Bruce Mohl, CommonWealth Magazine: \u201cI heard the cost of the Green Line Extension was spinning out of control in early June, but I had no proof and ended up not writing anything. That\u2019s my bad. But my back-and-forth with the MBTA on the issue, all captured in emails, is nevertheless very revealing about the mindset of government officials, and their willingness to be open about a major setback for a key transportation project.\u201d http://bit.ly/1JAIKEQ \n-- HOW TO GET AWAY WITH CALLING THE GUV CHEAP: \u201cTough choices on Green Line project, but it isn\u2019t derailed yet,\u201d by Shirley Leung, Boston Globe: \u201cCharlie Baker may be cheap, but he\u2019s not stupid. \u2026 Even in the face of stomach-churning runaway costs, the governor is going to find a way to get the Green Line extensiondone. Greater Boston needs it \u2014 and he can\u2019t risk losing nearly $1 billion of federal money for the project.\u201d http://bit.ly/1LFH0AX \nIS HE HIGH ON THE LIST? -- \u201cBaker makes marijuana advocates\u2019 list of 50 most influential consumers,\u201d by David Scharfenberg, Boston Globe: \u201cThe governor has repeatedly declared his opposition to marijuana legalization.\u201d http://bit.ly/1F0kQ4z \nCHARLIE HEADS NORTH -- \u201cBaker headed to Newfoundland for energy talks,\u201d by Matt Murphy and Michael Norton, State House News Service: \u201cBaker plans to travel to St. John's, Newfoundland for the annual Conference of New England Governors and Eastern Canadian Premiers, where discussions are expected to focus on energy and innovations in the energy sector that could help mitigate climate change, the governor\u2019s office confirmed Thursday.\u201d \u2026 Baker travels \u201cto Canada on Sunday and returning to Massachusetts on Tuesday morning.\u201d http://bit.ly/1LFPwjl \nTHE ILLEGAL CAPE COD LIZARD -- \u201cMonitor lizard found wandering Yarmouth neighborhood,\u201d by Ethan Genter, Cape Cod Times: \u201cOn Wednesday, a 2 1/2-foot-long Savannah monitor lizard was found meandering through a residential neighborhood in Yarmouth \u2026 Police also noted the lizard is not legal to possess in the state.\u201d http://bit.ly/1VgZbOU \nALL\u2019S PRETTY ADORABLE IN LOVEAND POLITICS -- \u201cLove, politics, and a tale of two struggling cities,\u201d by Meghan E. Irons, Boston Globe: \u201cAnd so began the Massachusetts romance between the mayor and the city councilor, a long-distance affair sealed over campaign functions, glad-handing, and community dinners. As they traveled between two cities \u2014 an hour-and-a-half drive apart \u2014 over the next three years, they grew closer. He was her plus one. And everyone took notice. \u2026 When they got married in November, some of their supporters dreaded what they would do next. Would she leave her beloved Fitchburg? Would he ditch his hometown of Holyoke?\u201d http://bit.ly/1NKz14Q \nKIDS THESE DAYS -- \u201cCape teen casts vote for activism: 15-year-old organizes presidential campaign events,\u201d by Haven Orecchio-Egresitz, Cape Cod Times: \u201cJake Tibbetts won\u2019t be old enough tovote in 2016, but that isn\u2019t stopping him from putting great efforts into rallying fellow Cape Codders around the campaign he is most passionate about. \u2026 While participating in an international affairs program at the University of Pennsylvania this summer, the 15-year-old Osterville resident was simultaneously organizing a campaign event for Democratic presidential candidate Bernie Sanders.\u201d \u2026 \n-- \u201c\u2018I actually used to be a right-leaning libertarian, until I began to get tired of the crony capitalist views,\u2019 Jake said before the event he organized for the Vermontsenator at Freedom Hall in Cotuit on Wednesday night. \u2018But once I started to realize that democratic socialism isn\u2019t this sort of dangerous thing that a lot of the times the public makes it seem, I really started to tap into that message.\u2019\u201d http://bit.ly/1KRoQGA \nWOOD WAR --Herald: \u201cIF THEY WANT TO PROTEST HIS TRUMP PARTY, ERNIE BOCH JR. SAYS \u2026 COME ON DOWN!: The Donald hits car magnate\u2019s manse tonight,\u201d \"Miracle pup on mend,\u201d \u201cHERE\u2019S THE PICTURE: Buckley: How to improve baseball on television.\u201d -- Globe: \u201cBuilders miss city diversity targets,\u201d \u201cClash of visions in the square,\u201d \u201c300,000 in Mass. to see health policy rates raise 6%,\u201d \u201cLong-lauded ex-city officer killed in Haitian homeland,\u201d \u201cJurors take up prep school rape case.\u201d\nMCGOVERN NOT INTERESTED IN CUBAN POST -- \u201cRep. McGovern, on a tour in Northbridge, touts needs of farmers,\u201d by Susan Spencer, Worcester Telegram & Gazette: \u201cMr. McGovern said he reminds the U.S. Secretary of Agriculture, \u2018It's not just in the midwest. It's here.\u2019 \u2026With more than 1,000 farms in his congressional district, the \u2018buy local\u2019 movement, immigration reform and food safety policies are big issues.\u201d \u2026 \n-- PULL QUOTE: \u201cDespite the heated legislative battles on Capitol Hill, Mr.McGovern said he wasn't interested in trading his job for a possible ambassadorship to Cuba. \u2026 \u2018No, I'm happy where I am right now,\u2019 he said. \u2018My Spanish is not good.\u2019 \u2026 He added, \u2018I think the U.S. Senate ought to approve anambassador to Cuba.\u2019\" http://bit.ly/1Ko8EAU\nBUT WHAT IF I WANT TO VOTE FOR BENJAMIN DOVER -- \u201c\u2018Tom Brady Sketch\u2019 and \u2018Elizabeth Ann Warren\u2019 file to run for president,\u201d by Eric Levenson, Boston.com: \u201cThe Federal Election Commission has seen a dramatic rise in fake candidates in the past week, ever since a 15-year-old in Iowa filled out a form to run forpresident as \u2018Deez Nuts.\u2019\u201d http://bit.ly/1UfZaZo \nSORRY GUV, A LITTLE BUSY -- \u201cRox. residents to Baker admin: We\u2019re busy Sept. 8. Voting!\u201d by Yawu Miller, Bay State Banner: \u201cMany Roxbury residents were excited to receive an invitation from the Massachusetts Office of Business Development for a listening session with Gov. Charlie Baker and Secretary of Housing and Economic Development Jay Ash. That is, until they read the September 8 date. \u2026 That date, the Tuesday after Labor Day, is the day of the city\u2019s preliminary election for City Council. With contested races in Roxbury\u2019s District 7 and Dorchester\u2019s District 4, many of the most active, civically-engaged residents in Boston\u2019s black community are likely to be volunteering on a campaign, working on voter turnout, volunteering at a polling place or simply casting a ballot at event\u2019s 6 p.m. start time.\u201d http://bit.ly/1NXQkh0 \u2026 \n-- \u201cForum moved to 9/10 to avoid the 9/8 primary. Spread the word & join me for a lively discussion!\u201d Ash tweeted last night http://bit.ly/1hJeL7V \n-- ALSO FOR YOUR BOSTON CITY COUNCIL RACE RADAR: \u201cThree challengers for Council seats say no to pay raise,\u201d by Jennifer Smith, Dorchester Reporter: http://bit.ly/1VeTb9A \n-- EMILY\u2019S LIST ENDORSES FOURTH BOSTON CITY COUNCIL CANDIDATE: Statement: \u201cEMILY\u2019s List ... endorsed Annissa Essaibi George for Boston City Council. Annissais the fourth woman of color that EMILY\u2019s List has endorsed for Boston City Council in the 2015 cycle, joining Ayanna Pressley, Michelle Wu, and Andrea Campbell. Boston elected the first woman of color to the City Council in its 105-year history just six years ago when Pressley was elected in 2009.\u201d \nDATELINE CAPE COD: \u201cThebattle to save the beach on Cape Cod,\u201d by Charlotte Wilder, Boston.com: \u201cNew England\u2019s record-shattering winter, when Juno\u2014one of the massive snowstorms that pummeled Massachusetts\u2014sent waves crashing onto Town Neck Beach in Sandwich, a historic town that contains miles of coastal marshland. The sea swallowed dunes, flooded the homes behind them, and drowned septic systems and boardwalks. After the storm, Sandwich authorities declared astate of emergency and condemned over a dozen houses on Town Neck Beach. Meanwhile, houses across the canal on neighboring Scusset Beach were fine. ...Standing on his shrunken front yard in front of the ocean that drowned the public beach in front of his house, retired firefighter Paul Schneider lookedat the sand he\u2019d bought and placed on his property after the storm.\u201d ...\n-- \u201c\u2018I didn\u2019t think I\u2019d be spending my retirement money on sand,\u2019 he said.\u201d http://bit.ly/1i5ac7Q \nEYE ON SUPER TUESDAY --\u201cHillary builds a Super Tuesday firewall,\u201d by Gabriel Debenedetti, POLITICO: \u201cBernie Sanders is soaring in the polls. Joe Biden is making increasingly loud noises about joining the race. But Hillary Clinton\u2019s campaign staffers are working methodically to build the fail-safe they think can secure the nomination, and it\u2019s pegged to a single day on thecalendar: March 1, 2016. \u2026 Super Tuesday.\u201d http://politi.co/1EkzdG0 \n-- FUEL FOR THOSE WEEKEND CONVOS ABOUT 2016: \u201cDemocratic insiders: Joe Biden won't run,\u201d by Katie Glueck, POLITICO Caucus: \u201cThe vast majority of Democratic insiders from the early states don\u2019t believe Joe Biden will run for president, despite evidence that he is seriously considering a 2016 bid. \u2026 That\u2019s the assessment of the POLITICO Caucus, our weekly bipartisan survey of the top strategists, activists and operatives in Iowa and New Hampshire.\u201d http://politi.co/1Eoy1le \nDATELINE DORCHESTER: \u201cSeller\u2019s market: Boom creates new pressures in Dot market,\u201d by Jennifer Smith, Dorchester Reporter: \u201cThe housing market in Dorchester has been experiencing a price surge that is in line with much of Boston in the past fewyears. But the \u2018booming\u2019 state of the market belies a badly-needed influx of new units, which realtors and prospective buyers hope will accompany the Walsh administration\u2019s plan to build out new housing stock. ... Home prices have beenrising rapidly, though the statistics are complicated somewhat by the recession causing an anomalistic dip in 2009. The median home sales price has risen about 38 percent in Dorchester and 32 percent citywide \u2014 to $385,000 and $499,900 respectively \u2014 in the last five years, according to data from the Department of Neighborhood Development. http://bit.ly/1LzJ6iX \nI\u2019VE GOT THE BLACK LUNG, POP -- \u201cYear-long exposure to Springfield air is like smoking seven cigarettes, graphic shows,\u201d by Laura Newberry, Masslive.com: \u201cLiving in Springfield for a year is equivalent to smoking seven cigarettes, according to live data provided by the U.S. Environmental Protection Agency on Thursday morning.\u201d http://bit.ly/1hIKqXc \nMAZEL! --Happy weekend birthdays to PR pros Colin Riley of Boston University and Kelly Smith of Solomon McCown and previously the MBTA.\n-- Happy new job to Jason Wentworth, who was named assistant commissioner to the Department of Agricultural Resources yesterday.\n-- \u201cSen. Benjamin Downing selected as CSG Toll Fellow,\u201d from iBerkshires.com: \u201cEach year, the program brings 48 of the nation\u2019s top officials from all three branches of state government to Lexington, Ky., for an intensive six-day, five-night intellectual boot camp.\u201d http://bit.ly/1JnGrpt \nHave a tip, story,suggestion, birthday, anniversary, new job, or any other tidbit for thePlaybook? Get in touch: ldezenski@politico.com\nGREAT HEADLINE -- \u201cWritey Bulger: Almost two years into his two lifetime prison sentences, James \u2018Whitey\u2019 Bulger is taking pen to paper,\u201d by Erick Trickey, Boston Magazine: \u201cThe envelope, addressed by hand in meticulous, slashing cursive, arrived at the Boston magazine offices without fanfare. Our receptionist saw the name on the return address and thought it might be worth an editor\u2019s attention. A Mr. James Bulger, prisoner ID number 02182748, from the high-security U.S. penitentiary in Coleman, Florida, was requesting a change of address for his subscription. \u2018Look forward to your magazine,\u2019 Bulger penned in his own hand.\u201d http://bit.ly/1NXLmAE \n#MAPOLI TWEET OF THE DAY: \u201cDidYou Know...@SoniaChangDiaz still drives a car with a tape deck.#MapoliDidUKnow\u201d via @MA_Senate http://bit.ly/1Imb1ho \nOH GOOD -- \u201cState health officials announce first human case of West Nile Virus in Massachusetts,\u201d statement from the Massachusetts Department of Public Health: \u201cThe patient is a resident of Middlesex County in his 40\u2019s who was diagnosed with WNV by testing completed today by the State Public Health Laboratory. The patient remains hospitalized. \u2026 In 2014, there were six human cases of WNV infection identified in Massachusetts.\u201d\nDATELINE DEAD DIRIGIBLES: \u201cGoodyear retiring blimps, rolling out new cigar-shaped craft,\u201d by John Rogers and Jae C. Hong, Associated Press via Fox 25: \u201c\u2018It\u2019s a brand new design. It is a much larger airship. It\u2019s a semi-rigid dirigible,\u2019 Goodyear\u2019s Priscilla Tasker said of the new fleet of non-blimps replacing the company\u2019s three aging U.S. airships.\u201d http://bit.ly/1KprK9R \nICYMI -- SAUGUS DINO SAGA: \u201cResidents don\u2019t want Route 1 dinosaur to go extinct,\u201d by Steve Annear, Boston Globe: \u201cAs the parcel of land where the decades-old dinosaur stands readies for redevelopment, the fate of the creature hangs in the balance. \u2026 Fans of the 20-foot-tall landmark have rallied together and started a Facebook group dedicated to trying to preserve a piece of the town\u2019s history.\u201d http://bit.ly/1KR5zVK \nDATELINE SOMERVILLE: \u201cHill Street booze: Winter Hill Brewing is coming, blocked a Starbucks along the way,\u201d by Dan McCarthy, Dig Boston: \u201cOnce the 60-seat brewpub gets up and running this fall (they\u2019re aiming for November), they\u2019re going to be using the space as a morning grab-and-go cafe, exclusively featuring Somerville\u2019s Counter Culture Coffee out of Union Square.\u201d http://bit.ly/1EnnUND\nTHE TIMES IS ON IT [THE CAPE]-- \u201cThe calming quiet of outer Cape Cod,\u201d byGuy Trebay, New York Times: \u201cWELLFLEET, Mass. \u2014 In flight from thebottles-and-models excesses of the Hamptons, the drag-queen hucksters of Provincetown and the hedge-funder mosh pit that Nantucket Island has become, a flock of creative types has steadily traced a route to an alternative getaway.... Refugees from the hectic pace of places where summer is less a season than a verb, they head instead to Wellfleet and Truro, two somnolent former whaling towns on the scrubby reaches of Outer Cape Cod in Massachusetts.\u201d http://nyti.ms/1KaNRCk \nPUBLIC SERVICE JOURNALISM --\u201cYou can now upload landscape and portrait photos to Instagram,\u201d by Nicole Nguyen, Buzzfeed: \u201cTo use the new format, tap the upload button, choose a photo from your gallery, and tap the new button on the bottom left. \u2026 You can then pinch and zoom to change the aspect ratio. That\u2019s it!\u201d http://bzfd.it/1LE3SRk \nDEPARTMENT OF CORRECTIONS - -Apologies to Dan Kennedy, whom I misidentified as John Kennedy on Wednesday, and Shira Schoenberg, whose name I misspelled on Thursday, in this week\u2019s playbooks. \nHave a great weekend, folks. See you Monday. \n\n                                            By \nCaleb Hannan\n\n\n                                            By \nMichael Brown\n\n\n                                            By \n                                                    Amb. Samantha Power\n\n\n                                            By \nBill Scher\n\nLauren Dezenski is a reporter.\n \u00a9 2015 POLITICO LLC", "byline": "", "description": "By Lauren Dezenski (ldezenski@politico.com; @laurendezenski)", "title": "POLITICO Massachusetts Playbook: TRUMP fundraiser tonight -- BAKER named influential marijuana consumer -- CAPE COD LIZARD", "url": "http://www.politico.com/tipsheets/massachusetts-playbook/2015/08/politico-massachusetts-playbook-trump-fundraiser-tonight-baker-named-influential-marijuana-consumer-cape-cod-lizard-210021", "topics": ["campaign_finance"], "people": ["Roger Ailes", "Katy O'Donnell", "Michael Grunwald", "Nicholas Kusnetz", "D.C. Tim Cook", "Steve Jobs", "Henry C. Jackson", "Caleb Hannan", "Hadas Gold", "Marc Caputo", "John Kennedy", "Steven Shepard", "Nicole Nguyen", "Jacob Soll", "Joe Biden", "Eric Levenson", "Lauren Dezenski", "Matt Murphy", "Dan Kennedy", "Nahal Toosi", "Gabriel Debenedetti", "Brianna Ehley", "James 'White", "Katie Glueck", "Nick Gass", "Samantha Power", "Priscilla Tasker", "David Scharfenberg", "Isaac Dovere", "Jeb Bush", "Seung Min Kim", "Shira Schoenberg", "Donald Trump", "Bruce Mohl", "Marco Rubio", "Eliza Collins", "Tony Ambrose", "Bernie Sanders", "Jae C. Hong", "Meghan E. Irons", "Howie Carr", "Jennifer Smith", "Ben Schreckinger", "Tony Romm", "Jennifer Haberkorn", "Mike Allen", "Michael Brown", "Hillary Clinton", "Ernie Boch Jr.", "Bill Scher", "Charlie Baker"], "orgs": ["City Council", "University of Pennsylvania", "TRUMP", "Army Corps of Engineers", "Senate", "Boston University", "Amb", "U.S. Environmental Protection Agency", "Boston Magazine", "Congress", "MBTA", "Starbucks", "Council", "Federal Election Commission", "Latin Builders", "U.S. Senate", "EMILY"], "authors": [{"author_id": 37730, "fullname": "lauren dezenski", "primary_org": "politico"}], "date_written": "2015-08-28 12:13:03", "org": "politico", "article_id": "5eec4270ab8016d643527d8b4579545a", "date_access": "2015-08-28 11:20:12.560717"}