{"body": "\n09/23/15, 12:14 PM EDT\n\n09/23/15, 12:14 PM EDT\n\n                                        By \nAndrew Restuccia\n                                         and \nDarren Goode\n\n\"I'll certainly listen respectfully, but I don't think that his speech is going to change my mind on it,\" says Sen. John Barrasso.\n\n09/23/15, 12:08 PM EDT\n\n                                        By \nNick Gass\n\nHe says the moratorium will last \"for the forseeable future.\"\n\n09/23/15, 12:01 PM EDT\n\n                                        By \nNick Gass\n\nTo Donald Trump, \"God is the ultimate.\"\n\n09/23/15, 11:59 AM EDT\n\n                                        Updated 09/23/15, 11:59 AM EDT\n\n                                        By \nBen Schreckinger\n\nFacing off with the razor-sharp comedian, a subdued front-runner grins and bears it.\n\n09/23/15, 11:55 AM EDT\n\n                                        By \nDaniel Strauss\n\n\"Though there are a few clunkers, many of his ideas are excellent.\"\n\n09/23/15, 11:50 AM EDT\n\n09/23/15, 11:42 AM EDT\n\n                                        By \nBen Schreckinger\n\nAri Fleischer and Michael Steele are among those concerned about Trump's impact. \n\n09/23/15, 11:30 AM EDT\nPope Francis' full remarks. \n\n09/23/15, 11:24 AM EDT\nRead Obama's full remarks. \n\n                                        By \nAlex Spence\n\n\n                                        By \n                                                Sebnem Arsu\n\n\n09/23/15, 10:27 AM EDT\n\n                                        By \nAndrew Restuccia\n\nThe pope made climate change a central part of his remarks, a signal that the issue will take center stage during his trip through the United States.\n\n09/23/15, 10:07 AM EDT\n\n                                        By \nEric Wolff\n\nPope has a busy day \u2014 Wal-Mart goes all renewable \n\n09/23/15, 10:06 AM EDT\n\n                                        By \nKaty O'Donnell\n\nFinance ministers call for minimum tax across EU\n\n09/23/15, 10:06 AM EDT\n\n                                        By \nCaitlin Emma\n\nNew criticism of college scorecard \u2014 'Freshman year for free' a growing option\n\n09/23/15, 10:06 AM EDT\n\n                                        By \nJennifer Scholtes\n\nFAA patch rides CR coattails \u2014 \u2018Defeat device\u2019 prevalence prompts worldwide scrutiny \u2014 Hatch says nobody\u2019s touching Senate highway money\n\n09/23/15, 10:05 AM EDT\n\n                                        By \nBrian Mahoney\n\n$15 won't go on ballot in K.C. \u2014 LIUNA livid over Hillary's Keystone stance\n\n09/23/15, 10:05 AM EDT\n\n                                        By \nAdam Sneed\n\nPritzker promises tough talk \u2014 House panel plans sharing-economy hearing\n\n09/23/15, 10:04 AM EDT\n\n                                        By \nNick Gass\n\nBernie Sanders draws strong parallels between his campaign's message those of Pope Francis.\n\n09/23/15, 10:04 AM EDT\n\n                                        By \nAdam Behsudi\n\nNew TTIP tariff offers expected before next round \u2013 Vatican\u2019s skeptical of TPP\n\n09/23/15, 10:04 AM EDT\n\n                                        By \nDarius Tahir\n\nWhy did Apple hinder an app? \u2014 Precision Medicine marches on\n\n09/23/15, 10:03 AM EDT\n\n                                        By \nErin Mershon\n\nSenate readies itself for spending action and defunding Planned Parenthood after Popemania \u2014 Turing CEO to lower Daraprim price \n\n09/23/15, 10:03 AM EDT\n\n                                        By \nBill Tomson\n\nGMO corn, soy and cotton await China\u2019s approval \u2014 Havana holds the keys to Cuba reform\n\n09/23/15, 10:02 AM EDT\n\n                                        By \nTim Starks\n\nXi huddles with tech execs today \u2013 Hackers won\u2019t bother stealing from Greece\n\n09/23/15, 10:01 AM EDT\n\n                                        By \nTheodoric Meyer\n\nInside Scott Walker's fall\n\nPhoto gallery\n\n09/23/15, 09:58 AM EDT\n\n                                        By \n                                                POLITICO Staff\n\n\n09/23/15, 09:58 AM EDT\n\n                                        By \nAndrew Glass\n\nOn this day in 1930, the last congressional veteran of the Civil War, died in office at the age of 89 years, 7 months and 25 days.\n\n                                        By \n                                                Matt Friedman\n\n\n09/23/15, 08:32 AM EDT\n\n                                        By \nJeremy Herb\n\nPetraeus apologizes and knocks White House strategy \u2014 Carter, Norwegian defense minister to Norfolk\n\n09/23/15, 08:32 AM EDT\n\n                                        By \nNahal Toosi\n\nThe pontiff weighed in on immigration, climate change and religious freedom in remarks that could make Republicans uncomfortable.\n\n09/23/15, 08:13 AM EDT\n\n                                        By \nLauren French\n\nCalifornia Rep. Adam Schiff will begin circulating Wednesday a letter among his House colleagues.\n\n09/23/15, 08:08 AM EDT\nMore email troubles for Hillary Clinton are worrying her biggest fans in the Senate.\n\n09/23/15, 08:01 AM EDT\n\n                                        By \nBen White\n\nHillary a no on Keystone \u2014 Blankfein fighting cancer \u2014 Car industry in turmoil \n\n09/23/15, 07:59 AM EDT\n\n                                        By \nNick Gass\n\nChinese President Xi Jinping is no Frank Underwood, apparently.\n\nSIMON SAYS\n\n09/23/15, 07:51 AM EDT\n\n                                        By \nRoger Simon\n\nSimon says his assertions were bigoted and ignorant, but that's been playing well in the Republican Party this year.\n\n09/23/15, 07:49 AM EDT\nHurricane Sandy program houses 8.\n\n09/23/15, 07:39 AM EDT\nAndrew Cuomo on Pope Francis.\n\n09/23/15, 07:34 AM EDT\n\n                                        By \nNick Gass\n\nEnergy Secretary Ernest Moniz has a message for opponents of the nuclear deal with Iran: It's happening. And the next president would foolish to rip it...\n\n09/23/15, 07:32 AM EDT\nMBTA report cites \u2018serious\u2019 problems.\n\n                                        By \nMichael Grunwald\n\nArne Duncan has tried to reshape American schools. Now will the backlash erase his legacy?\n\n09/23/15, 07:11 AM EDT\nPAPAL PLAYBOOK \u2013 HOW ARNE DUNCAN changed D.C. \u2013 FBI RECOVERS Hillary email? \u2013 YOGI BERRA\u2019s best -- B\u2019DAY: Sean Spicer, Michael Schmidt\n\nHistory Dept.\n\n09/23/15, 06:59 AM EDT\n\n                                        By \n                                                Josh Zeitz\n\nIn the late 19th century, statesmen feared that Catholics were something less than civilized (and less than white). \n\n                                        By \n                                                Matt Dixon\n\n\n                                        By \nDarren Samuelsohn\n                                         and \nDanny Vinik\n\nAt the time it was an epic achievement, bringing together Bush, Kennedy, Boehner and more. Here\u2019s how it got done, told by the people in the room.\n\n                                        By \nMaggie Severns\n\nEight cutting-edge proposals for tackling America\u2019s next great financial crisis.\n\n                                        Updated 09/23/15, 06:28 AM EDT\n\n                                        By \nNick Gass\n\nVice President Joe Biden surged in a new poll released Wednesday morning, even though he has not announced his intentions for the presidency.\n\n09/23/15, 06:00 AM EDT\nFlorida politician caught-on-audio: \u2018Any reporters?...So inside game\u2026'\n\n09/23/15, 05:32 AM EDT\n\n                                        By \nMike Allen\n                                         and \nAlex Isenstadt\n\n\"It's a f---ing bitch, man,\" Rick Wiley tells POLITICO of the Wisconsin governor's stunning collapse.\nWe're working on more stories right now\n\n\n                                            By \n                                                    Ted Widmer\n\n\n                                            By \n                                                    Fr. Sean Carroll\n\n\n                                            By \nJack Shafer\n\n\n                                            By \n                                                    Josh Zeitz\n\n\n                AP Photo\n\n            By \nNick Gass\n\n09/23/15, 12:01 PM EDT\nTo Donald Trump, \"God is the ultimate.\"\nIn a recent interview with CBN News' \"The Brody File,\" the Republican candidate marveled at his wealth and good fortune at Trump National Golf Club in Rancho Palos Verdes, California, outside of Los Angeles.\n\"You know, you look at this? Here we are on the Pacific Ocean. How did I ever own this? I bought it 15 years ago. I made one of the great deals, they say, ever. I have no more mortgage on it as I will certify and represent to you. And I was able to buy this and make a great deal,\" Trump explained. \nTrump said he wants to make great deals for the country, but that \"God is the ultimate.\"\n\"I mean, God created this,\" Trump said, pointing to his golf course, \"and here\u2019s the Pacific Ocean right behind us. So nobody, no thing, no there\u2019s nothing like God.\u201d\n \u00a9 2015 POLITICO LLC", "byline": "", "description": "", "title": "Trump on his golf course: 'God created this'", "url": "http://www.politico.com/story/2015/09/donald-trump-golf-course-god-created-213970", "topics": ["china", "immigration", "economy"], "people": ["Katy O'Donnell", "Michael Grunwald", "Sean Spicer", "John Barrasso", "Erin Mershon", "Ari Fleischer", "Ted Widmer", "Orrin Hatch", "David Petraeus", "Roger Simon", "Danny Vinik", "Adam Schiff", "Joe Biden", "John Boehner", "Brian Mahoney", "Jeremy Herb", "Theodoric Meyer", "Nahal Toosi", "Darius Tahir", "Pope Francis", "Michael Steele", "Andrew Restuccia", "Xi Jinping", "Scott Walker", "Nick Gass", "Jack Shafer", "Lauren French", "Jennifer Scholtes", "Adam Behsudi", "Alex Isenstadt", "Michael Schmidt", "Rick Wiley", "Andrew Glass", "Donald Trump", "Alex Spence", "Darren Goode", "Bernie Sanders", "Matt Dixon", "Tim Starks", "Arne Duncan", "Josh Zeitz", "Andrew Cuomo", "Sean Carroll", "Adam Sneed", "Ben Schreckinger", "Sebnem Arsu", "Daniel Strauss", "Mike Allen", "Hillary Clinton", "Frank Underwood", "Matt Friedman", "Ben White", "Darren Samuelsohn", "Eric Wolff", "Bill Tomson", "Ernest Moniz", "Maggie Severns", "Caitlin Emma"], "orgs": ["K.C.", "Hackers", "Senate", "Republican Party", "MBTA", "United States.", "FBI", "FAA"], "authors": [{"author_id": 30862, "fullname": "andrew restuccia", "primary_org": "politico"}, {"author_id": 30897, "fullname": "darren goode", "primary_org": "politico"}], "date_written": "2015-09-23 17:01:44", "org": "politico", "article_id": "5ad717752007ad500d65e03a1a240f75", "date_access": "2015-09-23 16:20:11.049294"}