{"body": "\n09/28/15 07:42 AM EDT\n\n                                        By \nNick Gass\n\nMarco Rubio wants no part of Donald Trump's \"freak show,\" he said.\n\n09/28/15 07:36 AM EDT\n\n                                        By \nNick Gass\n\nIranian President Hassan Rouhani says the country is open to discussing the future of Syria after Bashar Assad with the United States.\n\n09/28/15 07:29 AM EDT\n\n                                        By \nNick Gass\n\nHillary Clinton's use of a private email server does not constitute a national security breach, former Secretary of State Madeleine Albright said.\n\n09/28/15 07:05 AM EDT\nPREET\u2019s next move.\n\n09/28/15 07:01 AM EDT\n\n                                        By \nNick Gass\n\nRep. Daniel Webster pitched himself as the next speaker of the House on Monday.\n\n09/28/15 06:50 AM EDT\n\n                                        By \nAnna Palmer\n\nPrice is said to be considering a bid for House Majority Leader, but his message did not announce a formal bid.\n\n09/28/15 06:47 AM EDT\nCHRIS CHRISTIE gets an Iowa boost.\n\n09/28/15 06:37 AM EDT\nELIZABETH WARREN\u2019S Black Lives Matter speech.\n\n09/28/15 06:30 AM EDT\nFLORIDA REDISTRICTING DISCORD: more dysfunction likely.\n\n09/28/15 06:26 AM EDT\n\n                                        By \nNick Gass\n\nNearly seven in 10 Americans--69 percent--oppose shutting down the government over funding Planned Parenthood, according to the poll.\n\nWealth Of Nations\n\n09/28/15 05:20 AM EDT\n\n                                        By \n                                                Robert B. Reich\n\nOn the opening day of Trump Plaza in Atlantic City in 1984, Donald Trump stood in a dark topcoat on the casino floor celebrating his new investment as...\n\nHealth Care\n\n09/28/15 05:15 AM EDT\n\n                                        By \nLauren French\n\nDemocrats compare it the GOP's Benghazi panel.\n\nWhite House\n\n09/28/15 05:13 AM EDT\n\n                                        By \nMichael Crowley\n\nObama and Putin are trash-talking in advance of their first meeting in a year. \n\nCongress\n\n09/28/15 05:12 AM EDT\n\n                                        By \nJake Sherman\n                                         and \nJohn Bresnahan\n\nHe's the overwhelming favorite to replace John Boehner but the Freedom Caucus still presents a big hurdle.\n\nCongress\n\n09/28/15 05:11 AM EDT\n\n                                        By \nSeung Min Kim\n\nVotes this week will merely delay the showdown.\n\n09/28/15 12:00 AM EDT\n\n                                        By \nAndrew Glass\n\nHe began voicing his concern over the rising debt ceiling.\n\n                                        Updated 09/27/15 10:39 PM EDT\n\n                                        By \nHadas Gold\n\nTapper, looking somewhat surprised, thanked Carson and ended the interview. \n\n                                        Updated 09/27/15 10:08 PM EDT\n\n                                        By \nDoug Palmer\n\nOfficials from the U.S., Japan and 10 other Pacific Rim countries want to finish a massive deal.\n\n09/27/15 09:12 PM EDT\n\n                                        By \nHanna Trudo\n\nHe advocates building up the U.S. military and making use of it.\n\n                                        Updated 09/27/15 08:04 PM EDT\n\n                                        By \nPatrick Temple-West\n\nStatute-of-limitation laws stand in the way of justice, they argue.  \n\nIn The Arena\n\n09/27/15 07:45 PM EDT\n\n                                        By \n                                                Steve Latourette\n\nHe was a friend to many\u2014even his enemies.\n\nLetter From Ukraine\n\n09/27/15 07:44 PM EDT\n\n                                        By \n                                                Amie Ferris-Rotman\n\nThey\u2019re middle-aged and battled-hardened, but veterans of the Soviet war in Afghanistan are back on the front lines in Ukraine.\n\nINVESTIGATION\n\n                                        Updated 09/27/15 06:34 PM EDT\n\n                                        By \nJon Prior\n\nBanks continue to foreclose on homeowners they claim to be helping in violation of 2012 settlement.\n\nCongress\n\n                                        Updated 09/27/15 05:32 PM EDT\n\n                                        By \nJake Sherman\n                                        ,\nAnna Palmer\n                                         and \nJohn Bresnahan\n\nhow boehner decided to bounce\n\n                                        Updated 09/27/15 05:05 PM EDT\n\n                                        By \nEdward-Isaac Dovere\n\nHe speaks in New York in advance of Monday's address to the U.N. General Assembly.\n\n2016\n\n                                        Updated 09/27/15 04:58 PM EDT\n\n                                        By \nBurgess Everett\n                                         and \n                                                Katie Glueck\n\nIf he's ever going to break out of the GOP pack, the showdown over Planned Parenthood and the budget will be what does it.\n\n                                        Updated 09/27/15 04:04 PM EDT\n\n                                        By \nDavid Rogers\n\nLooming showdowns over the budget and debt ceiling might have benefited from his experience.\n\nCongress\n\n                                        Updated 09/27/15 03:44 PM EDT\n\n                                        By \nGlenn Thrush\n                                         and \nSarah Wheaton\n\nThe speaker and the president had big ideas, but 'the crazies' got in the way.\n\n                                        By \n                                                Peter O\u2019Donnell\n\nThe EU already operates a number of concrete programs and policies with the aim of securing health in Europe.\n\n                                        By \n                                                Peter O\u2019Donnell\n\nThe scale of movement of people since summer has created unprecedented health care needs.\n\nCONGRESS\n\n                                        Updated 09/27/15 01:24 PM EDT\n\n                                        By \nAnna Palmer\n                                        ,\nJohn Bresnahan\n                                         and \nJake Sherman\n\nAfter less than nine years in the House, the majority leader is poised to take the reins from Boehner.\n\n09/27/15 01:17 PM EDT\n\n                                        By \nAndrew Glass\n\nThe Democrat  served eight terms as chairman of the House Banking Committee.\n\n                                        Updated 09/27/15 12:06 PM EDT\n\n                                        By \nMike Zapler\n\n\u201cThere are people out there spreading, you know, noise about how much can get done.\"\n\n                                        Updated 09/27/15 12:02 PM EDT\n\n                                        By \nKyle Cheney\n\n\u201cDuring the \u201990s, I was subjected to the same kind of barrage,\u201d she says.\n\n09/27/15 11:55 AM EDT\n\n                                        By \nKyle Cheney\n\n\"I didn\u2019t want to go back to work as a CEO,\" she says.\n\n                                        By \nMichael Grunwald\n\nA close look at Francis's major encyclical finds some awfully strange views, even for people who care about the environment.\n\nFourth Estate\n\n                                        Updated 09/27/15 11:09 AM EDT\n\n                                        By \nJack Shafer\n\nDeclaring a subject or a question a distraction has become Clinton\u2019s favorite way of dodging questions.\n\n                                        By \n                                                Peter O\u2019Donnell\n\nFor the EU, there is the full knowledge that there will be a next time, with this or with another infectious disease.\n\n09/27/15 10:41 AM EDT\n\n                                        By \nKyle Cheney\n\nCarson said he was impressed with West's \"business acumen.\"\n\n09/27/15 10:28 AM EDT\n\n                                        By \nKyle Cheney\n\nHe also defends comments advocating against electing a Muslim president. \n\n                                        Updated 09/27/15 10:19 AM EDT\n\n                                        By \nJosh Gerstein\n                                         and \nRachael Bade\n\nInstead, Cheryl Mills did.\n\n09/27/15 10:08 AM EDT\n\n                                        By \nKyle Cheney\n\nRep. Mick Mulvaney (R-S.C.), a founding member of the conservative House Freedom Caucus, acknowledged Sunday that current Majority Leader Kevin McCarthy...\n\n09/27/15 09:49 AM EDT\nGood Sunday morning. RUBIO RISING in NBC/WSJ poll of Republican primary voters, out at 9 a.m.: Trump 21% ... Carson 20% ... Rubio, Fiorina 11% ... Jeb...\n\n09/27/15 09:44 AM EDT\n\n                                        By \n                                                POLITICO Staff\n\nThe statement comes a day after Rep. Roskam said he collected signatures from 50 Republican lawmakers.\n\n09/27/15 09:20 AM EDT\n\n                                        By \nAlex Isenstadt\n                                         and \nHadas Gold\n\nThe prospect of a reduction in the number of candidates on stage is a life-or-death matter for some campaigns.\n\n09/27/15 09:01 AM EDT\n\n                                        By \nKyle Cheney\n\n\"They don't filter out the people that aren't going to vote.\"\n\n09/27/15 09:01 AM EDT\n\n                                        By \nKyle Cheney\n\nHe justifies them by saying the rich pay the most taxes.\n\n09/27/15 09:00 AM EDT\n\n                                        By \nSteven Shepard\n\nDemocratic and Republican front-runners are losing their leads.\nWe're working on more stories right now\n\n                                            By \n                                                    Robert B. Reich\n\n\n                                            By \n                                                    Philip Gordon\n\n\n                                            By \n                                                    Steve Latourette\n\n\n                                            By \n                                                    Amie Ferris-Rotman\n\n\n                AP Photo \n\n            By \nNick Gass\n\n09/28/15 07:42 AM EDT\nMarco Rubio wants no part of Donald Trump's \"freak show,\" the Florida Republican senator and presidential candidate said in an NPR interview aired Monday.\n\u201cI\u2019m not interested in the back and forth \u2014 to be a member or a part of his freak show,\" Rubio remarked. \"I would just say this: He is a very sensitive person; he doesn\u2019t like to be criticized. He responds to criticism very poorly.\u201d\nStory Continued Below\nThe comments echo what Rubio told Fox News' Bill O'Reilly last Thursday, calling the billionaire mogul \"thin-skinned and sensitive to criticism\" and someone who \"can't have a conversation about policy because quite frankly he doesn't know anything about policy.\u201d\nFor his part, Trump has repeatedly called out Rubio for his attendance record in the Senate, calling him \"a kid,\" \"overly ambitious,\" \"too young,\" and joking that he has better hair than the 44-year-old senator. He also dinged him for his finances, for being \"disloyal\" to former Florida Gov. Jeb Bush, and for his allegedly propensity to sweat.\n\"I've never seen a young guy sweat so much,\" Trump said in South Carolina last week, talking about the long debate and the hot stage under which all candidates stood for more than three hours. \"He\u2019s drinking water, water, water, I never saw anything like this with him with the water.\"\n \u00a9 2015 POLITICO LLC", "byline": "", "description": "", "title": "Rubio: Leave me out of Trump's 'freak show'", "url": "http://www.politico.com/story/2015/09/marco-rubio-donald-trump-freak-show-214138", "topics": ["personality", "terrorism", "immigration"], "people": ["Burgess Everett", "Sarah Wheaton", "Kyle Cheney", "Bashar Assad", "Philip Gordon", "Rachael Bade", "Daniel Webster", "Doug Palmer", "Anna Palmer", "Hanna Trudo", "Vladimir Putin", "Mike Zapler", "Peter O'Donnell", "Cheryl Mills", "Steve Latourette", "Mick Mulvaney", "Patrick Temple", "John Boehner", "Josh Gerstein", "Michael Grunwald", "Katie Glueck", "Nick Gass", "Jack Shafer", "Robert B. Reich", "Jeb Bush", "Isaac Dovere", "Alex Isenstadt", "Seung Min Kim", "Steven Shepard", "David Rogers", "Andrew Glass", "Donald Trump", "John Bresnahan", "Marco Rubio", "Jake Sherman", "Glenn Thrush", "Jake Tapper", "Lauren French", "Hassan Rouhani", "Michael Crowley", "Hillary Clinton", "Amie Ferris", "Peter Roskam", "Jon Prior", "Madeleine Albright", "Hadas Gold"], "orgs": ["House Majority Leader", "CONGRESS", "Congress", "Freedom Caucus", "House Banking Committee", "Senate", "U.N. General Assembly", "PREET", "United States.", "Wealth Of Nations", "GOP", "House Freedom Caucus"], "authors": [{"author_id": 30728, "fullname": "nick gass", "primary_org": "politico"}], "date_written": "2015-09-28 12:42:36", "org": "politico", "article_id": "47e578df5c291b7103fe0415fcf010fb", "date_access": "2015-09-28 12:00:21.953286"}