{"body": "\n10/04/15 10:53 AM EDT\n\n                                        By \nElena Schneider\n\nDonald Trump sketched out the scenario when he would exit the 2016 presidential race-when he falls in the polls.\n\n10/04/15 10:52 AM EDT\n HILLARY as barkeep Val on SNL: \u2018Isn\u2019t (Trump) the one who\u2019s like, \u201cUH, you\u2019re all losers\u201d?\u2019 -- B\u2019DAY: Steve Capus\n\nCONGRESS\n\n                                        Updated 10/04/15 10:49 AM EDT\n\n                                        By \nRachael Bade\n                                         and \nJohn Bresnahan\n\nThe Utah Republican officially launches his dark-horse campaign for House speaker.\n\n10/04/15 10:28 AM EDT\n\n                                        By \nElena Schneider\n\nArizona Sen. John McCain warned Republican presidential candidates that if they continue personal attacks on 'character and integrity,' then 'we'll pay...\n\n                                        Updated 10/04/15 10:21 AM EDT\n\n                                        By \nAnnie Karni\n\nShe also takes some gentle ribbing about gay marriage and the Keystone pipeline.\n\n10/04/15 09:42 AM EDT\n\n                                        By \nJake Sherman\n\nUtah Rep. Jason Chaffetz sent a letter to his GOP colleagues Sunday morning announcing his bid for speaker.\n\n                                        By \nPeter Berlin\n\nThe ex-Manchester United manager basks anew in his fans\u2019 adulation with a new book on leadership.\n\n10/04/15 09:36 AM EDT\n\n                                        By \nElena Schneider\n\nDonald Trump maintains his polling edge in Iowa and New Hampshire, but his dominant lead has faded some.\n\n10/04/15 09:09 AM EDT\n\n                                        By \nElena Schneider\n\n\u201cYou're going to have problems no matter how good, no matter what kind of checks you do, you know, what kind of laws.\u201d\n\nOn The Bench\n\n10/04/15 07:44 AM EDT\n\n                                        By \n                                                Cass R. Sunstein\n\nIn friendship and romance, people are drawn to identifiable types. Some of us like larger-than-life figures, full of charisma, wild plans and fun. Some...\n\nSupreme Court\n\n10/04/15 07:41 AM EDT\n\n                                        By \nJosh Gerstein\n\nJudges may take up cases on abortion and immigration.\n\n10/03/15 10:57 PM EDT\n\n                                        By \nAndrew Glass\n\nHe spoke the day after a coup aimed at overthrowing Manuel Noriega.\n\n2016\n\n10/03/15 10:48 PM EDT\n\n                                        By \nEdward-Isaac Dovere\n\nThe vice president scores a rock-star's welcome at the annual dinner of the country\u2019s largest gay-rights group -- though Hillary got the first invitation.\n\n10/03/15 07:12 PM EDT\n\n                                        By \nDoug Palmer\n\nAfter extending their stay for a fifth day, U.S. officials said they remain optimistic they can clinch a deal Sunday. \n\n10/03/15 02:12 PM EDT\n\n                                        By \nKimberly Hefling\n\nThe National Education Association endorsement comes amid grumbling from some members that it's too soon.\n\n10/03/15 01:52 PM EDT\n\n                                        By \nLauren French\n\n\"The truth is [the old] rules are no longer working.\"\n\"Clinton makes gay rights as a core promise of 2016 campaign.\"\n\n10/03/15 12:49 PM EDT\nBy Mike Allen (@mikeallen; mallen@politico.com) and Daniel Lippman (@dlippman; dlippman@politico.com)\n\n2016\n\n10/03/15 08:01 AM EDT\n\n                                        By \n                                                Paul Goldman\n                                         and \n                                                Mark J. Rozell\n\nHow noncitizens decrease Republican chances of winning the White House next year.\n\n10/02/15 11:02 PM EDT\n\n                                        By \nAndrew Glass\n\nOn this day in 1965, President Lyndon B. Johnson signed legislation abolishing an immigration quota system based on national origin that had been in force...\n\nWhite House\n\n10/02/15 08:34 PM EDT\n\n                                        By \nEdward-Isaac Dovere\n\nIn a freewheeling news conference, the president smacks down Putin, Congress and gun control opponents -- among others.\nUnions wanted Obama to fire Arne Duncan. They got John King instead.\nShe took aim at them for not expanding Medicaid under the Affordable Care Act.\n\n                                        Updated 10/02/15 07:14 PM EDT\n\n                                        By \nCaitlin Emma\n                                        ,\nAllie Grasgreen Ciaramella\n                                         and \nKimberly Hefling\n\nHe doesn\u2019t have immediate plans lined up for life after the administration.\nThe best from this week's late-night television.\nHILLARY CLINTON\u2019s donors get a pep talk, even while some defect to JOE BIDEN.\n\n10/02/15 06:45 PM EDT\n\n                                        By \n                                                Henry C. Jackson\n\nIndianoplace like home \u2014 Stuff happens\n\n10/02/15 06:32 PM EDT\n\n                                        By \nEli Stokols\n\n\"It's fine. It's not a big deal,\u201d he says. \n\n10/02/15 06:32 PM EDT\n\n10/02/15 06:29 PM EDT\n\n                                        By \nBryan Bender\n\nOnce frequent communication between U.S. and Russian military has all but halted. In Syria, the superpowers are virtually starting from scratch.\n\n                                        Updated 10/02/15 06:13 PM EDT\n\n                                        By \n                                                POLITICO Staff\n\nHere are some of Bush\u2019s most ill-worded comments since launching his campaign.\n\n                                        Updated 10/02/15 06:11 PM EDT\n\n                                        By \nMichael Crowley\n\nAll the Russian president has gained are higher poll numbers -- in state-controlled media, the president said.\n\n10/02/15 05:59 PM EDT\n\n                                        By \nHadas Gold\n\nKamen spent 35 years with the Post, 23 of those writing \"In the Loop.\"\n\n                                        Updated 10/02/15 05:52 PM EDT\n\n                                        By \nSarah Wheaton\n\n\u201cI\u2019m going to talk about this,\u201d Obama said, \u201cand I\u2019m going to politicize it.\u201d\n\n                                        Updated 10/02/15 05:51 PM EDT\n\n                                        By \nDaniel Strauss\n\nFormer Florida governor Jeb Bush on Friday while discussing gun control on Friday said \"stuff happens\" but it doesn't necessarily mean action...\n\n                                        By \n                                                Jessica Bakeman\n                                         and \n                                                Keshia Clukey\n\nPresident Barack Obama tapped King to lead the U.S. Department of Education.\n\n10/02/15 05:31 PM EDT\n\n10/02/15 05:30 PM EDT\n\n                                        By \nEliza Collins\n\nHis 'rejection of absolutism' is a 'good place to start,' the president said during a Friday press conference. \n\n10/02/15 05:19 PM EDT\n\n10/02/15 05:15 PM EDT\n\n                                        By \nEliza Collins\n\nWith Biden weighing a run, the president works to remain even-handed.\n\n10/02/15 05:01 PM EDT\n\n10/02/15 04:58 PM EDT\n\n10/02/15 04:57 PM EDT\n\n                                        By \nLauren French\n\nEfforts have stalled in the House and Senate.\n\n10/02/15 04:53 PM EDT\n\n10/02/15 04:50 PM EDT\n\n                                        By \nEliza Collins\n\n\"It would have profound impact for the global economy and put our financial system in tailspin,\u201d he says.\n\n10/02/15 04:18 PM EDT\n\n                                        By \nEliza Collins\n\nThe economy would be \u201cdoing even better if we didn\u2019t have to keep dealing with unnecessary crises in Congress,\u201d he says.\n\n                                        Updated 10/02/15 04:10 PM EDT\n\n                                        By \nEliza Collins\n\nThe group says Trump withdrew from the Oct. 8 Q&A session because he wouldn't agree to its terms. Trump has a different story.\n\n10/02/15 04:04 PM EDT\n\n10/02/15 04:01 PM EDT\n\n                                        By \nCaitlin Emma\n                                         and \nKimberly Hefling\n\nObama's new pick looks a lot like the old  one.\n\n10/02/15 03:27 PM EDT\nWe're working on more stories right now\n\n                                            By \n                                                    Paul Goldman\n                                             and \n                                                    Mark J. Rozell\n\n\n                                            By \n                                                    Cass R. Sunstein\n\n\n                                            By \nJack Shafer\n\n\n                                            By \n                                                    Hugh Hewitt\n\n\n                AP Photo\n\n            By \nElena Schneider\n\n10/04/15 10:53 AM EDT\nDonald Trump made clear on Sunday he'd drop out of the race for the Republican presidential nomination if he plummets in the polls. \n\u201cIf [polls] changed, and that went in a different direction and if I thought that I wasn't going to win, like there are numerous people running, they\u2019re not going to win, okay? I would certainly want to get out,\u201d Trump said on ABC\u2019s \u201cThis Week.\u201d \nStory Continued Below\n\u201cI'm not a masochist,\" he said.\" I'm not somebody that needs to do this for other reasons.\nBut that\u2019s not happening any time soon, he emphasized, as he continues to lead in Iowa and New Hampshire, according to a new NBC/Wall Street Journal/Marist poll released Sunday.\n\u201cRight now, I'm loving it,\u201d he said. \u201cI\u2019m having a lot of fun.\u201d\n\n\n\n            By \nDaniel Strauss\n\nTrump also shared his take on the airstrikes Russia launched in Syria last week, saying he wants to \u201csit back\u201d and \u201csee what happens.\u201d He also said he would not accept Syrian refugees, if he were president. \n\u201cI said there is no way they come in. If they do come in, if I win for president, they're going out,\u201d Trump said. \u201cYou have Bahrain, you have Qatar, you have some of the richest countries, they're not taking any, and they're right there, so we're supposed to take 200,000 people that we have no idea who they are?\u201d\n\u201cWe are not going to take responsibility,\" he declared. \"Are they ISIS? Probably not, but nobody knows.\u201d\nTrump did not call for a no-fly zone over Syria, either. Instead, he predicted Russia would get \"bogged down\" in Syria the way it did in Afghanistan in the 1980s when \"it destroyed the Soviet Union.\"\n \u00a9 2015 POLITICO LLC", "byline": "", "description": "", "title": "Trump on his White House bid: 'I'm not a masochist'", "url": "http://www.politico.com/story/2015/10/donald-trump-masochist-214411", "topics": ["campaign_finance"], "people": ["Bryan Bender", "Allie Grasgreen Ciaramella", "John King", "Manuel Noriega", "Rachael Bade", "Henry C. Jackson", "Doug Palmer", "Hadas Gold", "Vladimir Putin", "Hugh Hewitt", "Kimberly Hefling", "Daniel Lippman", "Josh Gerstein", "Annie Karni", "Caitlin Emma", "Jessica Bakeman", "J. Rozell", "Arne Duncan", "Jack Shafer", "Jeb Bush", "Isaac Dovere", "Cass R. Sunstein", "Andrew Glass", "Donald Trump", "John Bresnahan", "Jake Sherman", "Barack Obama", "Sarah Wheaton", "Lauren French", "Peter Berlin", "Lyndon B. Johnson", "Mike Allen", "Daniel Strauss", "Michael Crowley", "Eli Stokols", "Elena Schneider", "Paul Goldman", "Eliza Collins", "Steve Capus", "Keshia Clukey", "Jason Chaffetz"], "orgs": ["U.S. Department of Education", "Manchester United", "National Education Association", "CONGRESS", "Congress", "Senate", "Marist", "Supreme Court", "Medicaid", "GOP", "Soviet Union"], "authors": [{"author_id": 30901, "fullname": "elena schneider", "primary_org": "politico"}], "date_written": "2015-10-04 15:53:26", "org": "politico", "article_id": "5096c3911bfd6c575cac6493f0ac26e4", "date_access": "2015-10-04 15:00:09.915792"}