{"body": "(Adds comment from Univision CEO, paragraph 10)\nWASHINGTON Aug 26 (Reuters) - Republican presidential\ncandidate Donald Trump on Wednesday defended his decision to\ntoss a news anchor with the Spanish-language Univision network\nout of a news conference, in his latest tussle with a U.S.\ntelevision personality.\n\"I'm not a bully,\" Trump told NBC in an interview.\nOn Tuesday, Univision's Jorge Ramos was removed from Trump's\nnews conference in Dubuque, Iowa, after the business\nmogul-turned-candidate said the journalist was asking a question\nout of turn.\n\"He was totally out of line last night,\" Trump said of\nRamos, speaking on NBC's \"Today\" program.\nRamos, who has been critical of Trump's stance on\nimmigration, said he was waiting for his turn to ask a question\non the subject when Trump ordered him out.\n\"He didn't like my question and when he didn't like my\nquestion then he motioned so the one security guard would come\nwhere I was and then threw me out of the press conference,\"\nRamos told ABC's \"Good Morning America.\"\nThe dust-up was the latest involving a television anchor and\nthe outspoken Trump, who also has faced criticism for his\nwar-of-words with Fox News anchor Megyn Kelly after that\nnetwork's recent Republican presidential debate.\nTrump is locked in a legal battle with Univision over the\nnetwork's recent decision to cancel its contract to broadcast\nthe Miss USA and Miss Universe pageants, co-owned by Trump,\nafter he made controversial remarks about undocumented Latino\nimmigrants.\nTrump has called for building a wall along the U.S.-Mexico\nborder, deporting illegal immigrants and ending birthright\ncitizenship.\nIn a statement on Wednesday night, Univision Chief Executive\nOfficer Randy Falco said Trump's treatment of Ramos at the news\nconference was \"beneath contempt,\" adding, \"Mr. Trump\ndemonstrated complete disregard for him and for the countless\nHispanics whom Jorge seeks to represent through press questions\nthat are at the heart of the First Amendment.\"\nRamos has been vocal about Trump's stance on immigration,\ntelling CNN earlier this month that it was \"not only disgraceful\nbut dangerous,\" while fueling some criticism about his work as\nan objective journalist.\n\"He has to explain how he wants to deport 11 million\npeople,\" Ramos told ABC on Wednesday. \"As journalists, we are\nnot only required but we are forced to take a stand and clearly\nwhen Mr. Trump is talking about immigration in an extreme way,\nwe have to confront him.\"\n(Reporting by Susan Heavey; Additional reporting by Peter\nCooney; Editing by Paul Simao and Leslie Adler)", "byline": "", "description": "WASHINGTON, Aug 26 (Reuters) - Republican presidential candidate Donald Trump on Wednesday defended his decision to toss a news anchor with the Spanish-language Univision network out of a news conference, in his latest tussle with a U.S. television personality.", "title": "UPDATE 1-Trump defends removal of Univision anchor from news conference", "url": "http://feeds.reuters.com/~r/reuters/MostRead/~3/RRMVmyWesDM/story01.htm", "topics": ["immigration", "mexico"], "people": ["Susan Heavey", "Jorge Ramos", "Paul Simao", "Randy Falco", "Donald Trump", "Leslie Adler", "Megyn Kelly"], "orgs": ["Univision", "Univision Chief Executive"], "authors": [{"author_id": 33346, "fullname": "reuters editorial", "primary_org": "reuters"}], "date_written": "2015-08-27 02:57:16", "org": "reuters", "article_id": "d96ea370cc28047518fcceccb7b6f086", "date_access": "2015-08-27 04:40:14.621459"}