{"body": "(Adds Bloomberg and New York Post reports, Trump Organization\ncomment)\nSept 11 (Reuters) - Republican presidential frontrunner\nDonald Trump said on Friday he had bought NBC's share of the\nMiss Universe Organization and that all lawsuits against the\nmedia company had been settled.\n\"Just purchased NBC's half of the Miss Universe Organization\nand settled all lawsuits against them. Now own 100% - stay\ntuned!,\" the billionaire property developer said in a tweet.\nBloomberg later reported that Trump is in talks to sell the\nnewly acquired enterprise to media and entertainment company\nWME/IMG. (bloom.bg/1M2r60H)\nIMG, owned by William Morris Endeavor Entertainment LLC and\nSilver Lake Management, is keen on owning the entire\norganization instead of just a stake, Bloomberg reported, citing\npeople familiar with the matter.\nThe New York Post had reported in August that Ari Emanuel,\nthe owner of William Morris Endeavor, was among the top bidders\nto buy Trump's stake in the organization. (pge.sx/1NmYnp9)\nA Trump Organization spokeswoman declined to comment beyond\nthe tweet. WME/IMG was not immediately available for comment.\nNo financial details for either deal were given.\nThe Miss Universe Organization, which also runs the \"Miss\nUSA\" pageant, was a joint venture between Trump and Comcast\nCorp's NBCUniversal.\nNBCUniversal cut ties with Trump and the \"Miss Universe\" and\n\"Miss USA\" pageants in June after the real estate magnate and TV\npersonality said some Mexican immigrants are rapists and\nkillers.\nThe same month, Spanish-language Univision refused\nto air the Miss USA pageant and severed ties with the Miss\nUniverse Organization, prompting Trump to sue the company.\nTrump is scheduled to appear on Jimmy Fallon's late-night\ntalk show on NBC later on Friday.\n\n (Reporting By Lehar Maan in Bengaluru; Editing by Ted Kerr and\nSavio D'Souza)", "byline": "", "description": "Sept 11 (Reuters) - Republican presidential frontrunner Donald Trump said on Friday he had bought NBC's share of the Miss Universe Organization and that all lawsuits against the media company had...", "title": "UPDATE 1-Trump says bought NBC's share of Miss Universe Organization", "url": "http://feeds.reuters.com/~r/news/usmarkets/~3/rDsnwGiQuJA/story01.htm", "topics": ["mexico", "immigration", "personality"], "people": ["Ted Kerr", "Savio D'Souza", "Lehar Maan", "Donald Trump", "Jimmy Fallon", "Ari Emanuel"], "orgs": ["IMG", "William Morris Endeavor", "Silver Lake Management", "Trump Organization", "Comcast", "Corp", "William Morris Endeavor Entertainment LLC", "New York Post", "NBCUniversal", "Trump"], "authors": [{"author_id": 33346, "fullname": "reuters editorial", "primary_org": "reuters"}], "date_written": "2015-09-11 21:21:11", "org": "reuters", "article_id": "ad7ce401316b10f443808183eff3e6cc", "date_access": "2015-09-11 20:55:44.328879"}