{"body": "\n11/16/15 05:37 PM EST\n\n                                        By \nJosh Gerstein\n\nThe D.C. Circuit Court of Appeals merely says the government had \"satisified the requirements for a stay pending appeal.\"\n\n2016\n\n                                        Updated 11/16/15 05:32 PM EST\n\n                                        By \nGabriel Debenedetti\n\nThe DNC comes under fire for Saturday's low viewership.\n\n11/16/15 05:13 PM EST\n\n                                        By \nEliza Collins\n\nKatrina Pierson also says it uses \"political correctness as cover.\"\n\n                                        Updated 11/16/15 05:11 PM EST\n\n                                        By \nSeung Min Kim\n                                        ,\nJake Sherman\n                                         and \nBurgess Everett\n\nLawmakers say they may try to attach restrictions to a must-pass spending bill, raising the specter of a shutdown battle.\n\n                                        Updated 11/16/15 04:42 PM EST\n\n                                        By \nNolan D. McCaskill\n\nRepublicans balk at taking refugees while Obama calls for officials to resist the 'dark impulse inside of us.'\n\nWhite House\n\n                                        Updated 11/16/15 04:16 PM EST\n\n                                        By \nNick Gass\n                                         and \nNahal Toosi\n\n'If there's a good idea out there, then we're going to do it,' Obama says. 'I don't think I've shown a hesitation to act.'\n\n                                        Updated 11/16/15 03:49 PM EST\n\n                                        By \nNahal Toosi\n                                         and \nEliza Collins\n\nThe U.S. secretary of state is visiting the French capital to show solidarity in the wake of the attacks. \n\n11/16/15 03:42 PM EST\n\n                                        By \nDaniel Strauss\n\nThe bill would also institute a 30-day waiting period for citizens of so-called visa waiver countries.\n\n11/16/15 03:42 PM EST\n\n11/16/15 03:34 PM EST\n\n                                        By \nHadas Gold\n\nThe Associated Press rebuked the State Department on Monday, accusing them of dragging their feet on producing documents related to Hillary Clinton's tenure...\n\n                                        By \nMichael Grunwald\n\nThey\u2019ve got a powerful record to run on. Saturday\u2019s debate is the latest evidence they\u2019re blowing the chance.\n\n                                        Updated 11/16/15 03:04 PM EST\n\n                                        By \nEliza Collins\n                                         and \nNick Gass\n\nThe 2016 GOP contenders race to condemn Obama's reluctance for a rethink after Friday's Paris attacks.\n\n11/16/15 02:48 PM EST\n\n                                        By \nAlex Isenstadt\n\nThere is speculation that the Las Vegas Casino mogul could endorse Sen. Marco Rubio.\n\n                                        Updated 11/16/15 02:35 PM EST\n\n                                        By \nIsaac Arnsdorf \n\nOSTP's Ghosh to Facebook \u2014 SEC subpoena upheld\n\n11/16/15 02:03 PM EST\n\n                                        By \n                                                Laura Nahmias\n\n\n                                        Updated 11/16/15 01:35 PM EST\n\n                                        By \nEliza Collins\n\nIn a blow to President Barack Obama's strategy with ISIL Sen. Dianne Feinstein broke with him, saying that ISIL is not contained.\n\n11/16/15 01:21 PM EST\n\n11/16/15 01:00 PM EST\n\n11/16/15 12:54 PM EST\n\n                                        By \nNick Gass\n\nMike Huckabee has asked the newly-elected speaker to step up his rhetoric against the \"importation\" of Syrian refugees.\n\n11/16/15 12:44 PM EST\n\n                                        By \nEliza Collins\n\nHillary Clinton \"will be by our side as we break down barriers and finally reach full equality for all,\" says Jim Obergefell. \n\n11/16/15 12:23 PM EST\n\n11/16/15 12:22 PM EST\n\n                                        By \nSeung Min Kim\n\nCapitol Police are urging staffers to keep their office informed of where they are. \n\n11/16/15 12:21 PM EST\n\n11/16/15 12:14 PM EST\n\nWashington and the World\n\n11/16/15 12:12 PM EST\n\n                                        By \nMichael Hirsh\n\nWhy can\u2019t we come up with strategy to defeat the terrorists? Maybe it\u2019s because we won\u2019t say who they are\u2014or even who we are.\n\n11/16/15 11:55 AM EST\n\n                                        By \nSarah Karlin\n                                         and \nBrett Norman\n\nPharma tries to shift focus ahead of HHS price forum \u2014Tech, drug companies unite on IP bill\n\n11/16/15 11:41 AM EST\n\n                                        By \nJake Sherman\n\nThe proposal will go before the House Republican Conference on Tuesday.\n\n11/16/15 11:10 AM EST\n\n                                        Updated 11/16/15 11:09 AM EST\n\n                                        By \nKatie Glueck\n\n\"I believe Ted Cruz is the candidate that's the answer to my prayers,\" King says.\n\n                                        Updated 11/16/15 11:08 AM EST\n\n                                        By \nNick Gass\n\n\"That\u2019s not American. That\u2019s not who we are. We don\u2019t have a religious test for our compassion,\" he says. \n\n                                        By \n                                                Nicholas Vinocur\n                                         and \nPierre Brian\u00e7on \n\nThe French president calls for meeting of UN Security Council and vows to scale up military campaign.\n\n                                        Updated 11/16/15 10:56 AM EST\n\n                                        By \nKatie Glueck\n\nIncreasingly, the field sees a clear path for Cruz into March.\n\n11/16/15 10:13 AM EST\nDeSAULNIER calls for bridge investigations\n\n11/16/15 10:09 AM EST\n\n                                        By \nTheodoric Meyer\n\nZwick to work for Ryan \u2014 A new DSCC attack\n\n11/16/15 10:00 AM EST\n\n                                        By \nAlex Byers\n                                         and \nKate Tummarello\n\nSenate Judiciary looks to debate trade secrets \u2014 Senate Commerce postpones spectrum markup\n\n11/16/15 10:00 AM EST\n\n                                        By \nVictoria Guida\n\nAPEC to focus on services \u2014 Ryan\u2019s short-term to-do list\n\n11/16/15 10:00 AM EST\n\n                                        By \nBrian Mahoney\n\nThe Democrats' wage problem \u2014 Rules committee meets on tribal labor bill\n\n11/16/15 10:00 AM EST\n\n                                        By \nBernie Becker\n\nRyan hits the airwaves \u2014 Debate recap\n\n11/16/15 10:00 AM EST\n\n                                        By \nJennifer Scholtes\n\nFoxx makes last-ditch funding plea \u2014 McCaul cites watch lists, visa waiver among terrorism concerns\n\n11/16/15 10:00 AM EST\n\n                                        By \nDavid Pittman\n\nSenate HELP watch continues \u2014 Blackburn works on interoperability bill \n\n11/16/15 10:00 AM EST\n\n                                        By \nBrianna Ehley\n\nAdvocates push Medicaid expansion in Florida \u2014 AMA sets advocacy agenda \u2014 FDA recalls device associated with spreading super bugs\n\n11/16/15 10:00 AM EST\n\n                                        By \nChase Purdy\n\nMcConnell may initiate a Senate vote on immigration? \u2014 A 'paradigm shift' coming for imported food\n\n11/16/15 10:00 AM EST\n\n                                        By \nAllie Grasgreen Ciaramella\n\nClinton splits from Obama administration on teacher evaluations \u2014 Closing in on an NCLB update?\n\n11/16/15 10:00 AM EST\n\n                                        By \nEric Wolff\n\nHouse committee takes up anti-EPA resolutions \u2014 Court to fast-track decision on whether McCarthy must testify in coal case\n\n11/16/15 10:00 AM EST\n\n                                        By \nTim Starks\n\nHouse oversight panel goes to school on Education Department, connected cars \u2014 Restaurant cybersecurity?\n\n11/16/15 09:52 AM EST\n\n                                        By \nNolan D. McCaskill\n\n\"In that shameful moment I think Secretary Clinton was trying to pump out a smokescreen to cover her tracks on this one.\u201d\n\n11/16/15 09:26 AM EST\n\n                                        By \nJosh Gerstein\n                                         and \nNick Gass\n\n\"It\u2019s not a surprise this attack was carried out, from the standpoint of we did have strategic warning.\"\n\n11/16/15 08:37 AM EST\nIslamic State attacks in Paris pit the White House against the GOP.\n\n11/16/15 08:30 AM EST\n\n                                        By \nJeremy Herb\n\nFrance launches airstrikes in Syria \u2014 Police conduct raids across France\nWe're working on more stories right now\n\n                                            By \nMichael Hirsh\n\n\n                                            By \n                                                    Michael Lind\n\n\n                                            By \nJack Shafer\n\n\n                                            By \nTodd S. Purdum\n\n\n                Getty\n\n            By \nEliza Collins\n\n11/16/15 05:13 PM EST\nDonald Trump\u2019s new spokeswoman, former congressional candidate and tea party activist Katrina Pierson, on Monday condemned Islam in a Facebook message that promoted the presidential ambitions of the billionaire businessman. \n\u201cIslam preys on the weak and uses political correctness as cover. Two things that Americans won't be concerned with when @realDonaldTrump is in the White House,\u201d she wrote on Facebook. \nStory Continued Below\nHer comments follow a horrific attack in Paris on Friday where at least 130 were killed and 350 were wounded. Islamic State has claimed responsibility for the massacre. \n\nWhite House\n\n            By \nNick Gass\n             and \nNahal Toosi\n\nTrump has said on multiple occasions that it may be necessary to close some mosques because people could be meeting there to plot attacks, and he reiterated that view on Monday. \"You\u2019re going to need to watch and study the mosques,\" Trump said on MSNBC\u2019s \u201cMorning Joe.\" \nThe Trump campaign did not immediately respond to request for comment. \n \u00a9 2015 POLITICO LLC", "byline": "", "description": "", "title": "Trump&apos;s new spokeswoman: &apos;Islam preys on the weak&apos;", "url": "http://www.politico.com/story/2015/11/donald-trump-pierson-islam-215945", "topics": ["trade"], "people": ["Isaac Arnsdorf", "Burgess Everett", "Jim Obergefell", "Bernie Becker", "Kate Tummarello", "Michael Grunwald", "Hadas Gold", "Eric Wolff", "Ted Cruz", "Spencer Zwick", "Theodoric Meyer", "Brian Mahoney", "Pierre Briancon", "Nahal Toosi", "Gabriel Debenedetti", "Dianne Feinstein", "Josh Gerstein", "Allie Grasgreen Ciaramella", "Katie Glueck", "Nick Gass", "Jack Shafer", "Michael Hirsh", "Brett Norman", "Jennifer Scholtes", "Alex Isenstadt", "Seung Min Kim", "Michael Lind", "Jeremy Herb", "Todd S. Purdum", "Marco Rubio", "Jake Sherman", "Barack Obama", "Chase Purdy", "Nicholas Vinocur", "Brianna Ehley", "David Pittman", "Tim Starks", "Donald Trump", "Daniel Strauss", "Sarah Karlin", "Hillary Clinton", "Mike Huckabee", "Victoria Guida", "Alex Byers", "Eliza Collins", "Laura Nahmias"], "orgs": ["HHS", "FDA", "Senate Judiciary", "DNC", "Blackburn", "Senate", "Education Department", "State Department", "AMA", "House Republican Conference", "Circuit Court of Appeals", "SEC", "Medicaid", "MSNBC", "ISIL", "Senate Commerce", "GOP", "Capitol Police", "EPA"], "election_confidence": 0.7999028717834702, "authors": [{"author_id": 30734, "fullname": "josh gerstein", "primary_org": "politico"}], "date_written": "2015-11-16 22:13:55", "org": "politico", "article_id": "17e3e50662eab53cc7fa4cf80b9c7f41", "date_access": "2015-11-16 22:39:36.209894"}