{"body": "\n11/16/15 06:59 PM EST\n\n                                        By \nGabriel Debenedetti\n\nHe needs to vastly improve his numbers in order to gain delegates coming out of the Iowa caucuses. \n\n11/16/15 06:51 PM EST\n\n                                        By \nGabriel Debenedetti\n\nThe Vermont senator suddenly finds himself forced to deviate from an economic message he's been honing for decades.\n\nFourth Estate\n\n11/16/15 06:51 PM EST\n\n                                        By \nJack Shafer\n\nWhy do we need to keep telling ourselves the plotters are special?\n\n11/16/15 06:43 PM EST\n\n                                        By \nEliza Collins\n\n\u201cA lot of Americans really think back to 2003, and they remember Saddam Hussein and Al Qaeda,\u201d Carson said. \n\n                                        Updated 11/16/15 06:37 PM EST\n\n                                        By \nNolan D. McCaskill\n\nRepublicans balk at taking refugees while Obama calls for officials to resist the 'dark impulse inside of us.'\n\n2016\n\n11/16/15 06:23 PM EST\n\n                                        By \nEli Stokols\n\nThe former Florida governor is staking claim as the candidate most ready to take it to Islamic State. But his last name is a liability.\n\n11/16/15 06:09 PM EST\n\n                                        By \n                                                Henry C. Jackson\n\nBush has proven himself at times inept at articulating the daylight between his foreign policy vision and that of the 43rd president. \n\n                                        Updated 11/16/15 06:03 PM EST\n\n                                        By \nJosh Gerstein\n\nThe D.C. Circuit Court of Appeals merely says the government had \"satisified the requirements for a stay pending appeal.\"\n\n2016\n\n                                        Updated 11/16/15 05:32 PM EST\n\n                                        By \nGabriel Debenedetti\n\nThe DNC comes under fire for Saturday's low viewership.\n\n11/16/15 05:13 PM EST\n\n                                        By \nEliza Collins\n\nKatrina Pierson also says it uses \"political correctness as cover.\"\n\n                                        Updated 11/16/15 05:11 PM EST\n\n                                        By \nSeung Min Kim\n                                        ,\nJake Sherman\n                                         and \nBurgess Everett\n\nLawmakers say they may try to attach restrictions to a must-pass spending bill, raising the specter of a shutdown battle.\n\nWhite House\n\n                                        Updated 11/16/15 04:16 PM EST\n\n                                        By \nNick Gass\n                                         and \nNahal Toosi\n\n'If there's a good idea out there, then we're going to do it,' Obama says. 'I don't think I've shown a hesitation to act.'\n\n                                        Updated 11/16/15 03:49 PM EST\n\n                                        By \nNahal Toosi\n                                         and \nEliza Collins\n\nThe U.S. secretary of state is visiting the French capital to show solidarity in the wake of the attacks. \n\n11/16/15 03:42 PM EST\n\n                                        By \nDaniel Strauss\n\nThe bill would also institute a 30-day waiting period for citizens of so-called visa waiver countries.\n\n11/16/15 03:42 PM EST\n\n11/16/15 03:34 PM EST\n\n                                        By \nHadas Gold\n\nThe AP sued the State Department in March.\n\n                                        By \nMichael Grunwald\n\nThey\u2019ve got a powerful record to run on. Saturday\u2019s debate is the latest evidence they\u2019re blowing the chance.\n\n                                        Updated 11/16/15 03:04 PM EST\n\n                                        By \nEliza Collins\n                                         and \nNick Gass\n\nThe 2016 GOP contenders race to condemn Obama's reluctance for a rethink after Friday's Paris attacks.\n\n11/16/15 02:48 PM EST\n\n                                        By \nAlex Isenstadt\n\nThere is speculation that the Las Vegas Casino mogul could endorse Sen. Marco Rubio.\n\n                                        Updated 11/16/15 02:35 PM EST\n\n                                        By \nIsaac Arnsdorf \n\nOSTP's Ghosh to Facebook \u2014 SEC subpoena upheld\n\n11/16/15 02:03 PM EST\n\n                                        By \n                                                Laura Nahmias\n\n\n                                        Updated 11/16/15 01:35 PM EST\n\n                                        By \nEliza Collins\n\nIn a blow to President Barack Obama's strategy with ISIL Sen. Dianne Feinstein broke with him, saying that ISIL is not contained.\n\n11/16/15 01:21 PM EST\n\n11/16/15 01:00 PM EST\n\n11/16/15 12:54 PM EST\n\n                                        By \nNick Gass\n\nMike Huckabee has asked the newly-elected speaker to step up his rhetoric against the \"importation\" of Syrian refugees.\n\n11/16/15 12:44 PM EST\n\n                                        By \nEliza Collins\n\nHillary Clinton \"will be by our side as we break down barriers and finally reach full equality for all,\" says Jim Obergefell. \n\n11/16/15 12:23 PM EST\n\n11/16/15 12:22 PM EST\n\n                                        By \nSeung Min Kim\n\nCapitol Police are urging staffers to keep their office informed of where they are. \n\n11/16/15 12:21 PM EST\n\n11/16/15 12:14 PM EST\n\nWashington and the World \n\n11/16/15 12:12 PM EST\n\n                                        By \nMichael Hirsh\n\nWhy can\u2019t we come up with strategy to defeat the terrorists? Maybe it\u2019s because we won\u2019t say who they are\u2014or even who we are.\n\n11/16/15 11:55 AM EST\n\n                                        By \nSarah Karlin\n                                         and \nBrett Norman\n\nPharma tries to shift focus ahead of HHS price forum \u2014Tech, drug companies unite on IP bill\n\n11/16/15 11:41 AM EST\n\n                                        By \nJake Sherman\n\nThe proposal will go before the House Republican Conference on Tuesday.\n\n11/16/15 11:10 AM EST\n\n                                        Updated 11/16/15 11:09 AM EST\n\n                                        By \nKatie Glueck\n\n\"I believe Ted Cruz is the candidate that's the answer to my prayers,\" King says.\n\n                                        Updated 11/16/15 11:08 AM EST\n\n                                        By \nNick Gass\n\n\"That\u2019s not American. That\u2019s not who we are. We don\u2019t have a religious test for our compassion,\" he says. \n\n                                        By \n                                                Nicholas Vinocur\n                                         and \nPierre Brian\u00e7on \n\nThe French president calls for meeting of UN Security Council and vows to scale up military campaign.\n\n                                        Updated 11/16/15 10:56 AM EST\n\n                                        By \nKatie Glueck\n\nIncreasingly, the field sees a clear path for Cruz into March.\n\n11/16/15 10:13 AM EST\nDeSAULNIER calls for bridge investigations\n\n11/16/15 10:09 AM EST\n\n                                        By \nTheodoric Meyer\n\nZwick to work for Ryan \u2014 A new DSCC attack\n\n11/16/15 10:00 AM EST\n\n                                        By \nAlex Byers\n                                         and \nKate Tummarello\n\nSenate Judiciary looks to debate trade secrets \u2014 Senate Commerce postpones spectrum markup\n\n11/16/15 10:00 AM EST\n\n                                        By \nVictoria Guida\n\nAPEC to focus on services \u2014 Ryan\u2019s short-term to-do list\n\n11/16/15 10:00 AM EST\n\n                                        By \nBrian Mahoney\n\nThe Democrats' wage problem \u2014 Rules committee meets on tribal labor bill\n\n11/16/15 10:00 AM EST\n\n                                        By \nBernie Becker\n\nRyan hits the airwaves \u2014 Debate recap\n\n11/16/15 10:00 AM EST\n\n                                        By \nJennifer Scholtes\n\nFoxx makes last-ditch funding plea \u2014 McCaul cites watch lists, visa waiver among terrorism concerns\n\n11/16/15 10:00 AM EST\n\n                                        By \nDavid Pittman\n\nSenate HELP watch continues \u2014 Blackburn works on interoperability bill \n\n11/16/15 10:00 AM EST\n\n                                        By \nBrianna Ehley\n\nAdvocates push Medicaid expansion in Florida \u2014 AMA sets advocacy agenda \u2014 FDA recalls device associated with spreading super bugs\n\n11/16/15 10:00 AM EST\n\n                                        By \nChase Purdy\n\nMcConnell may initiate a Senate vote on immigration? \u2014 A 'paradigm shift' coming for imported food\n\n11/16/15 10:00 AM EST\n\n                                        By \nAllie Grasgreen Ciaramella\n\nClinton splits from Obama administration on teacher evaluations \u2014 Closing in on an NCLB update?\nWe're working on more stories right now\n\n                                            By \nJack Shafer\n\n\n                                            By \nMichael Hirsh\n\n\n                                            By \n                                                    Michael Lind\n\n\n                                            By \nJack Shafer\n\n\n                Getty\n\n            By \nEliza Collins\n\n11/16/15 06:43 PM EST\nBen Carson wants to increase military intervention in Syria because he sees Islamic State militants as an existential threat to the United States, something he said was not an issue with Al Qaeda in 2003. \n\u201cA lot of Americans really think back to 2003, and they remember Saddam Hussein and Al Qaeda,\u201d Carson explained at a Nevada rally on Sunday, according to MSNBC. \u201cThey say, \u2018we never should have gone in there and destabilized it.\u2019 And they may be right about that.\"\nStory Continued Below\n\u201cBut here\u2019s the problem, Saddam Hussein and Al Qaeda at that time was not an existential threat to us. The global jihad movement is an existential threat. They want to destroy us and everything that has to do with us,\u201d the retired neurosurgeon continued, even though Al Qaeda was the force behind the 9/11 attacks.\n\n2016\n\n            By \nEli Stokols\n\nCarson, along with many in the Republican field, have criticized Obama\u2019s strategy in Syria, particularly in the wake of the bloody terrorist attack in Paris on Friday that killed more than 130 people and wounded 350. \nOn Monday he called for the Obama administration to refuse Syrian refugees and promised a new strategy if he becomes president. \"Tell Congress to defund the Obama Administration's plan to bring 10,000 Syrian refugees into America,\" Carson tweeted with a link to his website. \n\u201cThe era of arm-chair quarterbacking our military will end in the Carson Administration. We must empower our military to destroy #ISIS,\u201d he tweeted. \u201cTalk is cheap. When we draw a line in the sand or boundary in the air, the world - most importantly #ISIS - needs to understand we mean it,\u201d he followed.\nCarson's campaign did not immediately respond to request for comment.\n \u00a9 2015 POLITICO LLC", "byline": "", "description": "", "title": "Carson claims Al Qaeda was not &apos;an existential threat&apos; in 2003", "url": "http://www.politico.com/story/2015/11/ben-carson-al-qaeda-paris-attacks-215950", "topics": ["foreign policy/national security"], "people": ["Isaac Arnsdorf", "Burgess Everett", "Jim Obergefell", "Bernie Becker", "Kate Tummarello", "Henry C. Jackson", "Michael Grunwald", "Hadas Gold", "Ted Cruz", "Spencer Zwick", "Theodoric Meyer", "Brian Mahoney", "Pierre Briancon", "Nahal Toosi", "Josh Gerstein", "Dianne Feinstein", "Gabriel Debenedetti", "Allie Grasgreen Ciaramella", "Katie Glueck", "Nick Gass", "Jack Shafer", "Michael Hirsh", "Brett Norman", "Jennifer Scholtes", "Alex Isenstadt", "Seung Min Kim", "Michael Lind", "Marco Rubio", "Jake Sherman", "Barack Obama", "Chase Purdy", "Nicholas Vinocur", "Brianna Ehley", "David Pittman", "Saddam Hussein", "Daniel Strauss", "Sarah Karlin", "Hillary Clinton", "Eli Stokols", "Mike Huckabee", "Victoria Guida", "Alex Byers", "Eliza Collins", "Ben Carson", "Laura Nahmias"], "orgs": ["HHS", "FDA", "Senate Judiciary", "DNC", "Blackburn", "Senate", "Al Qaeda", "State Department", "AMA", "House Republican Conference", "Circuit Court of Appeals", "SEC", "Congress", "Medicaid", "MSNBC", "ISIL", "Senate Commerce", "Capitol Police"], "election_confidence": 0.6566123206468588, "authors": [{"author_id": 31592, "fullname": "gabriel debenedetti", "primary_org": "politico"}], "date_written": "2015-11-16 23:43:33", "org": "politico", "article_id": "b166e125d4f90003c08cd2637f1d109c", "date_access": "2015-11-17 00:00:06.399810"}