{"body": "\n11/05/15 06:55 PM EST\n\n                                        By \n                                                POLITICO Staff\n\n\"I think there is a possibility that there was a bomb on board and we're taking that very seriously,\" he says. \n\n11/05/15 06:48 PM EST\n\n                                        By \nEliza Collins\n\nThe statement was out for about an hour, before it was rescinded. \n\n                                        Updated 11/05/15 06:23 PM EST\n\n                                        By \nElana Schor\n\nThe company said it is reviewing the subpoena disputed allegations that it misled the public. \n\n11/05/15 06:21 PM EST\n\n                                        By \nEliza Collins\n\nJeb Bush can fix anything.\n\n2016\n\n11/05/15 06:02 PM EST\n\n                                        By \nAlex Isenstadt\n                                         and \nMarc Caputo\n\nFlorida's top fundraiser quits Bush team, signals shift to Rubio.\n\n11/05/15 05:59 PM EST\n\n                                        By \n                                                Henry C. Jackson\n\nEight months into Hillary Clinton\u2019s second presidential run, Bill Clinton is already occupying a more significant private role as a strategic adviser than...\n\n2016\n\n11/05/15 04:43 PM EST\n\n                                        By \nAnnie Karni\n\nThe former president is taking a more active role and is staying calm.\n\n                                        Updated 11/05/15 04:16 PM EST\n\n                                        By \nJohn Bresnahan\n\nThe California Republican is happy to be House majority leader, for now.\n\n                                        Updated 11/05/15 03:59 PM EST\n\n                                        By \nJosh Gerstein\n\nKrass said scrutiny of OLC has had the effect of reducing demands for its formal opinions.\n\n                                        Updated 11/05/15 03:59 PM EST\n\n                                        By \nDaniel Strauss\n\nChristie shrugged off the prospect that he would be pushed out of the next mainstage Republican presidential primary debate.\n\n11/05/15 03:37 PM EST\n\n11/05/15 03:36 PM EST\n\n                                        By \n                                                Alex Weprin\n\nThe debate will be streamed for free on Foxbusiness.com without the need to be a cable TV subscriber.\n\n11/05/15 03:32 PM EST\n\n                                        Updated 11/05/15 03:31 PM EST\n\n                                        By \nNick Gass\n\nJeb Bush expressed full confidence in his brother's decision-making and power during his presidency on Thursday.\n\n11/05/15 02:49 PM EST\n\n11/05/15 02:48 PM EST\n\n                                        Updated 11/05/15 02:42 PM EST\n\n                                        By \nSeung Min Kim\n\nDemocrats plan to relent and allow a separate funding measure that pays for military construction and veterans programs to advance on the Senate floor.\n\n                                        Updated 11/05/15 02:41 PM EST\n\n                                        By \nNick Gass\n\n\"If all you want is political experience then I cannot be your candidate.\"\n\n11/05/15 02:15 PM EST\n\n                                        By \nHadas Gold\n\nJon Allen has left Vox, POLITICO has confirmed.\n\n                                        Updated 11/05/15 02:03 PM EST\n\n                                        By \nEliza Collins\n\nHomeland Secretary Jeh Johnson approved the campaigns request. \n\n11/05/15 02:00 PM EST\n\n                                        By \nIsaac Arnsdorf \n\nABA taps Chamber's Sharp \u2014 Brady allies ascendant \u2014 Fundraisers sidelined?\n\n11/05/15 01:59 PM EST\n\n                                        By \nNick Gass\n\nAs Carson's support increases, so has media scrutiny of his past statements.\n\n11/05/15 01:44 PM EST\n\n                                        By \nJake Sherman\n\n\"I'm going to tell you bills will come up that may not pass,\" Ryan (R-Wis.) told reporters.\n\n11/05/15 01:30 PM EST\n\n                                        Updated 11/05/15 12:48 PM EST\n\n                                        By \nNick Gass\n\nIn the first of two ads, a female narrator intones: \"Donald Trump is running for president because politicians are all talk and no action.\" \n\n11/05/15 12:12 PM EST\n\n                                        By \nGabriel Debenedetti\n\nBernie Sanders' presidential campaign has signed a joint fundraising agreement with the Democratic National Committee, the DNC confirmed to POLITICO.\n\n                                        Updated 11/05/15 11:46 AM EST\n\n                                        By \nEliza Collins\n\n\u201cI don\u2019t know what it\u2019s like to lose a daughter, but I almost did,\u201d he says. \n\n11/05/15 11:44 AM EST\n\n11/05/15 11:43 AM EST\n\n                                        By \nNick Gass\n\nAs a Seventh-Day Adventist, it is unlikely that Ben Carson would imbibe anything with the son of God.\n\n11/05/15 11:14 AM EST\n\n                                        By \nHeather Caygle\n                                         and \nLauren Gardner\n\nThe House just voted 363-64 to pass a six-year, nearly $340 billion highway and transit bill.\n\n11/05/15 11:07 AM EST\n\n11/05/15 10:59 AM EST\n\n                                        By \nNick Gass\n\nAsked if he would back Trump, Lee began to speak, but then fell speechless.\n\n11/05/15 10:57 AM EST\n\n                                        By \nHadas Gold\n\nDuring her show on Wednesday night, Kelly went through some of Murray's reporting.\n\n11/05/15 10:26 AM EST\n\n11/05/15 10:25 AM EST\n\n                                        By \nBernie Becker\n\nIt\u2019s Brady \u2014 Ryan throws his weight around \u2014 Gas tax revolt?\n\n11/05/15 10:19 AM EST\n\n11/05/15 10:18 AM EST\nAirBNB\u2019s BIG PLANS\n\n11/05/15 10:03 AM EST\n\n                                        By \nTony Romm\n\nBlue Origin, the Bezos space company, eyes D.C. -- U.S. keeps up privacy push in EU -- Sharing economy companies go on offense -- R&D credit, online...\n\n11/05/15 10:03 AM EST\n\n                                        By \nBrian Mahoney\n\nUAW workers likely to approve GM deal \u2014 CTU tests waters on strike\n\n11/05/15 10:02 AM EST\n\n                                        By \nNick Gass\n\nJeb Bush will win the New Hampshire Republican primary, the former Florida governor declared in an interview. \n\n11/05/15 10:02 AM EST\n\n                                        By \nLauren Gardner\n                                         and \nHeather Caygle\n\nHistory on the horizon \u2014 Gas tax doldrums \u2014 Ways and Means gets new leader\n\n11/05/15 10:00 AM EST\n\n                                        By \nJake Sherman\n\nRyan announced the task force in a closed meeting Thursday.\n\n11/05/15 10:00 AM EST\n\n                                        By \nTheodoric Meyer\n\nOn to Louisiana: Dardenne said to endorse Edwards \u2014 Priorities USA Action launches new web ad \u2014 Supreme Court hears Maryland redistrictng case\n\n11/05/15 10:00 AM EST\n\n                                        By \nEric Wolff\n\nState continues KXL review -- Grid reliability hops on highway bill\n\n11/05/15 10:00 AM EST\n\n                                        By \nTim Starks\n\nNew car hacking legislation set to drop \u2014 A dispute about a CISA dispute \u2014 Farenthold, cyber caucus hit back over asbestos bill complaints\n\n11/05/15 10:00 AM EST\n\n                                        By \nErin Mershon\n\nObama to talk open enrollment in radio interviews \u2014 Brady gets the W&M gavel \u2014 Mental health legislation moves forward\n\n11/05/15 10:00 AM EST\n\n                                        By \nJenny Hopkinson\n\nAppropriations path unclear for waters rule \u2014Bipartisan bill pushes crop insurance reforms\n\n11/05/15 10:00 AM EST\n\n                                        By \nCaitlin Emma\n\nUT System\u2019s next chapter \u2014 First look: Making Corinthian veterans whole \u2014 Tribal Nations conference today \n\n11/05/15 10:00 AM EST\n\n                                        By \nDarius Tahir\n\nPoll: Consumers less concerned about privacy, but not quite there on tech \n\n11/05/15 08:33 AM EST\n\n                                        By \nJeremy Herb\n\nU.S. intel suggests bomb brought down plane \u2014 Britain suspends flights to Sinai Peninsula \u2014 NDAA, defense appropriations votes today\nWe're working on more stories right now\n\n                                            By \n                                                    Issac J. Bailey\n\n\n                                            By \n                                                    David Makovsky\n\n\n                                            By \n                                                    Barney Frank\n\n\n                                            By \nBenjamin Wofford\n\n\n                AP Photo\n\n            By \nEliza Collins\n\n11/05/15 06:48 PM EST\nLos Angeles Mayor Eric Garcetti endorsed Hillary Clinton for president, sort of.\nOn Thursday, Garcetti\u2019s office sent out a press release throwing the mayor's support behind the Democratic front-runner, and talking up her credentials. \"I\u2019m proud to endorse Hillary Clinton for president because I know that she understands the challenges and opportunities facing our cities and will be a powerful leader in building our future,\" Garcetti wrote. \u201cIn Hillary Clinton, Mayors will have a partner, someone ready to stand up for our mainstream economy.\u201d\nStory Continued Below\nBut then an hour later he took it back. \n\"Today's statement on Hillary Clinton was sent in error,\" a second press release said. \nPeter Jamison, a Los Angeles Times reporter who originally covered the story, said that the retraction came \u201cafter @latimes asked about misuse of mayor's comms staff/computers for campaign activity.\u201d\nIn California it is illegal to use government resources \u2013 including equipment \u2013 for endorsements, according to The Times.\nA member of Garcetti\u2019s staff told The Times that the original press release was sent from the wrong email account, but didn\u2019t clarify if it was actually retracted.\n \u00a9 2015 POLITICO LLC", "byline": "", "description": "", "title": "L.A. mayor endorses Clinton, then takes it back", "url": "http://www.politico.com/story/2015/11/eric-garcetti-endorses-hillary-clinton-215577", "topics": ["foreign policy/national security", "economy"], "people": ["Isaac Arnsdorf", "Lauren Gardner", "Eric Garcetti", "Erin Mershon", "Henry C. Jackson", "Hadas Gold", "Marc Caputo", "Jon Allen", "Jenny Hopkinson", "Brian Mahoney", "Alex Weprin", "Theodoric Meyer", "Josh Gerstein", "Elana Schor", "Gabriel Debenedetti", "Annie Karni", "Nick Gass", "Bernie Becker", "Jeb Bush", "Bill Clinton", "Alex Isenstadt", "Seung Min Kim", "Issac J. Bailey", "Jeh Johnson", "Donald Trump", "John Bresnahan", "Jake Sherman", "Eliza Collins", "Barney Frank", "Bernie Sanders", "David Makovsky", "Tim Starks", "Jeremy Herb", "Tony Romm", "Heather Caygle", "Daniel Strauss", "Hillary Clinton", "Eric Wolff", "Darius Tahir", "Ben Carson", "Caitlin Emma"], "orgs": ["DNC", "Senate", "Priorities USA Action", "Supreme Court", "UAW", "Democratic National Committee", "R&D"], "election_confidence": 0.9916147261441944, "authors": [{"author_id": 31370, "fullname": "politico staff", "primary_org": "politico"}], "date_written": "2015-11-05 23:48:32", "org": "politico", "article_id": "03c8f869f9d741ff525da9b8089c1e30", "date_access": "2015-11-06 00:00:06.455544"}