{"body": "\n11/12/15 01:44 PM EST\n\n                                        By \nSteven Shepard\n                                         and \nElena Schneider\n\nRep. Sam Farr won't run for reelection in 2016, the California Democrat plans announced Thursday. \n\n11/12/15 01:14 PM EST\n\n                                        By \nEliza Collins\n\nThe two leaders will have \"ample\" time for conversation, a top Obama aide says. \n\n11/12/15 12:40 PM EST\n\n11/12/15 12:39 PM EST\n\n11/12/15 12:31 PM EST\n\n                                        Updated 11/12/15 12:13 PM EST\n\n                                        By \nDarren Goode\n\nThe plan comes as Clinton and Sanders have both sought an edge with aggressive policies to confront climate change.>\n\n11/12/15 12:10 PM EST\n\n                                        By \nEliza Collins\n\nThe Texas senator and business mogul each have 27 percent of likely Republican voters in the state\n\n11/12/15 11:58 AM EST\n\n                                        By \nAlex Isenstadt\n\nThe controversial businessman may work with Rick Reed, a chief architect of the Swift Boat attack on Kerry.\n\n11/12/15 11:43 AM EST\n\n                                        By \nNolan D. McCaskill\n\nThe former Florida governor is reinventing himself.\n\n                                        Updated 11/12/15 11:21 AM EST\n\n                                        By \nBrian Mahoney\n\nPostal Workers endorse Sanders \u2013 UFCW files NAFTA complaint\n\n                                        Updated 11/12/15 11:11 AM EST\n\n                                        By \nNick Gass\n\n\"You would think that a paper like The Wall Street Journal would call for a clarification,\" Trump says.\n\n                                        Updated 11/12/15 10:59 AM EST\n\n                                        By \nJake Sherman\n\nBig changes are coming from Paul Ryan.\n\n11/12/15 10:56 AM EST\n\n11/12/15 10:12 AM EST\n\n11/12/15 10:08 AM EST\nAIRBNB\u2019S peace offering\n\n11/12/15 10:03 AM EST\n\n                                        By \nElena Schneider\n\nScore Q&A with Jason Kander\n\n11/12/15 10:02 AM EST\n\n                                        By \nJennifer Scholtes\n\nU.N. nations consider plane-tracker agreement \u2014 McCaul sees inside threat as greatest aviation vulnerability \u2014 Outside stakeholders throw down in bus vs....\n\n11/12/15 10:02 AM EST\n\n                                        By \nBernie Becker\n\nThe VAT wars \u2014 Fiorina shoots for three\n\n11/12/15 10:02 AM EST\n\n                                        By \nTony Romm\n\nGoodlatte, McCarthy raise GOP cash in L.A. \u2014 Tech descends on Iowa \u2014 AT&T on spectrum auctions\n\n11/12/15 10:01 AM EST\n\n                                        By \nDoug Palmer\n\nAfghanistan cleared for WTO membership \u2014 Colombia urges talks on illicit trade\n\n11/12/15 10:00 AM EST\n\n                                        By \nEric Wolff\n\nClinton releasing plan for coal workers? \u2014 Kerry possibly OK with congressional review of climate deal\n\n11/12/15 10:00 AM EST\n\n                                        By \nTim Starks\n\nThe playboy cyber criminals of Brazil \u2014 TVs getting hacked too\n\n11/12/15 10:00 AM EST\n\n                                        By \nDarius Tahir\n\nMore digital health investment (at retail clinics) \u2014 FDA considering DNA tests and sequencing\n\n11/12/15 10:00 AM EST\n\n                                        By \nJenny Hopkinson\n\nIs today the day for FSMA? \u2014 EU set to release glyphosate findings\n\n11/12/15 10:00 AM EST\n\n                                        By \nCaitlin Emma\n\nWorking college students \u2013 Rubio says Clinton \u2018captive\u2019 to unions\n\n11/12/15 10:00 AM EST\n\n                                        By \nBrianna Ehley\n\nColorado's replacement plan? Single payer \u2014 GOP moderates oppose Planned Parenthood defund in reconciliation bill\n\n11/12/15 08:30 AM EST\n\n                                        By \nJeremy Herb\n\nMcCain threatens court battle over Gitmo \u2014 Obama to award Medal of Honor\n\n11/12/15 08:05 AM EST\n\n                                        By \nNick Gass\n\n\"That was on minimum wage and it was how we're going to compete with other countries,\" Trump says. \n\n11/12/15 08:01 AM EST\nRICK WILEY\u2019s new gig -- B\u2019DAY: Dr. Elena Allbritton\n\n11/12/15 07:59 AM EST\n\n                                        By \nBen White\n\nHappy Glass-Steagall repeal anniversary \u2014 Big day for Fed speak \u2014 More debate grades \u2014 Bush plans big DC fundraiser\n\n11/12/15 07:44 AM EST\n\n                                        By \nNick Gass\n\n\"The President commended her for her tireless efforts and sacrifice over so many years to promote a more inclusive, peaceful, and democratic Burma,\"...\n\n11/12/15 07:32 AM EST\n\n                                        By \nBurgess Everett\n\nBAGLEY SMITH MAKES MOVES\n\n11/12/15 07:30 AM EST\nChicago gun sources, mapped\n\n11/12/15 07:05 AM EST\n\n                                        By \nNick Gass\n\nBernie Sanders snagged a major union endorsement on Thursday.\n\n11/12/15 06:50 AM EST\nSCHNEIDERMAN\u2019s fantasy-site campaign\n\n11/12/15 06:48 AM EST\n\n                                        By \nNick Gass\n\n\"We would do it in a very humane way,\" Trump says of the deportation plan.\n\n11/12/15 06:45 AM EST\nTUNNEL plan\n\n11/12/15 06:40 AM EST\nMASS MOOSE issue\n\n                                        By \n                                                Jacopo Barigazzi\n\n\n                                        By \n                                                Nicholas Vinocur\n\n\n11/12/15 06:32 AM EST\n\n                                        By \nNick Gass\n\nBen Carson blasted ongoing situations at his alma mater, Yale University, and at the University of Missouri.\n\n11/12/15 06:28 AM EST\nRubio v. Cruz.\n\nHealth Care \n\n11/12/15 05:25 AM EST\n\n                                        By \nRachana Pradhan\n\nColorado will vote on the plan long favored by liberals, bringing a big health care fight to the swing state. \n\nHealth Care\n\n11/12/15 05:25 AM EST\n\n                                        By \nJennifer Haberkorn\n                                         and \nSeung Min Kim\n\nLegislative language on Planned Parenthood could imperil another conserative goal.\n\nOpinion\n\n11/12/15 05:23 AM EST\n\n                                        By \n                                                Rich Lowry\n\nThe Texas senator is a severely underrated contender.\n\nHistory Dept.\n\n11/12/15 05:22 AM EST\n\n                                        By \n                                                Jon Meacham\n\nWe know that W. was ready to go it alone in a fight of good vs. evil. Less remembered: His father was, too. \n\nCongress\n\n11/12/15 05:20 AM EST\n\n                                        By \nDarren Goode\n\nTough negotiations have strained friendships, but they have brought Congress close to overhauling a 25-year-old environmental law.\n\n11/12/15 12:00 AM EST\n\n                                        By \nAndrew Glass\n\nThe briefers lauded the policy.\n\nRepublicans\n\n                                        Updated 11/11/15 11:13 PM EST\n\n                                        By \nKenneth P. Vogel\n\nNew details reveal the billionaire brothers' network efforts to reshape the GOP are more ambitious than previously reported.\nWe're working on more stories right now\nSponsored by Bank of America\n\n                                            By \n                                                    Rich Lowry\n\n\n                                            By \nPOLITICO Magazine\n\n\n                                            By \n                                                    Jeff Greenfield\n\n\n                                            By \nJack Shafer\n\n\n                Rep. Sam Farr announced that he won't run for reelection. | AP\n\n            By \nSteven Shepard\n             and \nElena Schneider\n\n11/12/15 01:44 PM EST\nRep. Sam Farr won't run for reelection in 2016, the California Democrat announced Thursday. \nFarr was first elected in a 1993 special election to succeed former Rep. Leon Panetta, who left the seat to become director of the Office of Management and Budget under Bill Clinton.\nStory Continued Below\nFarr's decision was first reported by KSBW-TV.\nThe Monterey-based district is safely Democratic: President Barack Obama won 71 percent of the vote there in 2012, and Farr was reelected last year with 75 percent of the vote.\nPanetta's son, Monterey County Deputy District Attorney James Panetta, has been mentioned as a possible successor to Farr. \"I've talked to people about it, and it's something I'm seriously considering,\" the younger Panetta told the Carmel Pine Cone in 2013.\n \u00a9 2015 POLITICO LLC", "byline": "", "description": "", "title": "California Democrat Farr announces retirement", "url": "http://www.politico.com/story/2015/11/california-democrat-farr-announces-retirement-215799", "topics": ["trade"], "people": ["Burgess Everett", "Eliza Collins", "Kenneth P. Vogel", "Leon Panetta", "Doug Palmer", "Jacopo Barigazzi", "Steven Shepard", "Barack Obama", "Jenny Hopkinson", "Brian Mahoney", "Darius Tahir", "Brianna Ehley", "Jeff Greenfield", "Rich Lowry", "Nick Gass", "Jack Shafer", "Bernie Becker", "Jennifer Scholtes", "Bill Clinton", "Alex Isenstadt", "Seung Min Kim", "Andrew Glass", "Jeremy Herb", "Jake Sherman", "Darren Goode", "Paul Ryan", "Nicholas Vinocur", "Bernie Sanders", "Tim Starks", "Jason Kander", "Tony Romm", "Jennifer Haberkorn", "Rachana Pradhan", "Ben White", "Elena Schneider", "Rick Reed", "Eric Wolff", "Ben Carson", "Caitlin Emma"], "orgs": ["Fed", "Congress", "NAFTA", "Bank of America", "UFCW", "Yale University", "U.N.", "Swift Boat", "Medal of Honor", "Office of Management and Budget", "AT&T", "GOP", "WTO"], "election_confidence": 0.8984230342400785, "authors": [{"author_id": 30902, "fullname": "steven shepard", "primary_org": "politico"}, {"author_id": 30901, "fullname": "elena schneider", "primary_org": "politico"}], "date_written": "2015-11-12 18:44:00", "org": "politico", "article_id": "709b911b9b04398d4173d88da7cb04cb", "date_access": "2015-11-12 19:00:06.712610"}