{"body": "\n11/12/15 01:14 PM EST\n\n                                        By \nEliza Collins\n\nThe two leaders will have \"ample\" time for conversation, a top Obama aide says. \n\n11/12/15 12:40 PM EST\n\n11/12/15 12:39 PM EST\n\n11/12/15 12:31 PM EST\n\n                                        Updated 11/12/15 12:13 PM EST\n\n                                        By \nDarren Goode\n\nThe plan comes as Clinton and Sanders have both sought an edge with aggressive policies to confront climate change.>\n\n11/12/15 12:10 PM EST\n\n                                        By \nEliza Collins\n\nThe Texas senator and business mogul each have 27 percent of likely Republican voters in the state\n\n11/12/15 11:58 AM EST\n\n                                        By \nAlex Isenstadt\n\nThe controversial businessman may work with Rick Reed, a chief architect of the Swift Boat attack on Kerry.\n\n11/12/15 11:43 AM EST\n\n                                        By \nNolan D. McCaskill\n\nThe former Florida governor is reinventing himself.\n\n                                        Updated 11/12/15 11:21 AM EST\n\n                                        By \nBrian Mahoney\n\nPostal Workers endorse Sanders \u2013 UFCW files NAFTA complaint\n\n                                        Updated 11/12/15 11:11 AM EST\n\n                                        By \nNick Gass\n\n\"You would think that a paper like The Wall Street Journal would call for a clarification,\" Trump says.\n\n                                        Updated 11/12/15 10:59 AM EST\n\n                                        By \nJake Sherman\n\nBig changes are coming from Paul Ryan.\n\n11/12/15 10:56 AM EST\n\n11/12/15 10:12 AM EST\n\n11/12/15 10:08 AM EST\nAIRBNB\u2019S peace offering\n\n11/12/15 10:03 AM EST\n\n                                        By \nElena Schneider\n\nScore Q&A with Jason Kander\n\n11/12/15 10:02 AM EST\n\n                                        By \nJennifer Scholtes\n\nU.N. nations consider plane-tracker agreement \u2014 McCaul sees inside threat as greatest aviation vulnerability \u2014 Outside stakeholders throw down in bus vs....\n\n11/12/15 10:02 AM EST\n\n                                        By \nBernie Becker\n\nThe VAT wars \u2014 Fiorina shoots for three\n\n11/12/15 10:02 AM EST\n\n                                        By \nTony Romm\n\nGoodlatte, McCarthy raise GOP cash in L.A. \u2014 Tech descends on Iowa \u2014 AT&T on spectrum auctions\n\n11/12/15 10:01 AM EST\n\n                                        By \nDoug Palmer\n\nAfghanistan cleared for WTO membership \u2014 Colombia urges talks on illicit trade\n\n11/12/15 10:00 AM EST\n\n                                        By \nEric Wolff\n\nClinton releasing plan for coal workers? \u2014 Kerry possibly OK with congressional review of climate deal\n\n11/12/15 10:00 AM EST\n\n                                        By \nTim Starks\n\nThe playboy cyber criminals of Brazil \u2014 TVs getting hacked too\n\n11/12/15 10:00 AM EST\n\n                                        By \nDarius Tahir\n\nMore digital health investment (at retail clinics) \u2014 FDA considering DNA tests and sequencing\n\n11/12/15 10:00 AM EST\n\n                                        By \nJenny Hopkinson\n\nIs today the day for FSMA? \u2014 EU set to release glyphosate findings\n\n11/12/15 10:00 AM EST\n\n                                        By \nCaitlin Emma\n\nWorking college students \u2013 Rubio says Clinton \u2018captive\u2019 to unions\n\n11/12/15 10:00 AM EST\n\n                                        By \nBrianna Ehley\n\nColorado's replacement plan? Single payer \u2014 GOP moderates oppose Planned Parenthood defund in reconciliation bill\n\n11/12/15 08:30 AM EST\n\n                                        By \nJeremy Herb\n\nMcCain threatens court battle over Gitmo \u2014 Obama to award Medal of Honor\n\n11/12/15 08:05 AM EST\n\n                                        By \nNick Gass\n\n\"That was on minimum wage and it was how we're going to compete with other countries,\" Trump says. \n\n11/12/15 08:01 AM EST\nRICK WILEY\u2019s new gig -- B\u2019DAY: Dr. Elena Allbritton\n\n11/12/15 07:59 AM EST\n\n                                        By \nBen White\n\nHappy Glass-Steagall repeal anniversary \u2014 Big day for Fed speak \u2014 More debate grades \u2014 Bush plans big DC fundraiser\n\n11/12/15 07:44 AM EST\n\n                                        By \nNick Gass\n\n\"The President commended her for her tireless efforts and sacrifice over so many years to promote a more inclusive, peaceful, and democratic Burma,\"...\n\n11/12/15 07:32 AM EST\n\n                                        By \nBurgess Everett\n\nBAGLEY SMITH MAKES MOVES\n\n11/12/15 07:30 AM EST\nChicago gun sources, mapped\n\n11/12/15 07:05 AM EST\n\n                                        By \nNick Gass\n\nBernie Sanders snagged a major union endorsement on Thursday.\n\n11/12/15 06:50 AM EST\nSCHNEIDERMAN\u2019s fantasy-site campaign\n\n11/12/15 06:48 AM EST\n\n                                        By \nNick Gass\n\n\"We would do it in a very humane way,\" Trump says of the deportation plan.\n\n11/12/15 06:45 AM EST\nTUNNEL plan\n\n11/12/15 06:40 AM EST\nMASS MOOSE issue\n\n                                        By \n                                                Jacopo Barigazzi\n\n\n                                        By \n                                                Nicholas Vinocur\n\n\n11/12/15 06:32 AM EST\n\n                                        By \nNick Gass\n\nBen Carson blasted ongoing situations at his alma mater, Yale University, and at the University of Missouri.\n\n11/12/15 06:28 AM EST\nRubio v. Cruz.\n\nHealth Care \n\n11/12/15 05:25 AM EST\n\n                                        By \nRachana Pradhan\n\nColorado will vote on the plan long favored by liberals, bringing a big health care fight to the swing state. \n\nHealth Care\n\n11/12/15 05:25 AM EST\n\n                                        By \nJennifer Haberkorn\n                                         and \nSeung Min Kim\n\nLegislative language on Planned Parenthood could imperil another conserative goal.\n\nOpinion\n\n11/12/15 05:23 AM EST\n\n                                        By \n                                                Rich Lowry\n\nThe Texas senator is a severely underrated contender.\n\nHistory Dept.\n\n11/12/15 05:22 AM EST\n\n                                        By \n                                                Jon Meacham\n\nWe know that W. was ready to go it alone in a fight of good vs. evil. Less remembered: His father was, too. \n\nCongress\n\n11/12/15 05:20 AM EST\n\n                                        By \nDarren Goode\n\nTough negotiations have strained friendships, but they have brought Congress close to overhauling a 25-year-old environmental law.\n\n11/12/15 12:00 AM EST\n\n                                        By \nAndrew Glass\n\nThe briefers lauded the policy.\n\nRepublicans\n\n                                        Updated 11/11/15 11:13 PM EST\n\n                                        By \nKenneth P. Vogel\n\nNew details reveal the billionaire brothers' network efforts to reshape the GOP are more ambitious than previously reported.\n\n2016\n\n                                        Updated 11/11/15 10:29 PM EST\n\n                                        By \nEli Stokols\n                                         and \nKatie Glueck\n\nThe two Cuban-American, 40-something, first-term senators are increasingly viewed as the candidates to beat.\nWe're working on more stories right now\nSponsored by Bank of America\n\n                                            By \n                                                    Rich Lowry\n\n\n                                            By \nPOLITICO Magazine\n\n\n                                            By \n                                                    Jeff Greenfield\n\n\n                                            By \nJack Shafer\n\n\n                Obama travels to Antalya, Turkey this weekend for the G20 summit where the civil war in Syria is expected to be a top agenda item. | AP Photo\n\n                        The two leaders will have \"ample\" time for conversation, a top Obama aide says. \n\n            By \nEliza Collins\n\n11/12/15 01:14 PM EST\nPresident Barack Obama and Russian President Vladimir Putin may not have any meetings on the schedule but they may still end up talking.\n\u201cThere is not a formal meeting between the president and Mr. Putin on the schedule but has often been the case at the G20 and other multilateral leaders meetings we fully expect they\u2019ll have ample opportunity for discussion directly,\u201d National Security Adviser Susan Rice said at a White House briefing Thursday.\nStory Continued Below\nObama travels to Antalya, Turkey this weekend for the G20 summit where the civil war in Syria is expected to be a top agenda item.\n\nWhite House\n\n            By \nElana Schor\n             and \nAndrew Restuccia\n\n\u201cThe G20 meeting will come just after Secretary Kerry again convenes the key countries in Vienna along with the United Nations we\u2019ve been working with all the key players in that configuration including the Russians,\u201d Rice said. \u201cThe Russians certainly have their ideas, we have ours, other players have theirs and this discussion in Vienna will be an opportunity to try to see the extent to which we can forge a common way forward.\u201d \nRice said everyone will be looking for a concrete transition plan for Syria, though later in the briefing she acknowledged concrete plans aren\u2019t likely to come immediately because she views it as \"a process.\"\n\u201cI think we\u2019re all very realistic for the conflict in Syria to be resolved, which it must, it\u2019s going to require all the relevant players to come to a common understanding,\u201d Rice said. \n \u00a9 2015 POLITICO LLC", "byline": "", "description": "The two leaders will have \"ample\" time for conversation, a top Obama aide says.", "title": "Obama and Putin may discuss Syria at G20", "url": "http://www.politico.com/story/2015/11/obama-putin-syria-g20-215798", "topics": ["trade"], "people": ["Burgess Everett", "Eliza Collins", "Susan Rice", "Kenneth P. Vogel", "Doug Palmer", "Vladimir Putin", "Jacopo Barigazzi", "Vladimir V. Putin", "Barack Obama", "Jenny Hopkinson", "Brian Mahoney", "Andrew Restuccia", "Caitlin Emma", "Elana Schor", "Brianna Ehley", "Rich Lowry", "Katie Glueck", "Nick Gass", "Jack Shafer", "Bernie Becker", "Jennifer Scholtes", "Alex Isenstadt", "Seung Min Kim", "Andrew Glass", "Jeremy Herb", "Jake Sherman", "Darren Goode", "Paul Ryan", "Nicholas Vinocur", "Bernie Sanders", "Tim Starks", "Jason Kander", "Tony Romm", "Jennifer Haberkorn", "Rachana Pradhan", "Ben White", "Eli Stokols", "Elena Schneider", "Rick Reed", "Eric Wolff", "Darius Tahir", "Ben Carson", "Jeff Greenfield"], "orgs": ["Fed", "National Security", "Congress", "NAFTA", "Bank of America", "UFCW", "Yale University", "U.N.", "Swift Boat", "Medal of Honor", "AT&T", "United Nations", "GOP", "WTO"], "election_confidence": 0.9104961137274975, "authors": [{"author_id": 32625, "fullname": "eliza collins", "primary_org": "politico"}], "date_written": "2015-11-12 18:14:33", "org": "politico", "article_id": "019d08d7d8f5f0bfa2751c9a3a4ee9a4", "date_access": "2015-11-12 18:43:38.264825"}