{"body": "\n11/12/15 03:59 PM EST\n\n                                        By \nAlex Isenstadt\n\nIt\u2019s the first time that a pro-Christie group has purchased airtime in Iowa.\n\n                                        Updated 11/12/15 03:40 PM EST\n\n                                        By \nDaniel Strauss\n\nPractically the entire GOP field is throwing around accusations, but the fight between the two senators got especially nasty.\n\n11/12/15 03:28 PM EST\n\n                                        By \nNahal Toosi\n\nThe exclusion of rebel groups from recent peace talks stirred controversy. \n\n11/12/15 03:10 PM EST\n\n                                        By \nNick Gass\n\n\u201cThere just is no exemption for daily fantasy sports gambling.\"\n\n                                        Updated 11/12/15 02:36 PM EST\n\n                                        By \nEliza Collins\n\nThe two leaders will have \"ample\" time for conversation, a top Obama aide says. \n\n11/12/15 02:31 PM EST\n\n11/12/15 02:10 PM EST\n\n                                        By \nNoah Weiland\n\nThe debate will be broadcast live from Drake University in Des Moines, Iowa. \n\n11/12/15 02:00 PM EST\n\n                                        By \nIsaac Arnsdorf \n\nSugar coalition has Cruz's back \u2014 Koch scoop\n\n11/12/15 01:44 PM EST\n\n                                        By \nSteven Shepard\n                                         and \nElena Schneider\n\nThe rep. is stepping down.\n\n11/12/15 12:40 PM EST\n\n11/12/15 12:39 PM EST\n\n11/12/15 12:31 PM EST\n\n                                        Updated 11/12/15 12:13 PM EST\n\n                                        By \nDarren Goode\n\nThe plan comes as Clinton and Sanders have both sought an edge with aggressive policies to confront climate change.>\n\n11/12/15 12:10 PM EST\n\n                                        By \nEliza Collins\n\nThe Texas senator and business mogul each have 27 percent of likely Republican voters in the state\n\n11/12/15 11:58 AM EST\n\n                                        By \nAlex Isenstadt\n\nThe controversial businessman may work with Rick Reed, a chief architect of the Swift Boat attack on Kerry.\n\n11/12/15 11:43 AM EST\n\n                                        By \nNolan D. McCaskill\n\nThe former Florida governor is reinventing himself.\n\n                                        Updated 11/12/15 11:21 AM EST\n\n                                        By \nBrian Mahoney\n\nPostal Workers endorse Sanders \u2013 UFCW files NAFTA complaint\n\n                                        Updated 11/12/15 11:11 AM EST\n\n                                        By \nNick Gass\n\n\"You would think that a paper like The Wall Street Journal would call for a clarification,\" Trump says.\n\n                                        Updated 11/12/15 10:59 AM EST\n\n                                        By \nJake Sherman\n\nBig changes are coming from Paul Ryan.\n\n11/12/15 10:56 AM EST\n\n11/12/15 10:12 AM EST\n\n11/12/15 10:08 AM EST\nAIRBNB\u2019S peace offering\n\n11/12/15 10:03 AM EST\n\n                                        By \nElena Schneider\n\nScore Q&A with Jason Kander\n\n11/12/15 10:02 AM EST\n\n                                        By \nJennifer Scholtes\n\nU.N. nations consider plane-tracker agreement \u2014 McCaul sees inside threat as greatest aviation vulnerability \u2014 Outside stakeholders throw down in bus vs....\n\n11/12/15 10:02 AM EST\n\n                                        By \nBernie Becker\n\nThe VAT wars \u2014 Fiorina shoots for three\n\n11/12/15 10:02 AM EST\n\n                                        By \nTony Romm\n\nGoodlatte, McCarthy raise GOP cash in L.A. \u2014 Tech descends on Iowa \u2014 AT&T on spectrum auctions\n\n11/12/15 10:01 AM EST\n\n                                        By \nDoug Palmer\n\nAfghanistan cleared for WTO membership \u2014 Colombia urges talks on illicit trade\n\n11/12/15 10:00 AM EST\n\n                                        By \nEric Wolff\n\nClinton releasing plan for coal workers? \u2014 Kerry possibly OK with congressional review of climate deal\n\n11/12/15 10:00 AM EST\n\n                                        By \nTim Starks\n\nThe playboy cyber criminals of Brazil \u2014 TVs getting hacked too\n\n11/12/15 10:00 AM EST\n\n                                        By \nDarius Tahir\n\nMore digital health investment (at retail clinics) \u2014 FDA considering DNA tests and sequencing\n\n11/12/15 10:00 AM EST\n\n                                        By \nJenny Hopkinson\n\nIs today the day for FSMA? \u2014 EU set to release glyphosate findings\n\n11/12/15 10:00 AM EST\n\n                                        By \nCaitlin Emma\n\nWorking college students \u2013 Rubio says Clinton \u2018captive\u2019 to unions\n\n11/12/15 10:00 AM EST\n\n                                        By \nBrianna Ehley\n\nColorado's replacement plan? Single payer \u2014 GOP moderates oppose Planned Parenthood defund in reconciliation bill\n\n11/12/15 08:30 AM EST\n\n                                        By \nJeremy Herb\n\nMcCain threatens court battle over Gitmo \u2014 Obama to award Medal of Honor\n\n11/12/15 08:05 AM EST\n\n                                        By \nNick Gass\n\n\"That was on minimum wage and it was how we're going to compete with other countries,\" Trump says. \n\n11/12/15 08:01 AM EST\nRICK WILEY\u2019s new gig -- B\u2019DAY: Dr. Elena Allbritton\n\n11/12/15 07:59 AM EST\n\n                                        By \nBen White\n\nHappy Glass-Steagall repeal anniversary \u2014 Big day for Fed speak \u2014 More debate grades \u2014 Bush plans big DC fundraiser\n\n11/12/15 07:44 AM EST\n\n                                        By \nNick Gass\n\n\"The President commended her for her tireless efforts and sacrifice over so many years to promote a more inclusive, peaceful, and democratic Burma,\"...\n\n11/12/15 07:32 AM EST\n\n                                        By \nBurgess Everett\n\nBAGLEY SMITH MAKES MOVES\n\n11/12/15 07:30 AM EST\nChicago gun sources, mapped\n\n11/12/15 07:05 AM EST\n\n                                        By \nNick Gass\n\nBernie Sanders snagged a major union endorsement on Thursday.\n\n11/12/15 06:50 AM EST\nSCHNEIDERMAN\u2019s fantasy-site campaign\n\n11/12/15 06:48 AM EST\n\n                                        By \nNick Gass\n\n\"We would do it in a very humane way,\" Trump says of the deportation plan.\n\n11/12/15 06:45 AM EST\nTUNNEL plan\n\n11/12/15 06:40 AM EST\nMASS MOOSE issue\n\n                                        By \n                                                Jacopo Barigazzi\n\n\n                                        By \n                                                Nicholas Vinocur\n\n\n11/12/15 06:32 AM EST\n\n                                        By \nNick Gass\n\nBen Carson blasted ongoing situations at his alma mater, Yale University, and at the University of Missouri.\n\n11/12/15 06:28 AM EST\nRubio v. Cruz.\nWe're working on more stories right now\n\n                                                    Politico\nA play-by-play preview of the day's congressional news\n\n            By \nBurgess Everett\n\n11/11/15 08:27 AM EST\n \u00a9 2015 POLITICO LLC", "byline": "", "description": "On Veterans Day, hope for an AUMF vanishes.", "title": "POLITICO Huddle: SENATORS SHINE ON STAGE -- AUMF push dies -- Q poll says Menendez should resign -- OBAMACARE REPEAL PLODS FORWARD", "url": "http://www.politico.com/tipsheets/huddle/2015/11/politico-huddle-november-11-aumf-veterans-day-211204", "topics": ["trade"], "people": ["Isaac Arnsdorf", "Burgess Everett", "Doug Palmer", "Jacopo Barigazzi", "Steven Shepard", "Jenny Hopkinson", "Brian Mahoney", "Nahal Toosi", "Darius Tahir", "Caitlin Emma", "Nick Gass", "Bernie Becker", "Jennifer Scholtes", "Noah Weiland", "Alex Isenstadt", "Jason Kander", "Jake Sherman", "Eliza Collins", "Paul Ryan", "Nicholas Vinocur", "Brianna Ehley", "Tim Starks", "Jeremy Herb", "Tony Romm", "Daniel Strauss", "Darren Goode", "Ben Carson", "Ben White", "Elena Schneider", "Rick Reed", "Eric Wolff", "Bernie Sanders"], "orgs": ["Fed", "UFCW", "NAFTA", "Swift Boat", "Yale University", "AUMF", "Medal of Honor", "Drake University", "AT&T", "GOP", "U.N.", "WTO"], "election_confidence": 0.9882228485766693, "authors": [{"author_id": 31212, "fullname": "alex isenstadt", "primary_org": "politico"}], "date_written": "2015-11-11 13:27:10", "org": "politico", "article_id": "9ade7d2db591331d1b81dffe52c1da41", "date_access": "2015-11-12 21:45:00.878373"}