{"body": "\n11/12/15 11:58 AM EST\n\n                                        By \nAlex Isenstadt\n\nRick Reed has served as a strategist for a number of conservative causes.\n\n11/12/15 11:43 AM EST\n\n                                        By \nNolan D. McCaskill\n\nThe former Florida governor is reinventing himself.\n\n                                        Updated 11/12/15 11:21 AM EST\n\n                                        By \nBrian Mahoney\n\nPostal Workers endorse Sanders \u2013 UFCW files NAFTA complaint\n\n                                        Updated 11/12/15 11:11 AM EST\n\n                                        By \nNick Gass\n\n\"You would think that a paper like The Wall Street Journal would call for a clarification,\" Trump says.\n\n11/12/15 11:05 AM EST\n\n                                        By \nDarren Goode\n\nThe plan comes as Clinton and Sanders have both sought an edge with aggressive policies to confront climate change.>\n\n                                        Updated 11/12/15 10:59 AM EST\n\n                                        By \nJake Sherman\n\nBig changes are coming from Paul Ryan.\n\n11/12/15 10:56 AM EST\n\n11/12/15 10:12 AM EST\n\n11/12/15 10:08 AM EST\nAIRBNB\u2019S peace offering\n\n11/12/15 10:03 AM EST\n\n                                        By \nElena Schneider\n\nScore Q&A with Jason Kander\n\n11/12/15 10:02 AM EST\n\n                                        By \nJennifer Scholtes\n\nU.N. nations consider plane-tracker agreement \u2014 McCaul sees inside threat as greatest aviation vulnerability \u2014 Outside stakeholders throw down in bus vs....\n\n11/12/15 10:02 AM EST\n\n                                        By \nBernie Becker\n\nThe VAT wars \u2014 Fiorina shoots for three\n\n11/12/15 10:02 AM EST\n\n                                        By \nTony Romm\n\nGoodlatte, McCarthy raise GOP cash in L.A. \u2014 Tech descends on Iowa \u2014 AT&T on spectrum auctions\n\n11/12/15 10:01 AM EST\n\n                                        By \nDoug Palmer\n\nAfghanistan cleared for WTO membership \u2014 Colombia urges talks on illicit trade\n\n11/12/15 10:00 AM EST\n\n                                        By \nEric Wolff\n\nClinton releasing plan for coal workers? \u2014 Kerry possibly OK with congressional review of climate deal\n\n11/12/15 10:00 AM EST\n\n                                        By \nTim Starks\n\nThe playboy cyber criminals of Brazil \u2014 TVs getting hacked too\n\n11/12/15 10:00 AM EST\n\n                                        By \nDarius Tahir\n\nMore digital health investment (at retail clinics) \u2014 FDA considering DNA tests and sequencing\n\n11/12/15 10:00 AM EST\n\n                                        By \nJenny Hopkinson\n\nIs today the day for FSMA? \u2014 EU set to release glyphosate findings\n\n11/12/15 10:00 AM EST\n\n                                        By \nCaitlin Emma\n\nWorking college students \u2013 Rubio says Clinton \u2018captive\u2019 to unions\n\n11/12/15 10:00 AM EST\n\n                                        By \nBrianna Ehley\n\nColorado's replacement plan? Single payer \u2014 GOP moderates oppose Planned Parenthood defund in reconciliation bill\n\n11/12/15 08:30 AM EST\n\n                                        By \nJeremy Herb\n\nMcCain threatens court battle over Gitmo \u2014 Obama to award Medal of Honor\n\n11/12/15 08:05 AM EST\n\n                                        By \nNick Gass\n\nDonald Trump defended his comment during the debate that increased American wages would hurt U.S. competition in a global market on Thursday, adding that...\n\n11/12/15 08:01 AM EST\nRICK WILEY\u2019s new gig -- B\u2019DAY: Dr. Elena Allbritton\n\n11/12/15 07:59 AM EST\n\n                                        By \nBen White\n\nHappy Glass-Steagall repeal anniversary \u2014 Big day for Fed speak \u2014 More debate grades \u2014 Bush plans big DC fundraiser\n\n11/12/15 07:44 AM EST\n\n                                        By \nNick Gass\n\n\"The President commended her for her tireless efforts and sacrifice over so many years to promote a more inclusive, peaceful, and democratic Burma,\"...\n\n11/12/15 07:32 AM EST\n\n                                        By \nBurgess Everett\n\nBAGLEY SMITH MAKES MOVES\n\n11/12/15 07:30 AM EST\nChicago gun sources, mapped\n\n11/12/15 07:05 AM EST\n\n                                        By \nNick Gass\n\nBernie Sanders snagged a major union endorsement on Thursday.\n\n11/12/15 06:50 AM EST\nSCHNEIDERMAN\u2019s fantasy-site campaign\n\n11/12/15 06:48 AM EST\n\n                                        By \nNick Gass\n\n\"We would do it in a very humane way,\" Trump says of the deportation plan.\n\n11/12/15 06:45 AM EST\nTUNNEL plan\n\n11/12/15 06:40 AM EST\nMASS MOOSE issue\n\n                                        By \n                                                Jacopo Barigazzi\n\n\n                                        By \n                                                Nicholas Vinocur\n\n\n11/12/15 06:32 AM EST\n\n                                        By \nNick Gass\n\nBen Carson blasted ongoing situations at his alma mater, Yale University, and at the University of Missouri.\n\n11/12/15 06:28 AM EST\nRubio v. Cruz.\n\nHealth Care \n\n11/12/15 05:25 AM EST\n\n                                        By \nRachana Pradhan\n\nColorado will vote on the plan long favored by liberals, bringing a big health care fight to the swing state. \n\nHealth Care\n\n11/12/15 05:25 AM EST\n\n                                        By \nJennifer Haberkorn\n                                         and \nSeung Min Kim\n\nLegislative language on Planned Parenthood could imperil another conserative goal.\n\nOpinion\n\n11/12/15 05:23 AM EST\n\n                                        By \n                                                Rich Lowry\n\nThe Texas senator is a severely underrated contender.\n\nHistory Dept.\n\n11/12/15 05:22 AM EST\n\n                                        By \n                                                Jon Meacham\n\nWe know that W. was ready to go it alone in a fight of good vs. evil. Less remembered: His father was, too. \n\nCongress\n\n11/12/15 05:20 AM EST\n\n                                        By \nDarren Goode\n\nTough negotiations have strained friendships, but they have brought Congress close to overhauling a 25-year-old environmental law.\n\n11/12/15 12:00 AM EST\n\n                                        By \nAndrew Glass\n\nThe briefers lauded the policy.\n\nRepublicans\n\n                                        Updated 11/11/15 11:13 PM EST\n\n                                        By \nKenneth P. Vogel\n\nNew details reveal the billionaire brothers' network efforts to reshape the GOP are more ambitious than previously reported.\n\n2016\n\n                                        Updated 11/11/15 10:29 PM EST\n\n                                        By \nEli Stokols\n                                         and \nKatie Glueck\n\nThe two Cuban-American, 40-something, first-term senators are increasingly viewed as the candidates to beat.\n\n                                        Updated 11/11/15 09:09 PM EST\n\n                                        By \nTony Romm\n\nNew York's crackdown on FanDuel and DraftKings could trigger battles nationwide.\n\n2016\n\n11/11/15 08:22 PM EST\n\n                                        By \n                                                Jeff Greenfield\n\nThe other debaters are playing checkers. Cruz is playing chess.\n\n11/11/15 07:49 PM EST\n\n                                        By \n                                                Henry C. Jackson\n\nJeb Bush and Marco Rubio seemed to be the rivalry to watch in the GOP primary. \n\nFourth Estate\n\n11/11/15 07:15 PM EST\n\n                                        By \nJack Shafer\n\nA series of Knockout Rounds could be used in the coming months to breathe some life back into the sagging debate circuit.\n\n11/11/15 07:06 PM EST\n\n                                        By \nAustin Wright\n\nThe dispute comes as the Pentagon prepares to release a report outlining options for closing Guantanamo.\nWe're working on more stories right now\n\n                                                The best of last night's late-night TV: What comes up when you google 'Jeb Bush,' John Kasich was at the debate, and Donald Trump and Vladimir Putin are best buds.\n11/12/15 10:56 AM EST\n\n11/12/15 10:12 AM EST\n\n11/12/15 10:56 AM EST\n\n11/12/15 10:12 AM EST\n\n11/11/15 06:33 PM EST\n\n11/11/15 06:17 PM EST\n\n11/11/15 04:17 PM EST\n\n11/11/15 03:44 PM EST\n\n11/11/15 01:15 PM EST\n\n11/11/15 12:12 PM EST\n \u00a9 2015 POLITICO LLC", "byline": "", "description": "", "title": "Playback: Is Jeb Bush still running for president?", "url": "http://www.politico.com/video/2015/11/playback-is-jeb-bush-still-running-for-president-033100", "topics": ["trade", "campaign_finance"], "people": ["Burgess Everett", "Kenneth P. Vogel", "Henry C. Jackson", "Doug Palmer", "Vladimir Putin", "Jacopo Barigazzi", "Donald Trump", "Austin Wright", "Jenny Hopkinson", "Brian Mahoney", "Darius Tahir", "Brianna Ehley", "Jeff Greenfield", "Rich Lowry", "Katie Glueck", "Nick Gass", "Jack Shafer", "Bernie Becker", "Jeb Bush", "Jennifer Scholtes", "Alex Isenstadt", "Seung Min Kim", "Andrew Glass", "Jeremy Herb", "Marco Rubio", "Jake Sherman", "Darren Goode", "Paul Ryan", "Nicholas Vinocur", "Bernie Sanders", "Tim Starks", "Jason Kander", "Tony Romm", "Jennifer Haberkorn", "Rachana Pradhan", "John Kasich", "Ben White", "Eli Stokols", "Elena Schneider", "Rick Reed", "Eric Wolff", "Ben Carson", "Caitlin Emma"], "orgs": ["Fed", "Congress", "NAFTA", "UFCW", "Yale University", "U.N.", "Medal of Honor", "AT&T", "Pentagon", "GOP", "WTO"], "election_confidence": 0.9990020304528304, "authors": [{"author_id": 31212, "fullname": "alex isenstadt", "primary_org": "politico"}], "date_written": "2015-11-12 15:56:49", "org": "politico", "article_id": "f03c262092404fc0367551a4a28c1050", "date_access": "2015-11-12 17:00:09.448415"}