{"body": "\n11/12/15 06:58 PM EST\n\n                                        By \n                                                Henry C. Jackson\n\nWhile the direction of the questions may be squarely in the hands of debate host CBS News and moderator John Dickerson, each of the candidates has already...\n\n11/12/15 06:53 PM EST\n\n                                        By \nEliza Collins\n\n\u201cTaxes too high, wages too high, we\u2019re not going to be able to compete against the world,\" Trump said. \n\n                                        Updated 11/12/15 06:52 PM EST\n\n                                        By \nNolan D. McCaskill\n\n\u201cThe notion that we\u2019re gonna deport 11, 12 million people from this country \u2014 first of all, I have no idea where Mr. Trump thinks the money\u2019s gonna come...\n\n11/12/15 06:43 PM EST\n\n                                        Updated 11/12/15 06:42 PM EST\n\n                                        By \nDarren Goode\n\nThe plan comes as Clinton and Sanders have both sought an edge with aggressive policies to confront climate change.\n\n2016\n\n11/12/15 06:23 PM EST\n\n                                        By \n                                                Jeff Greenfield\n\nLike the voters they hope to represent, the drug epidemic has touched them too.\n\n11/12/15 06:15 PM EST\n\n                                        By \nEliza Collins\n\nThe move is a surprise, considering how involved Turner has been with the Clintons.\n\n11/12/15 06:14 PM EST\n\n                                        By \nBryan Bender\n\nThe Defense Secretary did not divulge the details of the allegations.\n\n                                        Updated 11/12/15 06:07 PM EST\n\n                                        By \nKevin Robillard\n\nThe ad continues Vitter's recent strategy of confronting his 2007 prostitution scandal.\n\n2016\n\n11/12/15 06:02 PM EST\n\n                                        By \nGabriel Debenedetti\n\nClinton, Sanders and O'Malley will have a national audience Saturday but they'll be narrowcasting to a much smaller group of voters.\n\nCongress\n\n11/12/15 05:51 PM EST\n\n                                        By \nZachary Warmbrodt\n\nRichard Shelby of Alabama, is trying to include the regulatory overhaul in a fiscal 2016 appropriations bill. \n\n                                        Updated 11/12/15 05:47 PM EST\n\n                                        By \nNick Gass\n\nBen Carson blasted ongoing situations at his alma mater, Yale University, and at the University of Missouri.\n\n11/12/15 05:44 PM EST\n\n11/12/15 05:28 PM EST\n\n                                        Updated 11/12/15 05:27 PM EST\n\n                                        By \nDaniel Strauss\n\nPractically the entire GOP field is throwing around accusations, but the fight between the two senators got especially nasty.\n\n11/12/15 05:22 PM EST\n\n11/12/15 05:17 PM EST\n\n11/12/15 04:55 PM EST\n\n                                        By \nJosh Gerstein\n\nA federal judge issued an order Thursday that will sharply ramp up the volume of documents being release in a lawsuit demanding memos and emails from top...\n\n11/12/15 03:59 PM EST\n\n                                        By \nAlex Isenstadt\n\nIt\u2019s the first time that a pro-Christie group has purchased airtime in Iowa.\n\n11/12/15 03:28 PM EST\n\n                                        By \nNahal Toosi\n\nThe exclusion of rebel groups from recent peace talks stirred controversy. \n\n11/12/15 03:10 PM EST\n\n                                        By \nNick Gass\n\n\u201cThere just is no exemption for daily fantasy sports gambling.\"\n\n                                        Updated 11/12/15 02:36 PM EST\n\n                                        By \nEliza Collins\n\nThe two leaders will have \"ample\" time for conversation, a top Obama aide says. \n\n11/12/15 02:31 PM EST\n\n11/12/15 02:10 PM EST\n\n                                        By \nNoah Weiland\n\nThe debate will be broadcast live from Drake University in Des Moines, Iowa. \n\n11/12/15 02:00 PM EST\n\n                                        By \nIsaac Arnsdorf \n\nSugar coalition has Cruz's back \u2014 Koch scoop\n\n11/12/15 01:44 PM EST\n\n                                        By \nSteven Shepard\n                                         and \nElena Schneider\n\nThe rep. is stepping down.\n\n11/12/15 12:40 PM EST\n\n11/12/15 12:39 PM EST\n\n11/12/15 12:31 PM EST\n\n11/12/15 12:10 PM EST\n\n                                        By \nEliza Collins\n\nThe Texas senator and business mogul each have 27 percent of likely Republican voters in the state\n\n11/12/15 11:58 AM EST\n\n                                        By \nAlex Isenstadt\n\nThe controversial businessman may work with Rick Reed, a chief architect of the Swift Boat attack on Kerry.\n\n11/12/15 11:43 AM EST\n\n                                        By \nNolan D. McCaskill\n\nThe former Florida governor is reinventing himself.\n\n                                        Updated 11/12/15 11:21 AM EST\n\n                                        By \nBrian Mahoney\n\nPostal Workers endorse Sanders \u2013 UFCW files NAFTA complaint\n\n                                        Updated 11/12/15 11:11 AM EST\n\n                                        By \nNick Gass\n\n\"You would think that a paper like The Wall Street Journal would call for a clarification,\" Trump says.\n\n                                        Updated 11/12/15 10:59 AM EST\n\n                                        By \nJake Sherman\n\nBig changes are coming from Paul Ryan.\n\n11/12/15 10:56 AM EST\n\n11/12/15 10:12 AM EST\n\n11/12/15 10:08 AM EST\nAIRBNB\u2019S peace offering\n\n11/12/15 10:03 AM EST\n\n                                        By \nElena Schneider\n\nScore Q&A with Jason Kander\n\n11/12/15 10:02 AM EST\n\n                                        By \nJennifer Scholtes\n\nU.N. nations consider plane-tracker agreement \u2014 McCaul sees inside threat as greatest aviation vulnerability \u2014 Outside stakeholders throw down in bus vs....\n\n11/12/15 10:02 AM EST\n\n                                        By \nBernie Becker\n\nThe VAT wars \u2014 Fiorina shoots for three\n\n11/12/15 10:02 AM EST\n\n                                        By \nTony Romm\n\nGoodlatte, McCarthy raise GOP cash in L.A. \u2014 Tech descends on Iowa \u2014 AT&T on spectrum auctions\n\n11/12/15 10:01 AM EST\n\n                                        By \nDoug Palmer\n\nAfghanistan cleared for WTO membership \u2014 Colombia urges talks on illicit trade\n\n11/12/15 10:00 AM EST\n\n                                        By \nEric Wolff\n\nClinton releasing plan for coal workers? \u2014 Kerry possibly OK with congressional review of climate deal\n\n11/12/15 10:00 AM EST\n\n                                        By \nTim Starks\n\nThe playboy cyber criminals of Brazil \u2014 TVs getting hacked too\n\n11/12/15 10:00 AM EST\n\n                                        By \nDarius Tahir\n\nMore digital health investment (at retail clinics) \u2014 FDA considering DNA tests and sequencing\n\n11/12/15 10:00 AM EST\n\n                                        By \nJenny Hopkinson\n\nIs today the day for FSMA? \u2014 EU set to release glyphosate findings\n\n11/12/15 10:00 AM EST\n\n                                        By \nCaitlin Emma\n\nWorking college students \u2013 Rubio says Clinton \u2018captive\u2019 to unions\n\n11/12/15 10:00 AM EST\n\n                                        By \nBrianna Ehley\n\nColorado's replacement plan? Single payer \u2014 GOP moderates oppose Planned Parenthood defund in reconciliation bill\n\n11/12/15 08:30 AM EST\n\n                                        By \nJeremy Herb\n\nMcCain threatens court battle over Gitmo \u2014 Obama to award Medal of Honor\nWe're working on more stories right now\n\n                                            By \n                                                    Jeff Greenfield\n\n\n                                            By \n                                                    Neera Tanden\n\n\n                                            By \n                                                    Rich Lowry\n\n\n                                            By \n                                                    Jeff Greenfield\n\n\n                Getty\n\n            By \nEliza Collins\n\n11/12/15 06:53 PM EST\nDonald Trump on Thursday clarified his comments from Tuesday night's GOP debate about wages being too high, saying the blowback has been misguided.\nThe billionaire businessman was asked during the Fox Business debate about whether he was sympathetic to protesters who have been pushing for the minimum wage to be raised to $15 an hour. \nStory Continued Below\n\u201cI can\u2019t be\u2026and the reason I can\u2019t be is because we are a country that is being beaten on every front,\u201d Trump said on Tuesday night. \u201cTaxes too high, wages too high, we\u2019re not going to be able to compete against the world.\u201d\nBut on Fox News\u2019 \u201cSpecial Report\u201d Thursday he insisted that he never said wages were too high, just that the minimum wage should not increase.\n\nCongress\n\n            By \nZachary Warmbrodt\n\n\u201cI didn\u2019t say that. Bret, we were talking about the minimum wage, and they said \u2018should we increase the minimum wage?\u2019 And I\u2019m saying that if we\u2019re going to compete with other countries we can\u2019t do that because the wages would be too high,\u201d Trump said after host Bret Baier asked him about his comments.\n\u201cI was referring to the minimum wage,\u201d Trump continued. \nThe business mogul said that people say they want to increase the minimum wage because it sounds good politically and even though it\u2019s hard for him to say, he had to stand strong on not raising the minimum wage because \u201cour country is losing businesses.\u201d \n \u00a9 2015 POLITICO LLC", "byline": "", "description": "", "title": "Trump: I never said wages are too high", "url": "http://www.politico.com/story/2015/11/donald-trump-wages-215812", "topics": ["trade"], "people": ["Nick Gass", "Isaac Arnsdorf", "Bret Baier", "Henry C. Jackson", "Elena Schneider", "Richard Shelby", "Steven Shepard", "Jeremy Herb", "Jenny Hopkinson", "Kevin Robillard", "Brian Mahoney", "Caitlin Emma", "Nahal Toosi", "Josh Gerstein", "Gabriel Debenedetti", "Rich Lowry", "Bryan Bender", "Bernie Becker", "John Dickerson", "Jennifer Scholtes", "Neera Tanden", "Noah Weiland", "Alex Isenstadt", "Donald Trump", "Jake Sherman", "Darren Goode", "Jeff Greenfield", "Eric Wolff", "David Vitter", "Tim Starks", "Zachary Warmbrodt", "Jason Kander", "Tony Romm", "Daniel Strauss", "Doug Palmer", "Rick Reed", "Brianna Ehley", "Eliza Collins", "Darius Tahir", "Ben Carson", "Paul Ryan"], "orgs": ["Congress", "Swift Boat", "UFCW", "NAFTA", "Medal of Honor", "U.N.", "Yale University", "Drake University", "AT&T", "GOP", "WTO"], "election_confidence": 0.9693108573969997, "authors": [{"author_id": 34746, "fullname": "henry c. jackson", "primary_org": "politico"}], "date_written": "2015-11-12 23:53:46", "org": "politico", "article_id": "d10300f0090bf3e29b08821da0194d53", "date_access": "2015-11-13 00:00:06.187022"}