{"body": "\n11/17/15 03:32 PM EST\n\n                                        By \nEliza Collins\n\nThomas\u2019 husband is conservative Supreme Court justice Clarence Thomas.\n\n11/17/15 03:20 PM EST\n\n                                        By \nHadas Gold\n\nGawker Media plans to shift the focus of its flagship site Gawker.com to politics, editors at the company announced in memos to staff on Tuesday.\n\n11/17/15 02:44 PM EST\n\n                                        By \nNick Gass\n\nAfter the Paris attacks, the Republican field is taking a tougher stance against the refugees.\n\n11/17/15 02:41 PM EST\n\n11/17/15 02:12 PM EST\n\n                                        By \nBurgess Everett\n\nThe gathering is slated to be held in Baltimore on  Jan. 13 and 14.\n\n                                        Updated 11/17/15 02:01 PM EST\n\n                                        By \nJosh Gerstein\n\nLynch says the Justice Department plans to comply with provisions in the current National Defense Authorization Act.\n\n11/17/15 02:00 PM EST\n\n                                        By \nIsaac Arnsdorf \n\nSpace bill passes, casino bill fails \u2014 Brady fundraiser\n\n11/17/15 01:33 PM EST\n\n                                        By \nNahal Toosi\n\n\"We don\u2019t want to send refugees anywhere where they would not be welcomed,\" one official said.\n\n11/17/15 01:32 PM EST\n\n                                        By \nNick Gass\n\nHis statement differs from a campaign ad released earlier in the day. \n\n11/17/15 12:55 PM EST\n\n                                        By \nKenneth P. Vogel\n\nIn 2014, the main group in the brothers' network raised $126 million and gave out $88 million in grants.\n\n                                        Updated 11/17/15 12:38 PM EST\n\n                                        By \nNick Gass\n\n\"We will not turn our backs on the refugees who are fleeing Syria and Afghanistan. We will do what we do best and that is be Americans.\"\n\n11/17/15 12:33 PM EST\n\n                                        By \nBrian Mahoney\n                                         and \nMarianne LeVine\n\nClinton now has the support of unions representing about 9.5 million union members\n\n11/17/15 12:23 PM EST\n\n                                        By \nEliza Collins\n\n\u201cIn California, you have a Democrat as a governor; in Florida you have Rick Scott so they send them to the Republicans,\u201d Trump said.\n\n11/17/15 11:43 AM EST\n\n                                        By \nLauren French\n\nJohn Podesta will talk to members of the Congressional Black Caucus.\n\n11/17/15 11:31 AM EST\n\n11/17/15 11:29 AM EST\n\n                                        By \nJosh Gerstein\n\n\"I really don\u2019t have a comment on the president\u2019s expression of his view,\" Loretta Lynch said\n\n                                        Updated 11/17/15 11:20 AM EST\n\n                                        By \nNolan D. McCaskill\n\n\u201cNow Obama is sending Syrian refugees to Louisiana,\u201d the narrator says.\n\n                                        Updated 11/17/15 11:14 AM EST\n\n                                        By \nJake Sherman\n\nSpeaker Paul Ryan announced to a closed meeting of Republicans Tuesday morning.\n\n                                        By \nDarren Samuelsohn\n\n\n11/17/15 11:10 AM EST\n\n                                        By \nEliza Collins\n\nRubio has been under fire for his past work on immigration reform,\n\n11/17/15 11:03 AM EST\n\n                                        By \nGabriel Debenedetti\n\nThe events will take the former president to 13 states and Washington, DC between Nov. 17 and Dec. 14.\n\n11/17/15 11:02 AM EST\n\n                                        By \nNick Gass\n\nHollande will visit Washington on Nov. 24, the White House announced Tuesday.\n\n11/17/15 11:00 AM EST\n\nWashington And The World\n\n11/17/15 10:53 AM EST\n\n                                        By \n                                                Jessica Stern\n\nThe more we fight it, the more its appeal grows.\nBudget fight veteran Jim Dyer on what's at stake. \n\n11/17/15 10:06 AM EST\nFEINSTEIN scolds Silicon Valley\n\n11/17/15 10:01 AM EST\n\n                                        By \nBrian Mahoney\n\nIllinois court ponders pensions \u2014 Franchisee jailed for wage theft \n\n11/17/15 10:01 AM EST\n\n                                        By \nAnnie Karni\n\nOnce sure-footed and decisive in expressing his views, the Vermont senator now appears to be holding back on the details of his big-picture ideas.\n\n11/17/15 10:00 AM EST\n\n                                        By \nKate Tummarello\n                                         and \nAlex Byers\n\nParis fallout revives Snowden debate \u2014 Driving The Day: Party of Five, FCC edition\n\n11/17/15 10:00 AM EST\n\n                                        By \nTheodoric Meyer\n\nSyrian refugees become campaign issue\n\n11/17/15 10:00 AM EST\n\n                                        By \nBernie Becker\n\nEurope gives tech a tongue-lashing \u2014 Expensing > interest\n\n11/17/15 10:00 AM EST\n\n                                        By \nJennifer Scholtes\n\nAmtrak victim compensation hangs in the balance \u2014 T-HUD time?\n\n11/17/15 10:00 AM EST\n\n                                        By \nVictoria Guida\n\nHighway conference shifts into gear \u2014 TPP: an origin story\n\n11/17/15 10:00 AM EST\n\n                                        By \nEric Wolff\n\nMoniz chairs IEA meeting in Paris \u2014 Nuclear industry preparing for climate talks\n\n11/17/15 10:00 AM EST\n\n                                        By \nDavid Pittman\n\nComments due on suggestions for moving to MACRA \u2014 CMS releases bundled payment final rule \n\n11/17/15 10:00 AM EST\n\n                                        By \nCaitlin Emma\n\nEducation data insecurity \u2014 College completion rates drop \u2014 Duncan to reflect on time in office\n\n11/17/15 10:00 AM EST\n\n                                        By \nTim Starks\n\nJustice visits cyberspace \u2014 Attorneys general back chip and PIN\n\n11/17/15 10:00 AM EST\n\n                                        By \nBrianna Ehley\n\nSenate HELP considers Califf for FDA chief \u2014 Senate GOP ponders big changes to  reconciliation bill \u2014 CMS scales back bundled payments\n\n11/17/15 10:00 AM EST\n\n                                        By \nJenny Hopkinson\n\nWho will be on top in food policy votes? \u2014 FDA rejects more time on nutrition facts (again)\n\n11/17/15 08:30 AM EST\n\n                                        By \nJeremy Herb\n\nFrance launches new round of airstrikes \u2014 Republican calls grow to halt Syrian refugees to U.S.\n\n11/17/15 08:21 AM EST\nThe GOP-led House moves to block funding for a program that resettles Syrian refugees in the U.S.\n\n                                        By \n                                                Jacopo Barigazzi\n\n\n                                        By \nAlex Spence\n                                         and \n                                                Duncan Gardham\n\n\n11/17/15 08:00 AM EST\n\n                                        By \nBen White\n\nHow 2016 insiders view the economy \u2014 The scene in Iowa \u2014 More on the economic impact of the Paris attacks \u2014 Shutdown threat over refugees?\n\n11/17/15 07:38 AM EST\n\n11/17/15 07:22 AM EST\n\n                                        By \nNick Gass\n\nA presidential campaign against Donald Trump \"would've been fun,\" President Barack Obama said.\n\n11/17/15 07:15 AM EST\n\n                                        By \nMarc Caputo\n\n\n11/17/15 07:03 AM EST\n\n11/17/15 07:00 AM EST\n\n                                        By \nAnnie Karni\n\n\"The last thing you should do is cut their take-home pay right off the bat,\" a Clinton spokesman says. \nWe're working on more stories right now\n\n                                            By \n                                                    Eric Velasco\n\n\n                                            By \n                                                    Patrick Michels\n\n\n                                            By \n                                                    Saundra Amrhein\n\n\n                                            By \n                                                    Debra Bruno\n\n\n                AP Photo\n\n            By \nEliza Collins\n\n11/17/15 03:32 PM EST\nTed Cruz continued his collection of endorsements Tuesday with prominent conservative activist Virginia \u201cGinni\" Thomas.\n\u201cI am looking for the kind of person who will be the leader of the free world,\u201d Thomas said in an endorsement video. \u201cSomeone who has a North Star; someone who is a principled, experienced conservative. And Ted Cruz has got the scars to show he has tangled with the top Republican leaders and Democrats leaders in town\u2026Rhetoric and promise on the campaign trail are not enough.\u201d\nStory Continued Below\nThomas\u2019 husband is conservative Supreme Court Justice Clarence Thomas.\n\u201cWhat\u2019s great about Ted Cruz is we don\u2019t have on the job training problems,\" she says. \nThomas\u2019 endorsement follows Iowa hardliner Steve King\u2019s announcement of support on Monday. \n \u00a9 2015 POLITICO LLC", "byline": "", "description": "", "title": "Conservative activist &quot;Ginni&quot; Thomas endorses Cruz", "url": "http://www.politico.com/story/2015/11/virginia-ginni-thomas-endorses-ted-cruz-215988", "topics": ["economy"], "people": ["Steve King", "Isaac Arnsdorf", "Burgess Everett", "Kenneth P. Vogel", "Kate Tummarello", "Hadas Gold", "Jacopo Barigazzi", "Marc Caputo", "Tim Starks", "Ted Cruz", "Barack Obama", "Debra Bruno", "Jenny Hopkinson", "Brian Mahoney", "Theodoric Meyer", "Nahal Toosi", "Loretta Lynch", "Annie Karni", "Patrick Michels", "Josh Gerstein", "Nick Gass", "Bernie Becker", "Jennifer Scholtes", "Jeremy Herb", "Jake Sherman", "Eliza Collins", "Paul Ryan", "Brianna Ehley", "David Pittman", "Lauren French", "John Podesta", "Gabriel Debenedetti", "Clarence Thomas", "Donald Trump", "Rick Scott", "Saundra Amrhein", "Ben White", "Alex Spence", "Darren Samuelsohn", "Victoria Guida", "Alex Byers", "Eric Wolff", "Ernest Moniz", "Edward Snowden", "Caitlin Emma"], "orgs": ["Washington And The World", "FDA", "National Defense", "Gawker", "Amtrak", "Senate", "Ginni", "Supreme Court", "Justice Department", "FCC", "Congressional Black Caucus", "Senate GOP", "College", "Supreme Court Justice", "CMS", "GOP"], "election_confidence": 0.7843097094999948, "authors": [{"author_id": 32625, "fullname": "eliza collins", "primary_org": "politico"}], "date_written": "2015-11-17 20:32:54", "org": "politico", "article_id": "700a66da61697e8f94a924c33a849279", "date_access": "2015-11-17 20:43:38.888935"}