{"body": "\n11/17/15 11:43 AM EST\n\n                                        By \nLauren French\n\nJohn Podesta will talk to members of the Congressional Black Caucus.\n\n11/17/15 11:31 AM EST\n\n11/17/15 11:29 AM EST\n\n                                        By \nJosh Gerstein\n\n\"I really don\u2019t have a comment on the president\u2019s expression of his view,\" Loretta Lynch said\n\n                                        Updated 11/17/15 11:20 AM EST\n\n                                        By \nNolan D. McCaskill\n\n\u201cNow Obama is sending Syrian refugees to Louisiana,\u201d the narrator says.\n\n                                        Updated 11/17/15 11:14 AM EST\n\n                                        By \nJake Sherman\n\nSpeaker Paul Ryan announced to a closed meeting of Republicans Tuesday morning.\n\n                                        By \nDarren Samuelsohn\n\n\n11/17/15 11:10 AM EST\n\n                                        By \nEliza Collins\n\nRubio has been under fire for his past work on immigration reform,\n\n11/17/15 11:03 AM EST\n\n                                        By \nGabriel Debenedetti\n\nThe events will take the former president to 13 states and Washington, DC between Nov. 17 and Dec. 14.\n\n11/17/15 11:02 AM EST\n\n                                        By \nNick Gass\n\nHollande will visit Washington on Nov. 24, the White House announced Tuesday.\n\n11/17/15 11:00 AM EST\n\nWashington And The World\n\n11/17/15 10:53 AM EST\n\n                                        By \n                                                Jessica Stern\n\nThe more we fight it, the more its appeal grows.\nBudget fight veteran Jim Dyer on what's at stake. \n\n11/17/15 10:06 AM EST\nFEINSTEIN scolds Silicon Valley\n\n11/17/15 10:01 AM EST\n\n                                        By \nBrian Mahoney\n\nIllinois court ponders pensions \u2014 Franchisee jailed for wage theft \n\n11/17/15 10:01 AM EST\n\n                                        By \nAnnie Karni\n\nOnce sure-footed and decisive in expressing his views, the Vermont senator now appears to be holding back on the details of his big-picture ideas.\n\n11/17/15 10:00 AM EST\n\n                                        By \nKate Tummarello\n                                         and \nAlex Byers\n\nParis fallout revives Snowden debate \u2014 Driving The Day: Party of Five, FCC edition\n\n11/17/15 10:00 AM EST\n\n                                        By \nTheodoric Meyer\n\nSyrian refugees become campaign issue\n\n11/17/15 10:00 AM EST\n\n                                        By \nBernie Becker\n\nEurope gives tech a tongue-lashing \u2014 Expensing > interest\n\n11/17/15 10:00 AM EST\n\n                                        By \nJennifer Scholtes\n\nAmtrak victim compensation hangs in the balance \u2014 T-HUD time?\n\n11/17/15 10:00 AM EST\n\n                                        By \nVictoria Guida\n\nHighway conference shifts into gear \u2014 TPP: an origin story\n\n11/17/15 10:00 AM EST\n\n                                        By \nEric Wolff\n\nMoniz chairs IEA meeting in Paris \u2014 Nuclear industry preparing for climate talks\n\n11/17/15 10:00 AM EST\n\n                                        By \nDavid Pittman\n\nComments due on suggestions for moving to MACRA \u2014 CMS releases bundled payment final rule \n\n11/17/15 10:00 AM EST\n\n                                        By \nCaitlin Emma\n\nEducation data insecurity \u2014 College completion rates drop \u2014 Duncan to reflect on time in office\n\n11/17/15 10:00 AM EST\n\n                                        By \nTim Starks\n\nJustice visits cyberspace \u2014 Attorneys general back chip and PIN\n\n11/17/15 10:00 AM EST\n\n                                        By \nBrianna Ehley\n\nSenate HELP considers Califf for FDA chief \u2014 Senate GOP ponders big changes to  reconciliation bill \u2014 CMS scales back bundled payments\n\n11/17/15 10:00 AM EST\n\n                                        By \nJenny Hopkinson\n\nWho will be on top in food policy votes? \u2014 FDA rejects more time on nutrition facts (again)\n\n11/17/15 08:30 AM EST\n\n                                        By \nJeremy Herb\n\nFrance launches new round of airstrikes \u2014 Republican calls grow to halt Syrian refugees to U.S.\n\n11/17/15 08:21 AM EST\nThe GOP-led House moves to block funding for a program that resettles Syrian refugees in the U.S.\n\n                                        By \n                                                Jacopo Barigazzi\n\n\n                                        By \nAlex Spence\n                                         and \n                                                Duncan Gardham\n\n\n11/17/15 08:01 AM EST\n\n                                        By \nNick Gass\n\n\"We will not turn our backs on the refugees who are fleeing Syria and Afghanistan. We will do what we do best and that is be Americans.\"\n\n11/17/15 08:00 AM EST\n\n                                        By \nBen White\n\nHow 2016 insiders view the economy \u2014 The scene in Iowa \u2014 More on the economic impact of the Paris attacks \u2014 Shutdown threat over refugees?\n\n11/17/15 07:38 AM EST\n\n11/17/15 07:22 AM EST\n\n                                        By \nNick Gass\n\nA presidential campaign against Donald Trump \"would've been fun,\" President Barack Obama said.\n\n11/17/15 07:15 AM EST\n\n                                        By \nMarc Caputo\n\n\n11/17/15 07:03 AM EST\n\n11/17/15 07:00 AM EST\n\n                                        By \nAnnie Karni\n\n\"The last thing you should do is cut their take-home pay right off the bat,\" a Clinton spokesman says. \n\n11/17/15 06:51 AM EST\n\n11/17/15 06:28 AM EST\nPutnam\u2019s profitable pals \u2013 Who\u2019s who in Hillary\u2019s FL shop.\n\n11/17/15 05:48 AM EST\nB\u2019DAY: Susan Rice, John Boehner, Howard Dean, Howard Fineman, Paul Lindsay, Lorne Michaels\n\n2016\n\n11/17/15 05:15 AM EST\n\n                                        By \nShane Goldmacher\n\nRubio\u2019s campaign is getting twice the ads for half the price of Bush\u2019s super PAC, undercutting his rival\u2019s cash advantage.\n\n2016\n\n11/17/15 05:14 AM EST\n\n                                        By \nDarren Samuelsohn\n\nPeople close to the former vice president say it's not just to preserve his leverage on climate change. There's more to the story.\n\nCongress\n\n11/17/15 05:13 AM EST\n\n                                        By \nLauren French\n\nLongtime tensions between the Congressional Black Caucus and the Democratic Congressional Campaign Committee appear to be easing.\n\nThe POLITICO Caucus: Economy\n\n11/17/15 05:03 AM EST\n\n                                        By \nBen White\n                                         and \nSteven Shepard\n\nDemocrats overwhelmingly agree income inequality is main issue in primary, while two out of three Republicans point to growth.\n\n11/17/15 05:00 AM EST\n\n11/17/15 12:02 AM EST\n\n                                        By \nAndrew Glass\n\nIt relocated from Philadelphia.\n\n                                        By \n                                                Rosemary Righter\n\nYes, it\u2019s an island. But it\u2019s also better at inter-service teamwork.\n\n                                        Updated 11/16/15 10:58 PM EST\n\n                                        By \nBurgess Everett\n\nThe rivalry between the two Republican senators seeking the presidential nomination continues to grow.\n\n                                        Updated 11/16/15 10:57 PM EST\n\n                                        By \nJosh Gerstein\n                                         and \nKenneth P. Vogel\n\nIt is correcting errors that came to light during Hillary Clinton's campaign.\nWe're working on more stories right now\n\n\n                                            By \n                                                    Sara Solovitch\n\n\n                                            By \n                                                    Jessica Stern\n\n\n                                            By \nMichael Hirsh\n\n\n                                            By \n                                                    Martha Bayles \n                                             and \n                                                    Jeffrey Gedmin\n\n\n                Hillary Clinton, her presidential campaign chairman John Podesta, left, and Deputy Chief of Staff of Senate Minority Leader Harry Reid David McCallum on Capitol Hill. | Getty\n\n            By \nLauren French\n\n11/17/15 11:43 AM EST\nHillary Clinton's top deputy will be on Capitol Hill on Tuesday to continue the campaign's outreach to African-American Democrats. \nJohn Podesta, the chairman of Clinton's presidential campaign, will be at the Democratic National Committee headquarters to discuss their strategy and talk to members of the Congressional Black Caucus.\nStory Continued Below\nThe Clinton campaign has been heavily courting members of the black caucus \u2014 a group that strongly supported her 2008 primary opponent, then-Sen. Barack Obama \u2014 since she first announced her candidacy earlier this year. \nAfrican-American lawmakers have stumped for her on the campaign trail in key early-voting states and in black churches in the South. Clinton also personally hosted a private reception for black lawmakers in September during the Congressional Black Caucus Foundation\u2019s annual gala in Washington.\n \u00a9 2015 POLITICO LLC", "byline": "", "description": "", "title": "Clinton campaign continues outreach to black lawmakers", "url": "http://www.politico.com/story/2015/11/hillary-clinton-cbc-215974", "topics": ["economy", "immigration"], "people": ["Sara Solovitch", "Burgess Everett", "Susan Rice", "Kenneth P. Vogel", "Michael Hirsh", "Kate Tummarello", "Jacopo Barigazzi", "Marc Caputo", "Tim Starks", "Steven Shepard", "Barack Obama", "Jenny Hopkinson", "John Boehner", "Brian Mahoney", "Jeffrey Gedmin", "Howard Dean", "Theodoric Meyer", "Loretta Lynch", "Annie Karni", "Josh Gerstein", "Shane Goldmacher", "Nick Gass", "Bernie Becker", "Jennifer Scholtes", "Andrew Glass", "Jeremy Herb", "Jake Sherman", "Eliza Collins", "Paul Ryan", "Brianna Ehley", "David Pittman", "Lauren French", "John Podesta", "Gabriel Debenedetti", "Donald Trump", "Paul Lindsay", "Howard Fineman", "Hillary Clinton", "Ben White", "Alex Spence", "Darren Samuelsohn", "Victoria Guida", "Alex Byers", "Eric Wolff", "Ernest Moniz", "Edward Snowden", "Caitlin Emma"], "orgs": ["Washington And The World", "FDA", "Congress", "Amtrak", "Senate", "Democratic Congressional Campaign Committee", "PAC", "Congressional Black Caucus Foundation", "Democratic National Committee", "FCC", "College", "Senate GOP", "Congressional Black Caucus", "CMS", "GOP"], "election_confidence": 0.7288609186461441, "authors": [{"author_id": 30729, "fullname": "lauren french", "primary_org": "politico"}], "date_written": "2015-11-17 16:43:26", "org": "politico", "article_id": "c02d4809ebc267cdb7e9b3554369c252", "date_access": "2015-11-17 17:00:06.602881"}