{"body": "\n                                        Updated 11/17/15 05:45 PM EST\n\n                                        By \nJake Sherman\n\nSpeaker Paul Ryan announced to a closed meeting of Republicans Tuesday morning.\n\n11/17/15 05:37 PM EST\n\n                                        By \nHadas Gold\n\n\"For The New York Times to take advantage of an elderly gentleman and use him as their foil in this story is an affront to good journalistic practices.\"\n\n11/17/15 05:34 PM EST\n\n11/17/15 05:33 PM EST\n\n11/17/15 05:28 PM EST\n\n11/17/15 05:23 PM EST\n\n                                        By \n                                                Henry C. Jackson\n\nWith friends like these... \u2014 Clinton's union backing\n\n11/17/15 05:03 PM EST\n\n                                        By \nNolan D. McCaskill\n\nTwo of his advisers told The New York Times in interviews that Carson is having trouble absorbing facts on international affairs.\n\n11/17/15 04:45 PM EST\n\n                                        By \nEli Stokols\n\n\u201cI think they\u2019re doing the right thing because they haven\u2019t gotten any information about what the screening process is,\u201d he said. \n\n                                        Updated 11/17/15 04:44 PM EST\n\n                                        By \nGabriel Debenedetti\n\nThe events will take the former president to 14 states and Washington, DC between Nov. 17 and Dec. 14.\n\n11/17/15 04:31 PM EST\n\n                                        By \nHadas Gold\n                                         and \nJohn Bresnahan\n\n\"I don't answer questions from you because you are not a truthful reporter,\" Labrador said.\n\n11/17/15 04:22 PM EST\n\n11/17/15 04:14 PM EST\n\n                                        By \nEliza Collins\n\n\u201cThere\u2019s something different about what happened from Charlie Hebdo, and I think everybody would feel that,\" he says. \n\n                                        Updated 11/17/15 04:08 PM EST\n\n                                        By \nKevin Robillard\n\nA crowd of 400 packed a private high school, cheering and jeering the candidates throughout the debate.\n\n11/17/15 03:46 PM EST\n\n                                        By \nSeung Min Kim\n\nSenate Republicans' plans to defund Planned Parenthood through reconciliation is still on.\n\n11/17/15 03:32 PM EST\n\n                                        By \nEliza Collins\n\nThomas\u2019 husband is conservative Supreme Court justice Clarence Thomas.\n\n11/17/15 03:20 PM EST\n\n                                        By \nHadas Gold\n\nGawker Media plans to shift the focus of its flagship site Gawker.com to politics, editors at the company announced in memos to staff on Tuesday.\n\n11/17/15 02:44 PM EST\n\n                                        By \nNick Gass\n\nAfter the Paris attacks, the Republican field is taking a tougher stance against the refugees.\n\n11/17/15 02:41 PM EST\n\n11/17/15 02:12 PM EST\n\n                                        By \nBurgess Everett\n\nThe gathering is slated to be held in Baltimore on  Jan. 13 and 14.\n\n                                        Updated 11/17/15 02:01 PM EST\n\n                                        By \nJosh Gerstein\n\nLynch says the Justice Department plans to comply with provisions in the current National Defense Authorization Act.\n\n11/17/15 02:00 PM EST\n\n                                        By \nIsaac Arnsdorf \n\nSpace bill passes, casino bill fails \u2014 Brady fundraiser\n\n11/17/15 01:33 PM EST\n\n                                        By \nNahal Toosi\n\n\"We don\u2019t want to send refugees anywhere where they would not be welcomed,\" one official said.\n\n11/17/15 01:32 PM EST\n\n                                        By \nNick Gass\n\nHis statement differs from a campaign ad released earlier in the day. \n\n11/17/15 12:55 PM EST\n\n                                        By \nKenneth P. Vogel\n\nIn 2014, the main group in the brothers' network raised $126 million and gave out $88 million in grants.\n\n                                        Updated 11/17/15 12:38 PM EST\n\n                                        By \nNick Gass\n\n\"We will not turn our backs on the refugees who are fleeing Syria and Afghanistan. We will do what we do best and that is be Americans.\"\n\n11/17/15 12:33 PM EST\n\n                                        By \nBrian Mahoney\n                                         and \nMarianne LeVine\n\nClinton now has the support of unions representing about 9.5 million union members\n\n11/17/15 12:23 PM EST\n\n                                        By \nEliza Collins\n\n\u201cIn California, you have a Democrat as a governor; in Florida you have Rick Scott so they send them to the Republicans,\u201d Trump said.\n\n11/17/15 11:43 AM EST\n\n                                        By \nLauren French\n\nJohn Podesta will talk to members of the Congressional Black Caucus.\n\n11/17/15 11:31 AM EST\n\n11/17/15 11:29 AM EST\n\n                                        By \nJosh Gerstein\n\n\"I really don\u2019t have a comment on the president\u2019s expression of his view,\" Loretta Lynch said\n\n                                        Updated 11/17/15 11:20 AM EST\n\n                                        By \nNolan D. McCaskill\n\n\u201cNow Obama is sending Syrian refugees to Louisiana,\u201d the narrator says.\n\n                                        By \nDarren Samuelsohn\n\n\n11/17/15 11:10 AM EST\n\n                                        By \nEliza Collins\n\nRubio has been under fire for his past work on immigration reform,\n\n11/17/15 11:02 AM EST\n\n                                        By \nNick Gass\n\nHollande will visit Washington on Nov. 24, the White House announced Tuesday.\n\n11/17/15 11:00 AM EST\n\nWashington And The World\n\n11/17/15 10:53 AM EST\n\n                                        By \n                                                Jessica Stern\n\nThe more we fight it, the more its appeal grows.\nBudget fight veteran Jim Dyer on what's at stake. \n\n11/17/15 10:06 AM EST\nFEINSTEIN scolds Silicon Valley\n\n11/17/15 10:01 AM EST\n\n                                        By \nBrian Mahoney\n\nIllinois court ponders pensions \u2014 Franchisee jailed for wage theft \n\n11/17/15 10:01 AM EST\n\n                                        By \nAnnie Karni\n\nOnce sure-footed and decisive in expressing his views, the Vermont senator now appears to be holding back on the details of his big-picture ideas.\n\n11/17/15 10:00 AM EST\n\n                                        By \nKate Tummarello\n                                         and \nAlex Byers\n\nParis fallout revives Snowden debate \u2014 Driving The Day: Party of Five, FCC edition\n\n11/17/15 10:00 AM EST\n\n                                        By \nTheodoric Meyer\n\nSyrian refugees become campaign issue\n\n11/17/15 10:00 AM EST\n\n                                        By \nBernie Becker\n\nEurope gives tech a tongue-lashing \u2014 Expensing > interest\n\n11/17/15 10:00 AM EST\n\n                                        By \nJennifer Scholtes\n\nAmtrak victim compensation hangs in the balance \u2014 T-HUD time?\n\n11/17/15 10:00 AM EST\n\n                                        By \nVictoria Guida\n\nHighway conference shifts into gear \u2014 TPP: an origin story\n\n11/17/15 10:00 AM EST\n\n                                        By \nEric Wolff\n\nMoniz chairs IEA meeting in Paris \u2014 Nuclear industry preparing for climate talks\n\n11/17/15 10:00 AM EST\n\n                                        By \nDavid Pittman\n\nComments due on suggestions for moving to MACRA \u2014 CMS releases bundled payment final rule \n\n11/17/15 10:00 AM EST\n\n                                        By \nCaitlin Emma\n\nEducation data insecurity \u2014 College completion rates drop \u2014 Duncan to reflect on time in office\n\n11/17/15 10:00 AM EST\n\n                                        By \nTim Starks\n\nJustice visits cyberspace \u2014 Attorneys general back chip and PIN\nWe're working on more stories right now\n\nWhere politics meets the press\n\n                Getty\n\n            By \nHadas Gold\n\n11/17/15 05:37 PM EST\nBen Carson's campaign is claiming The New York Times took \"advantage of an elderly gentleman\" in its bombshell report that some Carson advisers did not think the Republican presidential candidate has a good grasp on foreign policy.\nThe Times based its report partly off of an interview with Duane R. Clarridge, a former CIA agent described as \"a top adviser to Mr. Carson on terrorism and national security.\" Armstrong Williams, Carson's business manager is quoted as describing Clarridge as Carson's \"mentor\" in the piece. \nBut the Carson campaign said in a statement to Business Insider that Clarridge is not the top adviser the Times made him out to be.\n\"Mr. Clarridge has incomplete knowledge of the daily, not weekly briefings, that Dr. Carson receives on important national security matters from former military and State Department officials,\" Carson spokesperson Doug Watts told the site. \"He is coming to the end of a long career of serving our country. Mr. Clarridge's input to Dr. Carson is appreciated but he is clearly not one of Dr. Carson's top advisers. For The New York Times to take advantage of an elderly gentleman and use him as their foil in this story is an affront to good journalistic practices.\"\nA request for comment from the New York Times was not immediately returned. \nHadas Gold is a reporter at\u00a0Politico.\n \u00a9 2015 POLITICO LLC", "byline": "", "description": "&quot;For The New York Times to take advantage of an elderly gentleman and use him as their foil in this story is an affront to good journalistic practices.&quot;", "title": "Carson camp: New York Times took advantage of &apos;elderly gentleman&apos;", "url": "http://www.politico.com/blogs/on-media/2015/11/ben-carson-elderly-gentleman-duane-clarridge-215997", "topics": ["surveillance/privacy", "immigration", "foreign policy/national security"], "people": ["Isaac Arnsdorf", "Burgess Everett", "Kenneth P. Vogel", "Kate Tummarello", "Henry C. Jackson", "Hadas Gold", "Tim Starks", "Kevin Robillard", "Brian Mahoney", "Theodoric Meyer", "Nahal Toosi", "Gabriel Debenedetti", "Annie Karni", "Josh Gerstein", "Nick Gass", "Charlie Hebdo", "Bernie Becker", "Jennifer Scholtes", "Doug Watts", "Armstrong Williams", "Seung Min Kim", "John Bresnahan", "Jake Sherman", "Eliza Collins", "Paul Ryan", "David Pittman", "Lauren French", "John Podesta", "Clarence Thomas", "Rick Scott", "Loretta Lynch", "Ben Carson", "Eli Stokols", "Darren Samuelsohn", "Victoria Guida", "Alex Byers", "Eric Wolff", "Ernest Moniz", "Edward Snowden", "Caitlin Emma"], "orgs": ["Washington And The World", "National Defense", "Gawker", "Amtrak", "Business Insider", "State Department", "Supreme Court", "Parenthood", "Justice Department", "FCC", "Congressional Black Caucus", "College", "CMS", "CIA"], "election_confidence": 0.7974041739522711, "authors": [{"author_id": 31180, "fullname": "jake sherman", "primary_org": "politico"}], "date_written": "2015-11-17 22:37:53", "org": "politico", "article_id": "e911955920cf2f0fa256236bd6f1a94a", "date_access": "2015-11-17 22:47:07.217747"}