{"body": "\n11/17/15 05:48 AM EST\nB\u2019DAY: Susan Rice, John Boehner, Howard Dean, Howard Fineman, Paul Lindsay, Lorne Michaels\n\n2016\n\n11/17/15 05:15 AM EST\n\n                                        By \nShane Goldmacher\n\nRubio\u2019s campaign is getting twice the ads for half the price of Bush\u2019s super PAC, undercutting his rival\u2019s cash advantage.\n\n2016\n\n11/17/15 05:14 AM EST\n\n                                        By \nDarren Samuelsohn\n\nPeople close to the former vice president say it's not just to preserve his leverage on climate change. There's more to the story.\n\nCongress\n\n11/17/15 05:13 AM EST\n\n                                        By \nLauren French\n\nLongtime tensions between the Congressional Black Caucus and the Democratic Congressional Campaign Committee appear to be easing.\n\nThe POLITICO Caucus\n\n11/17/15 05:03 AM EST\n\n                                        By \nBen White\n                                         and \nSteven Shepard\n\nDemocrats overwhelmingly agree income inequality is main issue in primary, while two out of three Republicans point to growth.\n\n11/17/15 05:00 AM EST\n\n11/17/15 12:02 AM EST\n\n                                        By \nAndrew Glass\n\nIt relocated from Philadelphia.\n\n                                        By \n                                                Rosemary Righter\n\nYes, it\u2019s an island. But it\u2019s also better at inter-service teamwork.\n\n                                        Updated 11/16/15 10:58 PM EST\n\n                                        By \nBurgess Everett\n\nThe rivalry between the two Republican senators seeking the presidential nomination continues to grow.\n\n                                        Updated 11/16/15 10:57 PM EST\n\n                                        By \nJosh Gerstein\n                                         and \nKenneth P. Vogel\n\nIt is correcting errors that came to light during Hillary Clinton's campaign.\n\n11/16/15 10:43 PM EST\n\n                                        By \nKenneth P. Vogel\n\nTax filings show biggest reserves in charity's 17-year history.\n\nIn The Arena\n\n11/16/15 10:33 PM EST\n\n                                        By \n                                                Martha Bayles \n                                         and \n                                                Jeffrey Gedmin\n\nThe U.S. needs to develop it's state-sponsored media abroad.\n\n                                        Updated 11/16/15 09:41 PM EST\n\n                                        By \nGabriel Debenedetti\n\nThe Vermont senator suddenly finds himself forced to deviate from an economic message he's been honing for decades.\n\n11/16/15 09:34 PM EST\n\n                                        By \nKevin Robillard\n\nA crowd of 400 packed a private high school, cheering and jeering the candidates throughout the debate.\n\n                                        Updated 11/16/15 09:21 PM EST\n\n                                        By \nAlex Isenstadt\n\nThere is speculation that the Las Vegas Casino mogul could endorse Sen. Marco Rubio.\n\n                                        Updated 11/16/15 09:19 PM EST\n\n                                        By \nLauren French\n\nThe Ohio Republican will remain the group's leader.\n\n11/16/15 08:52 PM EST\n\n                                        By \nLauren French\n\nPaul Ryan had requested the session.\n\n                                        Updated 11/16/15 07:52 PM EST\n\n                                        By \nDavid Perera\n\nFriday\u2019s attacks are reopening the debate on whether intelligence leaks and encryption have made it too easy for terrorists to hide online.\n\n                                        Updated 11/16/15 07:46 PM EST\n\n                                        By \nNahal Toosi\n\n\"It would have been a very, very bad message to cancel the trip and demonstrate that eight thugs with assault weapons can divert the travel itinerary...\n\n                                        Updated 11/16/15 07:40 PM EST\n\n                                        By \nSeung Min Kim\n                                        ,\nJake Sherman\n                                         and \nBurgess Everett\n\nLawmakers say they may try to attach restrictions to a must-pass spending bill, raising the specter of a shutdown battle.\n\n                                        Updated 11/16/15 07:30 PM EST\n\n                                        By \nEliza Collins\n\n\u201cI don\u2019t think orphans under five are being, you know, should be admitted into the United States at this point. But you know, they have no family here....\n\nWhite House \n\n11/16/15 07:20 PM EST\n\n                                        By \nSarah Wheaton\n\nThe president angrily defends his rhetorical restraint on the Paris terrorist attacks.\n\nCongress\n\n11/16/15 07:19 PM EST\n\n                                        By \nBurgess Everett\n\nRepublicans may remove a Planned Parenthood provision if that will help things along.\n\n                                        Updated 11/16/15 07:08 PM EST\n\n                                        By \nNolan D. McCaskill\n\nRepublicans balk at taking refugees while Obama calls for officials to resist the 'dark impulse inside of us.'\n\n11/16/15 06:59 PM EST\n\n                                        By \nGabriel Debenedetti\n\nHe needs to vastly improve his numbers in order to gain delegates coming out of the Iowa caucuses. \n\nFourth Estate\n\n11/16/15 06:51 PM EST\n\n                                        By \nJack Shafer\n\nWhy do we need to keep telling ourselves the plotters are special?\n\n11/16/15 06:43 PM EST\n\n                                        By \nEliza Collins\n\n\u201cA lot of Americans really think back to 2003, and they remember Saddam Hussein and Al Qaeda,\u201d Carson said. \n\n2016\n\n11/16/15 06:23 PM EST\n\n                                        By \nEli Stokols\n\nThe former Florida governor is staking claim as the candidate most ready to take it to Islamic State. But his last name is a liability.\n\n11/16/15 06:09 PM EST\n\n                                        By \n                                                Henry C. Jackson\n\nBush has proven himself at times inept at articulating the daylight between his foreign policy vision and that of the 43rd president. \n\n                                        Updated 11/16/15 06:03 PM EST\n\n                                        By \nJosh Gerstein\n\nThe D.C. Circuit Court of Appeals merely says the government had \"satisified the requirements for a stay pending appeal.\"\n\n2016\n\n                                        Updated 11/16/15 05:32 PM EST\n\n                                        By \nGabriel Debenedetti\n\nThe DNC comes under fire for Saturday's low viewership.\n\n11/16/15 05:13 PM EST\n\n                                        By \nEliza Collins\n\nKatrina Pierson also says it uses \"political correctness as cover.\"\n\nWhite House\n\n                                        Updated 11/16/15 04:16 PM EST\n\n                                        By \nNick Gass\n                                         and \nNahal Toosi\n\n'If there's a good idea out there, then we're going to do it,' Obama says. 'I don't think I've shown a hesitation to act.'\n\n                                        Updated 11/16/15 03:49 PM EST\n\n                                        By \nNahal Toosi\n                                         and \nEliza Collins\n\nThe U.S. secretary of state is visiting the French capital to show solidarity in the wake of the attacks. \n\n11/16/15 03:42 PM EST\n\n                                        By \nDaniel Strauss\n\nThe bill would also institute a 30-day waiting period for citizens of so-called visa waiver countries.\n\n11/16/15 03:42 PM EST\n\n11/16/15 03:34 PM EST\n\n                                        By \nHadas Gold\n\nThe AP sued the State Department in March.\n\n                                        By \nMichael Grunwald\n\nThey\u2019ve got a powerful record to run on. Saturday\u2019s debate is the latest evidence they\u2019re blowing the chance.\n\n                                        Updated 11/16/15 03:04 PM EST\n\n                                        By \nEliza Collins\n                                         and \nNick Gass\n\nThe 2016 GOP contenders race to condemn Obama's reluctance for a rethink after Friday's Paris attacks.\n\n                                        Updated 11/16/15 02:35 PM EST\n\n                                        By \nIsaac Arnsdorf \n\nOSTP's Ghosh to Facebook \u2014 SEC subpoena upheld\n\n11/16/15 02:03 PM EST\n\n                                        By \n                                                Laura Nahmias\n\n\n                                        Updated 11/16/15 01:35 PM EST\n\n                                        By \nEliza Collins\n\nIn a blow to President Barack Obama's strategy with ISIL Sen. Dianne Feinstein broke with him, saying that ISIL is not contained.\n\n11/16/15 01:21 PM EST\n\n11/16/15 01:00 PM EST\n\n11/16/15 12:54 PM EST\n\n                                        By \nNick Gass\n\nMike Huckabee has asked the newly-elected speaker to step up his rhetoric against the \"importation\" of Syrian refugees.\n\n11/16/15 12:44 PM EST\n\n                                        By \nEliza Collins\n\nHillary Clinton \"will be by our side as we break down barriers and finally reach full equality for all,\" says Jim Obergefell. \n\n11/16/15 12:23 PM EST\n\n11/16/15 12:22 PM EST\n\n                                        By \nSeung Min Kim\n\nCapitol Police are urging staffers to keep their office informed of where they are. \n\n11/16/15 12:21 PM EST\nWe're working on more stories right now\n\n                                                POLITICO's Katie Glueck on Sen. Ted Cruz's rise in the polls for president. Video produced by Michael Schwab\n11/17/15 05:00 AM EST\n\n11/16/15 03:42 PM EST\n\n11/17/15 05:00 AM EST\n\n11/16/15 03:42 PM EST\n\n11/16/15 02:03 PM EST\n\n11/16/15 01:21 PM EST\n\n11/16/15 12:23 PM EST\n\n11/16/15 12:21 PM EST\n\n11/16/15 12:14 PM EST\n\n11/16/15 11:10 AM EST\n \u00a9 2015 POLITICO LLC", "byline": "", "description": "", "title": "Cruz on the rise", "url": "http://www.politico.com/video/2015/11/cruz-on-the-rise-033755", "topics": ["foreign policy/national security"], "people": ["Isaac Arnsdorf", "Burgess Everett", "Susan Rice", "Kenneth P. Vogel", "Henry C. Jackson", "Michael Grunwald", "Hadas Gold", "Jeffrey Gedmin", "Ted Cruz", "Steven Shepard", "Jim Obergefell", "Kevin Robillard", "Howard Dean", "John Boehner", "Nahal Toosi", "Josh Gerstein", "Dianne Feinstein", "Gabriel Debenedetti", "Shane Goldmacher", "Nick Gass", "Jack Shafer", "Alex Isenstadt", "Seung Min Kim", "Andrew Glass", "Marco Rubio", "Jake Sherman", "Eliza Collins", "Paul Ryan", "Sarah Wheaton", "Lauren French", "Saddam Hussein", "Paul Lindsay", "Daniel Strauss", "Howard Fineman", "Hillary Clinton", "David Perera", "Ben White", "Eli Stokols", "Mike Huckabee", "Darren Samuelsohn", "Barack Obama", "Katie Glueck", "Laura Nahmias"], "orgs": ["PAC", "DNC", "Congress", "Al Qaeda", "State Department", "Circuit Court of Appeals", "Congressional Black Caucus", "SEC", "ISIL", "Democratic Congressional Campaign Committee", "Capitol Police"], "election_confidence": 0.7083488168996673, "authors": [{"author_id": 39086, "fullname": "shane goldmacher", "primary_org": "politico"}], "date_written": "2015-11-17 10:00:00", "org": "politico", "article_id": "8803bb0c6e291cfc25b5fd5ca45e643b", "date_access": "2015-11-17 11:00:10.976195"}