{"body": "\n11/17/15 01:34 PM EST\n\n                                        By \nJosh Gerstein\n\nAttorney General Loretta Lynch said Tuesday she's unaware of any plan by President Barack Obama to defy laws aimed at prohibiting the transfer of Guantanamo...\n\n11/17/15 01:33 PM EST\n\n                                        By \nNahal Toosi\n\n\"We don\u2019t want to send refugees anywhere where they would not be welcomed,\" one official said.\n\n11/17/15 01:32 PM EST\n\n                                        By \nNick Gass\n\nHis statement differs from a campaign ad released earlier in the day. \n\n11/17/15 12:55 PM EST\n\n                                        By \nKenneth P. Vogel\n\nIn 2014, the main group in the brothers' network raised $126 million and gave out $88 million in grants.\n\n                                        Updated 11/17/15 12:38 PM EST\n\n                                        By \nNick Gass\n\n\"We will not turn our backs on the refugees who are fleeing Syria and Afghanistan. We will do what we do best and that is be Americans.\"\n\n11/17/15 12:33 PM EST\n\n                                        By \nBrian Mahoney\n                                         and \nMarianne LeVine\n\nClinton now has the support of unions representing about 9.5 million union members\n\n11/17/15 12:23 PM EST\n\n                                        By \nEliza Collins\n\n\u201cIn California, you have a Democrat as a governor; in Florida you have Rick Scott so they send them to the Republicans,\u201d Trump said.\n\n11/17/15 11:43 AM EST\n\n                                        By \nLauren French\n\nJohn Podesta will talk to members of the Congressional Black Caucus.\n\n11/17/15 11:31 AM EST\n\n11/17/15 11:29 AM EST\n\n                                        By \nJosh Gerstein\n\n\"I really don\u2019t have a comment on the president\u2019s expression of his view,\" Loretta Lynch said\n\n                                        Updated 11/17/15 11:20 AM EST\n\n                                        By \nNolan D. McCaskill\n\n\u201cNow Obama is sending Syrian refugees to Louisiana,\u201d the narrator says.\n\n                                        Updated 11/17/15 11:14 AM EST\n\n                                        By \nJake Sherman\n\nSpeaker Paul Ryan announced to a closed meeting of Republicans Tuesday morning.\n\n                                        By \nDarren Samuelsohn\n\n\n11/17/15 11:10 AM EST\n\n                                        By \nEliza Collins\n\nRubio has been under fire for his past work on immigration reform,\n\n11/17/15 11:03 AM EST\n\n                                        By \nGabriel Debenedetti\n\nThe events will take the former president to 13 states and Washington, DC between Nov. 17 and Dec. 14.\n\n11/17/15 11:02 AM EST\n\n                                        By \nNick Gass\n\nHollande will visit Washington on Nov. 24, the White House announced Tuesday.\n\n11/17/15 11:00 AM EST\n\nWashington And The World\n\n11/17/15 10:53 AM EST\n\n                                        By \n                                                Jessica Stern\n\nThe more we fight it, the more its appeal grows.\nBudget fight veteran Jim Dyer on what's at stake. \n\n11/17/15 10:06 AM EST\nFEINSTEIN scolds Silicon Valley\n\n11/17/15 10:01 AM EST\n\n                                        By \nBrian Mahoney\n\nIllinois court ponders pensions \u2014 Franchisee jailed for wage theft \n\n11/17/15 10:01 AM EST\n\n                                        By \nAnnie Karni\n\nOnce sure-footed and decisive in expressing his views, the Vermont senator now appears to be holding back on the details of his big-picture ideas.\n\n11/17/15 10:00 AM EST\n\n                                        By \nKate Tummarello\n                                         and \nAlex Byers\n\nParis fallout revives Snowden debate \u2014 Driving The Day: Party of Five, FCC edition\n\n11/17/15 10:00 AM EST\n\n                                        By \nTheodoric Meyer\n\nSyrian refugees become campaign issue\n\n11/17/15 10:00 AM EST\n\n                                        By \nBernie Becker\n\nEurope gives tech a tongue-lashing \u2014 Expensing > interest\n\n11/17/15 10:00 AM EST\n\n                                        By \nJennifer Scholtes\n\nAmtrak victim compensation hangs in the balance \u2014 T-HUD time?\n\n11/17/15 10:00 AM EST\n\n                                        By \nVictoria Guida\n\nHighway conference shifts into gear \u2014 TPP: an origin story\n\n11/17/15 10:00 AM EST\n\n                                        By \nEric Wolff\n\nMoniz chairs IEA meeting in Paris \u2014 Nuclear industry preparing for climate talks\n\n11/17/15 10:00 AM EST\n\n                                        By \nDavid Pittman\n\nComments due on suggestions for moving to MACRA \u2014 CMS releases bundled payment final rule \n\n11/17/15 10:00 AM EST\n\n                                        By \nCaitlin Emma\n\nEducation data insecurity \u2014 College completion rates drop \u2014 Duncan to reflect on time in office\n\n11/17/15 10:00 AM EST\n\n                                        By \nTim Starks\n\nJustice visits cyberspace \u2014 Attorneys general back chip and PIN\n\n11/17/15 10:00 AM EST\n\n                                        By \nBrianna Ehley\n\nSenate HELP considers Califf for FDA chief \u2014 Senate GOP ponders big changes to  reconciliation bill \u2014 CMS scales back bundled payments\n\n11/17/15 10:00 AM EST\n\n                                        By \nJenny Hopkinson\n\nWho will be on top in food policy votes? \u2014 FDA rejects more time on nutrition facts (again)\n\n11/17/15 08:30 AM EST\n\n                                        By \nJeremy Herb\n\nFrance launches new round of airstrikes \u2014 Republican calls grow to halt Syrian refugees to U.S.\n\n11/17/15 08:21 AM EST\nThe GOP-led House moves to block funding for a program that resettles Syrian refugees in the U.S.\n\n                                        By \n                                                Jacopo Barigazzi\n\n\n                                        By \nAlex Spence\n                                         and \n                                                Duncan Gardham\n\n\n11/17/15 08:00 AM EST\n\n                                        By \nBen White\n\nHow 2016 insiders view the economy \u2014 The scene in Iowa \u2014 More on the economic impact of the Paris attacks \u2014 Shutdown threat over refugees?\n\n11/17/15 07:38 AM EST\n\n11/17/15 07:22 AM EST\n\n                                        By \nNick Gass\n\nA presidential campaign against Donald Trump \"would've been fun,\" President Barack Obama said.\n\n11/17/15 07:15 AM EST\n\n                                        By \nMarc Caputo\n\n\n11/17/15 07:03 AM EST\n\n11/17/15 07:00 AM EST\n\n                                        By \nAnnie Karni\n\n\"The last thing you should do is cut their take-home pay right off the bat,\" a Clinton spokesman says. \n\n11/17/15 06:51 AM EST\n\n11/17/15 06:28 AM EST\nPutnam\u2019s profitable pals \u2013 Who\u2019s who in Hillary\u2019s FL shop.\n\n11/17/15 05:48 AM EST\nB\u2019DAY: Susan Rice, John Boehner, Howard Dean, Howard Fineman, Paul Lindsay, Lorne Michaels\n\n2016\n\n11/17/15 05:15 AM EST\n\n                                        By \nShane Goldmacher\n\nRubio\u2019s campaign is getting twice the ads for half the price of Bush\u2019s super PAC, undercutting his rival\u2019s cash advantage.\n\n2016\n\n11/17/15 05:14 AM EST\n\n                                        By \nDarren Samuelsohn\n\nPeople close to the former vice president say it's not just to preserve his leverage on climate change. There's more to the story.\n\nCongress\n\n11/17/15 05:13 AM EST\n\n                                        By \nLauren French\n\nLongtime tensions between the Congressional Black Caucus and the Democratic Congressional Campaign Committee appear to be easing.\nWe're working on more stories right now\n\n                                            By \n                                                    Debra Bruno\n\n\n                                            By \n                                                    Caleb Hannan\n\n\n                                            By \n                                                    Sara Solovitch\n\n\n                                            By \n                                                    Jessica Stern\n\n\n                AP Photo\n\n            By \nNick Gass\n\n11/17/15 01:32 PM EST\nOhio Gov. John Kasich declared on Tuesday that he did not want to inject presidential politics in the fight over the Islamic State in the wake of the Paris attacks because \"these are very serious times.\"\nIn a political ad released by his presidential campaign earlier in the day, however, Kasich is shown speaking at the Florida GOP's Sunshine Summit on Saturday and in a Fox News segment on Sunday explaining how he would respond as president.\nStory Continued Below\nAsked to account for the difference in the ad's tone and his message during a question-and-answer session following a speech laying out his national security policy. Kasich did not appear to know some of the details of the specific video in question.\n\"Isn't that what your campaign is doing by bringing it up now?\" asked Thomas Burr, Salt Lake Tribune's Washington correspondent and National Press Club vice president.\n\u201cI didn\u2019t know they did that, and I don\u2019t know who did it, and I don\u2019t know what\u2019s behind it, but you know, you heard my speech today, and I\u2019m the person that speaks and I\u2019ve said what I\u2019ve had to say including in Florida, including on television on Sunday and including the question that we have here today,\" the governor said.\n \u00a9 2015 POLITICO LLC", "byline": "", "description": "", "title": "Kasich: Now&apos;s not the time to inject 2016 politics into ISIL debate", "url": "http://www.politico.com/story/2015/11/john-kasich-isil-politics-215983", "topics": ["campaign_finance", "immigration", "economy"], "people": ["Sara Solovitch", "Susan Rice", "Kenneth P. Vogel", "Thomas Burr", "Kate Tummarello", "Caleb Hannan", "Jacopo Barigazzi", "Donald Trump", "Tim Starks", "Marc Caputo", "Debra Bruno", "Jenny Hopkinson", "John Boehner", "Brian Mahoney", "Howard Dean", "Theodoric Meyer", "Nahal Toosi", "Josh Gerstein", "Annie Karni", "Loretta Lynch", "Shane Goldmacher", "Nick Gass", "Bernie Becker", "Jennifer Scholtes", "Jeremy Herb", "Jake Sherman", "Eliza Collins", "Paul Ryan", "Eric Wolff", "David Pittman", "Lauren French", "John Podesta", "Gabriel Debenedetti", "Brianna Ehley", "Paul Lindsay", "Howard Fineman", "Rick Scott", "John Kasich", "Ben White", "Alex Spence", "Darren Samuelsohn", "Victoria Guida", "Alex Byers", "Barack Obama", "Ernest Moniz", "Edward Snowden", "Caitlin Emma"], "orgs": ["Washington And The World", "FDA", "Congress", "Amtrak", "Senate", "Democratic Congressional Campaign Committee", "PAC", "FCC", "Congressional Black Caucus", "Senate GOP", "College", "ISIL", "CMS", "GOP"], "election_confidence": 0.7506796102251868, "authors": [{"author_id": 30734, "fullname": "josh gerstein", "primary_org": "politico"}], "date_written": "2015-11-17 18:32:24", "org": "politico", "article_id": "838d88e8e01bed432dd3571a9690b063", "date_access": "2015-11-17 18:42:52.431689"}